id,conversation_id,created_at,date,time,timezone,user_id,username,name,place,tweet,language,mentions,urls,photos,replies_count,retweets_count,likes_count,hashtags,cashtags,link,retweet,quote_url,video,thumbnail,near,geo,source,user_rt_id,user_rt,retweet_id,reply_to,retweet_date,translate,trans_src,trans_dest
1359569330434891778,1359569330434891778,2021-02-10 23:56:02 IST,2021-02-10,23:56:02,+0530,941019422222966784,acreagecannabis,Acreage Holdings,,"#Illinois reported a whopping 94% YoY increase in #cannabis sales. Details @Invest420 here:  https://t.co/AzcX5RnLXL  And if you're in IL, visit our @NaturesCareCo locations in #Chicago and #RollingMeadows.",en,"[{'screen_name': 'invest420', 'name': 'alan brochstein, cfa', 'id': '140149665'}, {'screen_name': 'naturescareco', 'name': ""nature's care"", 'id': '709800191730307072'}]",['https://bit.ly/2NYNSls'],[],0,2,4,"['illinois', 'cannabis', 'chicago', 'rollingmeadows']",[],https://twitter.com/AcreageCannabis/status/1359569330434891778,False,,0,,,,,,,,[],,,,
1359551984802611202,1359551984802611202,2021-02-10 22:47:07 IST,2021-02-10,22:47:07,+0530,941019422222966784,acreagecannabis,Acreage Holdings,,Interested in where our dispensaries are located? Visit our website to see for yourself.  https://t.co/3ag6teRv3S  #AcreageHoldings $ACRG $ACRG.U $ACRGF,en,[],['https://bit.ly/3jmvEWW'],[],0,1,4,['acreageholdings'],"['acrg', 'acrg.u', 'acrgf']",https://twitter.com/AcreageCannabis/status/1359551984802611202,False,,0,,,,,,,,[],,,,
1359209952666152960,1359209952666152960,2021-02-10 00:08:00 IST,2021-02-10,00:08:00,+0530,941019422222966784,acreagecannabis,Acreage Holdings,,"Following his neighbors in #NY, @GovernorTomWolf of #PA announced his intention to attempt adult-use cannabis #legalization via the state budget process. PA, home to our Prime Wellness of PA,  boasts one of the nation's largest #medicalcannabis markets.   https://t.co/3xdxeRj464",en,"[{'screen_name': 'governortomwolf', 'name': 'governor tom wolf', 'id': '2978837542'}]",['https://bit.ly/2O3uT9r'],[],0,2,16,"['ny', 'pa', 'legalization', 'medicalcannabis']",[],https://twitter.com/AcreageCannabis/status/1359209952666152960,False,,0,,,,,,,,[],,,,
1358813688409575428,1358813688409575428,2021-02-08 21:53:23 IST,2021-02-08,21:53:23,+0530,941019422222966784,acreagecannabis,Acreage Holdings,,"Mark your calendars... Acreage will release its Q4 and EOY 2020 financials on Tuesday, 3/9 and host our conference call on the morning of 3/10.  https://t.co/kEIUdsUubU #AcreageHoldings $ACRG $ACRG.U $ACRGF",en,[],['https://bit.ly/3tDyOdp'],[],2,3,7,['acreageholdings'],"['acrg', 'acrg.u', 'acrgf']",https://twitter.com/AcreageCannabis/status/1358813688409575428,False,,0,,,,,,,,[],,,,
1358770515482140672,1358770515482140672,2021-02-08 19:01:50 IST,2021-02-08,19:01:50,+0530,941019422222966784,acreagecannabis,Acreage Holdings,,"We're a proud founding member of the US Cannabis Council, a first-of-its-kind strategic alliance of businesses, associations and advocacy organizations, joining together to work towards cannabis legalization.   More here:  https://t.co/R1FQZreuMk",en,[],['https://bwnews.pr/3jr9brI'],[],0,3,12,[],[],https://twitter.com/AcreageCannabis/status/1358770515482140672,False,,0,,,,,,,,[],,,,
1358474056413155329,1358474056413155329,2021-02-07 23:23:48 IST,2021-02-07,23:23:48,+0530,941019422222966784,acreagecannabis,Acreage Holdings,,"As you watch the big game today, we are throwing it back to our #rejected 2019 Super Bowl ad. We are proud of the un-aired PSA's role in advancing the national conversation around #cannabisreform and are grateful of how far the movement has come since.  https://t.co/n4B2ENSrkg",en,[],['https://bit.ly/3qAIAe0'],[],1,2,11,"['rejected', 'cannabisreform']",[],https://twitter.com/AcreageCannabis/status/1358474056413155329,False,,0,,,,,,,,[],,,,
1358114303849730050,1358114303849730050,2021-02-06 23:34:17 IST,2021-02-06,23:34:17,+0530,941019422222966784,acreagecannabis,Acreage Holdings,,"ICYMI: This week, Senate Majority Leader Chuck Schumer, Senate Finance Committee Chairman Ron Wyden, and Sen. Cory Booker  announced their intention to introduce federal #cannabis reform legislation ""in the early part of this year."" Read more here:  https://t.co/k9YZ5IGF65",en,[],['https://bit.ly/3ahIiSE'],[],0,4,9,['cannabis'],[],https://twitter.com/AcreageCannabis/status/1358114303849730050,False,,0,,,,,,,,[],,,,
1357773489017618433,1357773489017618433,2021-02-06 01:00:00 IST,2021-02-06,01:00:00,+0530,941019422222966784,acreagecannabis,Acreage Holdings,,"After a big year for cannabis legalization in 2020, 2021 could prove to be even bigger.   16 states are considering new #cannabislegalization bills, 9 of which would create new adult-use markets… via @CBTmag. Full story here:  https://t.co/n6U3PNDVeo",en,"[{'screen_name': 'cbtmag', 'name': 'cannabis biz times', 'id': '2552293106'}]",['https://bit.ly/39DHics'],[],3,5,11,['cannabislegalization'],[],https://twitter.com/AcreageCannabis/status/1357773489017618433,False,,0,,,,,,,,[],,,,
1357364542926299137,1357364542926299137,2021-02-04 21:55:00 IST,2021-02-04,21:55:00,+0530,941019422222966784,acreagecannabis,Acreage Holdings,,"Following a pardon from Michigan governor Gretchen Whitmer, Michael Thompson has been released from prison after serving 25 years for a nonviolent cannabis conviction. Learn more about Michael's story here:  https://t.co/xrYnpGfsbV",en,[],['https://www.cnn.com/2021/01/29/us/michael-thompson-michigan-release/index.html'],[],2,7,11,[],[],https://twitter.com/AcreageCannabis/status/1357364542926299137,False,,0,,,,,,,,[],,,,
1357018515182616580,1357018515182616580,2021-02-03 23:00:00 IST,2021-02-03,23:00:00,+0530,941019422222966784,acreagecannabis,Acreage Holdings,,"New Jersey is slated to implement adult-use #cannabis in the coming months.   To prepare for the beginning of adult-use sales, check out the guide to NJ #legalization from @Curbed.  https://t.co/1lTpnBKxUX",en,"[{'screen_name': 'curbed', 'name': 'curbed', 'id': '173996982'}]",['https://bit.ly/3pPlP68'],[],2,0,14,"['cannabis', 'legalization']",[],https://twitter.com/AcreageCannabis/status/1357018515182616580,False,,0,,,,,,,,[],,,,
