id,conversation_id,created_at,date,time,timezone,user_id,username,name,place,tweet,language,mentions,urls,photos,replies_count,retweets_count,likes_count,hashtags,cashtags,link,retweet,quote_url,video,thumbnail,near,geo,source,user_rt_id,user_rt,retweet_id,reply_to,retweet_date,translate,trans_src,trans_dest
1285305791751299073,1285305791751299073,2020-07-21 01:39:15 IST,2020-07-21,01:39:15,+0530,517929053,advicent,NaviPlan by Advicent,,"The ability to open doors and identify selling opportunities in less time is a key advantage for #FinancialAdvisors.  In this whitepaper, learn how innovations in #FinTech help firms accomplish this:  https://t.co/OCtvs8uhLO",en,[],['https://www.advicentsolutions.com/resources/blog/whitepaper-lessons-from-the-data-revolution?utm_source=twitter&utm_medium=social&utm_campaign=technology'],[],0,0,2,"['financialadvisors', 'fintech']",[],https://twitter.com/Advicent/status/1285305791751299073,False,,0,,,,,,,,[],,,,
1283857908829163520,1283857908829163520,2020-07-17 01:45:53 IST,2020-07-17,01:45:53,+0530,517929053,advicent,NaviPlan by Advicent,,"A robust digital experience should not sacrifice engaging advice or lack a personal connection.  In this eBook, learn how #FinancialAdvisors can effectively connect with their clients through digital platforms:  https://t.co/ZgyaA3Gb32",en,[],['https://www.advicentsolutions.com/resources/blog/ebook-going-remote-how-to-guide-for-connecting-with-clients-and-delivering-engaging-advice?utm_source=twitter&utm_medium=social&utm_campaign=practice'],[],0,1,3,['financialadvisors'],[],https://twitter.com/Advicent/status/1283857908829163520,False,,0,,,,,,,,[],,,,
1283134359239827457,1283134359239827457,2020-07-15 01:50:45 IST,2020-07-15,01:50:45,+0530,517929053,advicent,NaviPlan by Advicent,,"Tomorrow starting at 8:15 AM ET, hear from @AngPecoraro and other industry experts on how institutions have navigated the pandemic and how digital engagement in #FinancialServices will continue to evolve.  Register for @AiteGroup's upcoming #WealthManagement roundtable below:",en,"[{'screen_name': 'angpecoraro', 'name': 'angela pecoraro', 'id': '169351249'}, {'screen_name': 'aitegroup', 'name': 'aite group', 'id': '38749545'}]",[],[],0,2,4,"['financialservices', 'wealthmanagement']",[],https://twitter.com/Advicent/status/1283134359239827457,False,,0,,,,,,,,[],,,,
1281657507010813952,1281657507010813952,2020-07-11 00:02:16 IST,2020-07-11,00:02:16,+0530,517929053,advicent,NaviPlan by Advicent,,"Shifting expectations and embracing change with #FinTech are key topics for #FinancialAdvisors today.  In this @JConnellyNYC hosted roundtable, @BurmeisterTom discusses these topics and more with fellow #FinancialPlanning industry experts.  Watch below:   https://t.co/KB4izKs6PS",en,"[{'screen_name': 'jconnellynyc', 'name': 'jconnelly', 'id': '21533716'}, {'screen_name': 'burmeistertom', 'name': 'tom burmeister', 'id': '2992435153'}]",['https://www.advicentsolutions.com/resources/blog/video-tom-burmeister-moderates-jconnelly-financial-planning-roundtable?utm_source=twitter&utm_medium=social&utm_campaign=practice'],[],0,1,6,"['fintech', 'financialadvisors', 'financialplanning']",[],https://twitter.com/Advicent/status/1281657507010813952,False,,0,,,,,,,,[],,,,
1280879416340602881,1280879416340602881,2020-07-08 20:30:25 IST,2020-07-08,20:30:25,+0530,517929053,advicent,NaviPlan by Advicent,,"Next Wednesday, join @AngPecoraro and other #WealthManagement industry experts for @AiteGroup's virtual roundtable discussion on digital innovation and engagement in #FinancialServices.  Register now:",en,"[{'screen_name': 'angpecoraro', 'name': 'angela pecoraro', 'id': '169351249'}, {'screen_name': 'aitegroup', 'name': 'aite group', 'id': '38749545'}]",[],[],0,2,2,"['wealthmanagement', 'financialservices']",[],https://twitter.com/Advicent/status/1280879416340602881,False,,0,,,,,,,,[],,,,
1280209212795166721,1280209212795166721,2020-07-07 00:07:16 IST,2020-07-07,00:07:16,+0530,517929053,advicent,NaviPlan by Advicent,,Incredibly proud to see our friends @Janney1832 named a finalist in FOUR different categories for the @wealth_mgmt 2020 Industry Awards!  See the full list of finalists:  #Wealthies #WMIA20   https://t.co/XfYjsKnGKO,en,"[{'screen_name': 'janney1832', 'name': 'janney montgomery scott llc', 'id': '1449774690'}, {'screen_name': 'wealth_mgmt', 'name': 'wealthmanagement.com', 'id': '90502419'}]",['https://informaconnect.com/wealthmanagementcom-industry-awards/categories-and-criteria/'],[],0,0,1,"['wealthies', 'wmia20']",[],https://twitter.com/Advicent/status/1280209212795166721,False,,0,,,,,,,,[],,,,
1278696178289344519,1278696178289344519,2020-07-02 19:55:00 IST,2020-07-02,19:55:00,+0530,517929053,advicent,NaviPlan by Advicent,,Congratulations to our good friends @UBS and Citi Private Bank for being named winners in this year’s @FT_PWM #WealthTech Awards!  The recognition is a true testament to each firm’s dedication to building an exceptional digital experience.  Learn more:  https://t.co/LRbMx8iZoe,en,"[{'screen_name': 'ubs', 'name': 'ubs', 'id': '38237581'}, {'screen_name': 'ft_pwm', 'name': 'pwm', 'id': '1119837114'}]",['https://pwmwealthtechawards.com/?linkId=92242171#group-GLOBAL-pLjUEihhGq'],[],0,0,1,['wealthtech'],[],https://twitter.com/Advicent/status/1278696178289344519,False,,0,,,,,,,,[],,,,
1278058126793719809,1278058126793719809,2020-07-01 01:39:37 IST,2020-07-01,01:39:37,+0530,517929053,advicent,NaviPlan by Advicent,,"391 days since the SEC introduced #RegBI, the new standards are now effective applying to broker-dealers, RIAs, and dual registrants.  Here's what you need to know as the latest piece of #FinancialServices regulation is implemented:   https://t.co/J2wunsz8P3",en,[],['https://www.advicentsolutions.com/resources/blog/reg-bi-has-arrived-what-to-know-about-the-new-standards?utm_source=twitter&utm_medium=social&utm_campaign=practice'],[],0,0,1,"['regbi', 'financialservices']",[],https://twitter.com/Advicent/status/1278058126793719809,False,,0,,,,,,,,[],,,,
1276586859012001792,1276586859012001792,2020-06-27 00:13:19 IST,2020-06-27,00:13:19,+0530,517929053,advicent,NaviPlan by Advicent,,We are excited to share that NaviPlan by @Advicent has been nominated for best wealth management software in the 2020 @Benzinga Global #FinTech Awards!  Learn more and vote for NaviPlan below:  https://t.co/KPQW1Ijm7b,en,"[{'screen_name': 'advicent', 'name': 'naviplan by advicent', 'id': '517929053'}, {'screen_name': 'benzinga', 'name': 'benzinga', 'id': '44060322'}]",['https://www.advicentsolutions.com/resources/blog/naviplan-by-advicent-nominated-for-2020-benzinga-global-fintech-awards?utm_source=twitter&utm_medium=social&utm_campaign=technology'],[],0,0,1,['fintech'],[],https://twitter.com/Advicent/status/1276586859012001792,False,,0,,,,,,,,[],,,,
1272987557601689601,1272976809685069824,2020-06-17 01:50:59 IST,2020-06-17,01:50:59,+0530,517929053,advicent,NaviPlan by Advicent,,@twentyoverten @wealth_mgmt @advicentcoo And to you @twentyoverten!,en,"[{'screen_name': 'twentyoverten', 'name': 'twenty over ten 💻', 'id': '2179181869'}]",[],[],0,0,2,[],[],https://twitter.com/Advicent/status/1272987557601689601,False,,0,,,,,,,,"[{'screen_name': 'twentyoverten', 'name': 'Twenty Over Ten 💻', 'id': '2179181869'}, {'screen_name': 'wealth_mgmt', 'name': 'WealthManagement.com', 'id': '90502419'}]",,,,
1272976809685069824,1272976809685069824,2020-06-17 01:08:16 IST,2020-06-17,01:08:16,+0530,517929053,advicent,NaviPlan by Advicent,,"We are thrilled to share that @Advicent has been named a finalist for the @wealth_mgmt 2020 Industry Awards for thought leadership, while @advicentcoo is a finalist for Chief Marketing Officer of the Year.  Read more:  #Wealthies #WMIA20   https://t.co/iO6CcgAcg7",en,"[{'screen_name': 'advicent', 'name': 'naviplan by advicent', 'id': '517929053'}, {'screen_name': 'wealth_mgmt', 'name': 'wealthmanagement.com', 'id': '90502419'}]",['https://www.advicentsolutions.com/resources/blog/advicent-announced-as-finalist-for-wealthmanagement-2020-industry-awards?utm_source=twitter&utm_medium=social&utm_campaign=technology'],[],3,2,11,"['wealthies', 'wmia20']",[],https://twitter.com/Advicent/status/1272976809685069824,False,,0,,,,,,,,[],,,,
1271156103527751680,1271156103527751680,2020-06-12 00:33:26 IST,2020-06-12,00:33:26,+0530,517929053,advicent,NaviPlan by Advicent,,"Whether you are video conferencing with an emerging affluent millennial or emailing with a legacy client well into retirement, the right #FinancialPlanning technology should help tailor advice delivery to the audience at hand.  Learn more:  https://t.co/lPLjElWWDA",en,[],['https://www.advicentsolutions.com/resources/blog/maintaining-client-connection-with-digital-tools?utm_source=twitter&utm_medium=social&utm_campaign=technology'],[],0,0,0,['financialplanning'],[],https://twitter.com/Advicent/status/1271156103527751680,False,,0,,,,,,,,[],,,,
1268979337040203781,1268979337040203781,2020-06-06 00:23:45 IST,2020-06-06,00:23:45,+0530,517929053,advicent,NaviPlan by Advicent,,"On the latest episode of the @tacotechs podcast, @advicentcoo joins @TorieHappe and @johnellert to discuss building the NaviPlan brand, Advicent's approach to conferences and parties, and the #FinancialServices trends to watch moving forward.  Listen:  https://t.co/zpoqM7qEtF",en,"[{'screen_name': 'tacotechs', 'name': 'the tacotech podcast 🌮', 'id': '1245044726241222656'}, {'screen_name': 'toriehappe', 'name': 'torie happe', 'id': '727043359'}, {'screen_name': 'johnellert', 'name': 'johnny sandquist', 'id': '69890027'}]",['https://www.advicentsolutions.com/resources/blog/anthony-stich-joins-tacotech-podcast-with-torie-happe-and-johnny-sandquist?utm_source=twitter&utm_medium=social&utm_campaign=technology'],[],1,4,11,['financialservices'],[],https://twitter.com/Advicent/status/1268979337040203781,False,,0,,,,,,,,[],,,,
1268190745221107720,1268190745221107720,2020-06-03 20:10:10 IST,2020-06-03,20:10:10,+0530,517929053,advicent,NaviPlan by Advicent,,".@advicentcoo joined @RetirementRisks' Framework podcast to discuss his entry into #FinancialServices, the robo-advisor disruption, and all things #FinTech and #FinancialPlanning.  Check out the episode and summary article from @CarsonGroupLLC below:  https://t.co/shby2yyfxf",en,"[{'screen_name': 'retirementrisks', 'name': 'jamie hopkins', 'id': '930552205'}, {'screen_name': 'carsongroupllc', 'name': 'carson group', 'id': '821819030411640833'}]",['https://www.carsongroup.com/insights/blog/technology-relationships-and-disruption-with-anthony-stich/'],[],0,2,5,"['financialservices', 'fintech', 'financialplanning']",[],https://twitter.com/Advicent/status/1268190745221107720,False,,0,,,,,,,,[],,,,
1267454963615248388,1267454963615248388,2020-06-01 19:26:26 IST,2020-06-01,19:26:26,+0530,517929053,advicent,NaviPlan by Advicent,,Our most recent update to NaviPlan includes the Recommended Plan tool in the NaviPlan client portal.  Learn more:  https://t.co/8MFb7URNnc,en,[],['https://www.advicentsolutions.com/resources/blog/product-update-naviplan-20-2-release?utm_source=twitter&utm_medium=social&utm_campaign=technology'],[],0,2,3,[],[],https://twitter.com/Advicent/status/1267454963615248388,False,,0,,,,,,,,[],,,,
1266446997701222400,1266446997701222400,2020-05-30 00:41:08 IST,2020-05-30,00:41:08,+0530,517929053,advicent,NaviPlan by Advicent,,"The cost of healthcare expenses is a major concern for many investors, which has only been made worse amid the COVID-19 pandemic.  Learn how #FinancialAdvisors can step in with #FinTech to help ease this anxiety:  https://t.co/rr50JwllG6",en,[],['https://www.advicentsolutions.com/resources/blog/pandemic-is-a-wake-up-call-to-address-health-care-in-financial-plans?utm_source=twitter&utm_medium=social&utm_campaign=scalable'],[],0,0,0,"['financialadvisors', 'fintech']",[],https://twitter.com/Advicent/status/1266446997701222400,False,,0,,,,,,,,[],,,,
1265679671414448130,1265679671414448130,2020-05-27 21:52:03 IST,2020-05-27,21:52:03,+0530,517929053,advicent,NaviPlan by Advicent,,"Begin delivering a seamless digital experience and connect with clients remotely using the NaviPlan client portal, free for advisors through 2021.  Request your free access:  https://t.co/HOSaCcQFc7",en,[],['https://go.advicentsolutions.com/freeportal.html?utm_source=twitter&utm_medium=social&utm_campaign=practice'],[],0,0,0,[],[],https://twitter.com/Advicent/status/1265679671414448130,False,,0,,,,,,,,[],,,,
1263901618233389056,1263901618233389056,2020-05-23 00:06:42 IST,2020-05-23,00:06:42,+0530,517929053,advicent,NaviPlan by Advicent,,"While the need for remote connection has soared during the pandemic, clients have shown a desire for their advisors and advice to be more accessible well before this all began.  In this eBook, learn more on the importance of going remote with #FinTech:  https://t.co/ZgyaA3Gb32",en,[],['https://www.advicentsolutions.com/resources/blog/ebook-going-remote-how-to-guide-for-connecting-with-clients-and-delivering-engaging-advice?utm_source=twitter&utm_medium=social&utm_campaign=practice'],[],0,1,1,['fintech'],[],https://twitter.com/Advicent/status/1263901618233389056,False,,0,,,,,,,,[],,,,
1263527042563399681,1263527042563399681,2020-05-21 23:18:16 IST,2020-05-21,23:18:16,+0530,517929053,advicent,NaviPlan by Advicent,,"With a majority of U.S. individuals having received their payment from the CARES Act, learn how NaviPlan supports this and other changes of the country's largest-ever stimulus package:  https://t.co/7C3vRHliRC",en,[],['https://www.advicentsolutions.com/resources/blog/how-naviplan-supports-the-cares-act?utm_source=twitter&utm_medium=social&utm_campaign=scalable'],[],0,1,0,[],[],https://twitter.com/Advicent/status/1263527042563399681,False,,0,,,,,,,,[],,,,
1260658964640919552,1258109296329572357,2020-05-14 01:21:33 IST,2020-05-14,01:21:33,+0530,517929053,advicent,NaviPlan by Advicent,,Learn more on how NaviPlan helps broker-dealers provide best interest advice by justifying recommendations and documenting compliance efforts:  https://t.co/MmSLAEhTbb,en,[],['https://go.advicentsolutions.com/Regulation-Best-Interest.html?utm_source=twitter&utm_medium=social&utm_campaign=practice'],[],0,0,0,[],[],https://twitter.com/Advicent/status/1260658964640919552,False,,0,,,,,,,,[],,,,
1258488049668931584,1258488049668931584,2020-05-08 01:35:07 IST,2020-05-08,01:35:07,+0530,517929053,advicent,NaviPlan by Advicent,,"In his latest piece on @ThinkAdvisor, @advicentcoo discusses how #FinancialAdvisors can exceed client expectations by understanding the three different types of investors and how to best leverage #FinTech to serve the unique needs of each.  Learn more:  https://t.co/lsTy3jSFAC",en,"[{'screen_name': 'thinkadvisor', 'name': 'thinkadvisor', 'id': '34379992'}]",['https://www.advicentsolutions.com/resources/blog/the-three-types-of-investors-and-how-advisors-can-better-serve-them?utm_source=twitter&utm_medium=social&utm_campaign=practice'],[],0,0,3,"['financialadvisors', 'fintech']",[],https://twitter.com/Advicent/status/1258488049668931584,False,,0,,,,,,,,[],,,,
1258109296329572357,1258109296329572357,2020-05-07 00:30:05 IST,2020-05-07,00:30:05,+0530,517929053,advicent,NaviPlan by Advicent,,"With under two months until the effective date for #RegBI arrives, what is the current status of the lawsuit against the rule, and will COVID-19 have any impact on its implementation?  Learn more in our latest #RegBI recap:  https://t.co/DSrYVqTL8B",en,[],['https://www.advicentsolutions.com/resources/blog/what-to-look-for-as-reg-bi-effective-date-nears?utm_source=twitter&utm_medium=social&utm_campaign=practice'],[],1,1,2,"['regbi', 'regbi']",[],https://twitter.com/Advicent/status/1258109296329572357,False,,0,,,,,,,,[],,,,
1256242831024427009,1256242831024427009,2020-05-01 20:53:25 IST,2020-05-01,20:53:25,+0530,517929053,advicent,NaviPlan by Advicent,,"Times of financial unrest present an excellent opportunity for advisors to show their worth and reiterate the importance of proper, comprehensive #FinancialPlanning.  Learn more on how advisors can demonstrate their value during these times:  https://t.co/mUZ7mqv9oJ",en,[],['https://www.advicentsolutions.com/resources/blog/demonstrating-value-as-a-financial-advisor?utm_source=twitter&utm_medium=social&utm_campaign=practice'],[],0,0,0,['financialplanning'],[],https://twitter.com/Advicent/status/1256242831024427009,False,,0,,,,,,,,[],,,,
1255152805314039808,1255142184564568065,2020-04-28 20:42:03 IST,2020-04-28,20:42:03,+0530,517929053,advicent,NaviPlan by Advicent,,@twentyoverten @ycharts @AdvisorEngine Exciting news @twentyoverten! We are honored to be surrounded by some of the best in #FinTech!,en,"[{'screen_name': 'twentyoverten', 'name': 'twenty over ten 💻', 'id': '2179181869'}]",[],[],0,0,3,['fintech'],[],https://twitter.com/Advicent/status/1255152805314039808,False,,0,,,,,,,,"[{'screen_name': 'twentyoverten', 'name': 'Twenty Over Ten 💻', 'id': '2179181869'}, {'screen_name': 'ycharts', 'name': 'YCharts', 'id': '22869238'}, {'screen_name': 'AdvisorEngine', 'name': 'AdvisorEngine', 'id': '796743624302137344'}]",,,,
1255150015426617346,1255150015426617346,2020-04-28 20:30:57 IST,2020-04-28,20:30:57,+0530,517929053,advicent,NaviPlan by Advicent,,We are excited to share that @Advicent has been named to the 2020 #WealthTech100 list - a collection of the most innovative #FinTech providers in the #WealthManagement industry! Thank you to @Fintech_Global for the honor!  Learn more:  https://t.co/uAuhEoO0JG,en,"[{'screen_name': 'advicent', 'name': 'naviplan by advicent', 'id': '517929053'}, {'screen_name': 'fintech_global', 'name': 'fintech global', 'id': '748148699604357121'}]",['https://www.advicentsolutions.com/resources/press-releases/advicent-named-to-2020-wealthtech100-list?utm_source=twitter&utm_medium=social&utm_campaign=technology'],[],1,1,4,"['wealthtech100', 'fintech', 'wealthmanagement']",[],https://twitter.com/Advicent/status/1255150015426617346,False,,0,,,,,,,,[],,,,
1253720008448004098,1253720008448004098,2020-04-24 21:48:37 IST,2020-04-24,21:48:37,+0530,517929053,advicent,NaviPlan by Advicent,,"Technology is the table stakes in this new era of #FinancialPlanning, one where advisors must embrace innovation to move forward. But how does an advisor begin creating an effective digital strategy at their firm?  Learn more:  https://t.co/mMT7Yvhhyx",en,[],['https://www.advicentsolutions.com/resources/blog/whitepaper-deep-impact?utm_source=twitter&utm_medium=social&utm_campaign=technology'],[],0,1,1,['financialplanning'],[],https://twitter.com/Advicent/status/1253720008448004098,False,,0,,,,,,,,[],,,,
1253026213544804354,1253026213544804354,2020-04-22 23:51:44 IST,2020-04-22,23:51:44,+0530,517929053,advicent,NaviPlan by Advicent,,We are thrilled to share that @Advicent has been named a finalist in the 2020 #WPAwardsCA for Service Provider of the Year! Thank you to @WealthProCA for the honor and recognizing those in the #WealthManagement industry!  Learn more:  https://t.co/n0HrSSnO7F,en,"[{'screen_name': 'advicent', 'name': 'naviplan by advicent', 'id': '517929053'}, {'screen_name': 'wealthproca', 'name': 'wealth professional canada', 'id': '1510635630'}]",['https://advicentsolutions.com/resources/blog/advicent-announced-as-a-finalist-in-2020-wealth-professional-awards-for-service-provider-of-the-year?utm_source=twitter&utm_medium=social&utm_campaign=technology'],[],0,2,3,"['wpawardsca', 'wealthmanagement']",[],https://twitter.com/Advicent/status/1253026213544804354,False,,0,,,,,,,,[],,,,
1250863456712036352,1250863456712036352,2020-04-17 00:37:42 IST,2020-04-17,00:37:42,+0530,517929053,advicent,NaviPlan by Advicent,,"We are proud to announce that @FirstWestCU, Canada's fifth-largest credit union, has integrated the NaviPlan platform for its members and clients across the institution's 51 branches in British Columbia.  Learn more about the partnership:  https://t.co/RtyBZzhCzI",en,"[{'screen_name': 'firstwestcu', 'name': 'first west cu', 'id': '299804338'}]",['https://www.advicentsolutions.com/resources/press-releases/naviplan-adopted-by-first-west-credit-union-strengthening-reach-in-canada'],[],1,4,7,[],[],https://twitter.com/Advicent/status/1250863456712036352,False,,0,,,,,,,,[],,,,
