id,conversation_id,created_at,date,time,timezone,user_id,username,name,place,tweet,language,mentions,urls,photos,replies_count,retweets_count,likes_count,hashtags,cashtags,link,retweet,quote_url,video,thumbnail,near,geo,source,user_rt_id,user_rt,retweet_id,reply_to,retweet_date,translate,trans_src,trans_dest
1385627886988709890,1385602275322781700,2021-04-23 21:43:26 IST,2021-04-23,21:43:26,+0530,18299237,briancalley,Brian Calley,,@AutismAlliance @JulieCalley I could not be more proud to work with the outstanding team at the AAoM!,en,[],[],[],0,0,3,[],[],https://twitter.com/briancalley/status/1385627886988709890,False,,0,,,,,,,,"[{'screen_name': 'AutismAlliance', 'name': 'Autism Alliance MI', 'id': '144491376'}, {'screen_name': 'JulieCalley', 'name': 'Julie Calley', 'id': '609636352'}]",,,,
1384942183501938697,1384939754270175234,2021-04-22 00:18:42 IST,2021-04-22,00:18:42,+0530,18299237,briancalley,Brian Calley,,"@jonathanoosting Dave is a no-nonsense, upstanding, experienced, and thoughtful public servant. Im not at all surprised that he took charge and set things back on a better course.",en,[],[],[],0,0,4,[],[],https://twitter.com/briancalley/status/1384942183501938697,False,,0,,,,,,,,"[{'screen_name': 'jonathanoosting', 'name': 'Jonathan Oosting', 'id': '6798482'}]",,,,
1384913625551458304,1384912329394073602,2021-04-21 22:25:13 IST,2021-04-21,22:25:13,+0530,18299237,briancalley,Brian Calley,,@AndyTJohnston Never mind. I got it. And I love it.,en,[],[],[],0,0,4,[],[],https://twitter.com/briancalley/status/1384913625551458304,False,,0,,,,,,,,"[{'screen_name': 'AndyTJohnston', 'name': 'Andy Johnston', 'id': '115694556'}]",,,,
1384913157483909120,1384912329394073602,2021-04-21 22:23:21 IST,2021-04-21,22:23:21,+0530,18299237,briancalley,Brian Calley,,@AndyTJohnston I don’t know that one either. Please share.,en,[],[],[],1,0,0,[],[],https://twitter.com/briancalley/status/1384913157483909120,False,,0,,,,,,,,"[{'screen_name': 'AndyTJohnston', 'name': 'Andy Johnston', 'id': '115694556'}]",,,,
1384493385076158464,1384488853365563393,2021-04-20 18:35:20 IST,2021-04-20,18:35:20,+0530,18299237,briancalley,Brian Calley,,@ChadLivengood I have no problem with the visit to FL either. I believe we made a point to to PRs on fairly minor things as a de facto notice. It’s not been common for anyone to announce a Governor’s personal travel. Perhaps it should. But I think it was clear when it happened.,en,[],[],[],1,0,2,[],[],https://twitter.com/briancalley/status/1384493385076158464,False,,0,,,,,,,,"[{'screen_name': 'ChadLivengood', 'name': 'Chad Livengood', 'id': '23545095'}]",,,,
1384125813839126529,1384119221886480391,2021-04-19 18:14:44 IST,2021-04-19,18:14:44,+0530,18299237,briancalley,Brian Calley,,"@Tori_Sachs I’m so, so sorry to hear this.",en,[],[],[],0,0,1,[],[],https://twitter.com/briancalley/status/1384125813839126529,False,,0,,,,,,,,"[{'screen_name': 'Tori_Sachs', 'name': 'Tori Sachs', 'id': '218660402'}]",,,,
1383474266037882881,1383474266037882881,2021-04-17 23:05:43 IST,2021-04-17,23:05:43,+0530,18299237,briancalley,Brian Calley,,Really awesome short film on @XavierDeGroat1 and his foundation. He’s already accomplished so much. I have a feeling that the best is yet to come. #autism @XDAFoundation    https://t.co/dWMq63zk2M,en,"[{'screen_name': 'xavierdegroat1', 'name': 'xavier degroat', 'id': '988190819231371266'}, {'screen_name': 'xdafoundation', 'name': 'xavier degroat autism foundation', 'id': '1045479219281756160'}]",['https://youtu.be/aIwLx2EAVAY'],[],2,3,7,['autism'],[],https://twitter.com/briancalley/status/1383474266037882881,False,,0,,,,,,,,[],,,,
1382786141003382785,1382473509952221184,2021-04-16 01:31:21 IST,2021-04-16,01:31:21,+0530,18299237,briancalley,Brian Calley,,"@tacobell Collin is a proud Taco Bell employee in Portland, Michigan.",en,[],[],[],1,0,1,[],[],https://twitter.com/briancalley/status/1382786141003382785,False,,0,,,,,,,,"[{'screen_name': 'tacobell', 'name': 'Taco Bell', 'id': '7831092'}]",,,,
1382666589229756419,1382666589229756419,2021-04-15 17:36:18 IST,2021-04-15,17:36:18,+0530,18299237,briancalley,Brian Calley,,"According to this new study, the particular type of blot clot in question is 10x more likely in people with the virus as compared to those with the vaccines.",en,[],[],[],2,2,15,[],[],https://twitter.com/briancalley/status/1382666589229756419,False,https://twitter.com/CBSThisMorning/status/1382654662902480900,0,,,,,,,,[],,,,
1382533397961129984,1382533397961129984,2021-04-15 08:47:02 IST,2021-04-15,08:47:02,+0530,18299237,briancalley,Brian Calley,,"Many small businesses have a long, difficult road ahead. But two things you can do right now to help...  1) Buy Local 2) Get your vaccine    https://t.co/O2lnOyY37x",en,[],['https://www.fox2detroit.com/video/921566'],[],1,5,29,[],[],https://twitter.com/briancalley/status/1382533397961129984,False,,0,,,,,,,,[],,,,
1382479481017933824,1382473509952221184,2021-04-15 05:12:48 IST,2021-04-15,05:12:48,+0530,18299237,briancalley,Brian Calley,,@CJArndt About this old.  https://t.co/vx79bDkuHN,en,[],[],['https://pbs.twimg.com/tweet_video_thumb/Ey-NwbNXAAcAFO3.jpg'],1,0,4,[],[],https://twitter.com/briancalley/status/1382479481017933824,False,,1,https://pbs.twimg.com/tweet_video_thumb/Ey-NwbNXAAcAFO3.jpg,,,,,,,"[{'screen_name': 'CJArndt', 'name': 'Chris Arndt', 'id': '15986096'}]",,,,
1382475584010326017,1382473509952221184,2021-04-15 04:57:19 IST,2021-04-15,04:57:19,+0530,18299237,briancalley,Brian Calley,,@KeithWellman2 That’s where Julie and I go!,en,[],[],[],1,0,1,[],[],https://twitter.com/briancalley/status/1382475584010326017,False,,0,,,,,,,,"[{'screen_name': 'KeithWellman2', 'name': 'Keith Wellman', 'id': '771507507072303104'}]",,,,
1382473509952221184,1382473509952221184,2021-04-15 04:49:04 IST,2021-04-15,04:49:04,+0530,18299237,briancalley,Brian Calley,,"Like father, like son. My 16 year old son joins the ranks of the vaccinated. Onward to Taco Bell! (his choice)  https://t.co/F6vLUavKqv",en,[],[],['https://pbs.twimg.com/media/Ey-IU70XAAEgALp.jpg'],13,5,360,[],[],https://twitter.com/briancalley/status/1382473509952221184,False,,1,https://pbs.twimg.com/media/Ey-IU70XAAEgALp.jpg,,,,,,,[],,,,
1382421971204456449,1382410778968530948,2021-04-15 01:24:16 IST,2021-04-15,01:24:16,+0530,18299237,briancalley,Brian Calley,,"@NateSilver538 Experts need to be questioned, and they should welcome being questioned and and defending their position - especially from smart people outside the bubble. Keep on doing what you’re doing.",en,[],[],[],0,0,3,[],[],https://twitter.com/briancalley/status/1382421971204456449,False,,0,,,,,,,,"[{'screen_name': 'NateSilver538', 'name': 'Nate Silver', 'id': '16017475'}]",,,,
1382299973824430082,1382294774955270144,2021-04-14 17:19:30 IST,2021-04-14,17:19:30,+0530,18299237,briancalley,Brian Calley,,@rossmanmckinney @MottChildren We’ve walked by the Big Bird many times at @MottChildren on the way to the heart docs. Best wishes! Your strength and resiliency through this trial has been an inspiration.,en,"[{'screen_name': 'mottchildren', 'name': ""c.s. mott children's"", 'id': '574548455'}]",[],[],1,0,5,[],[],https://twitter.com/briancalley/status/1382299973824430082,False,,0,,,,,,,,"[{'screen_name': 'rossmanmckinney', 'name': 'Kelly Rossman-McKinney', 'id': '23489140'}, {'screen_name': 'MottChildren', 'name': ""C.S. Mott Children's"", 'id': '574548455'}]",,,,
1382125188150665218,1382125188150665218,2021-04-14 05:44:58 IST,2021-04-14,05:44:58,+0530,18299237,briancalley,Brian Calley,,A new world record by Michigander Des Linden!,en,[],[],[],0,3,23,[],[],https://twitter.com/briancalley/status/1382125188150665218,False,https://twitter.com/des_linden/status/1382098533621190661,0,,,,,,,,[],,,,
1381997869624856577,1381957411485913092,2021-04-13 21:19:03 IST,2021-04-13,21:19:03,+0530,18299237,briancalley,Brian Calley,,@REALNickDeLeeuw @CJArndt And the connection is only a theory at this point.,en,[],[],[],2,0,2,[],[],https://twitter.com/briancalley/status/1381997869624856577,False,,0,,,,,,,,"[{'screen_name': 'REALNickDeLeeuw', 'name': 'Nick De Leeuw', 'id': '80574154'}, {'screen_name': 'CJArndt', 'name': 'Chris Arndt', 'id': '15986096'}]",,,,
1381994318743924739,1381957411485913092,2021-04-13 21:04:56 IST,2021-04-13,21:04:56,+0530,18299237,briancalley,Brian Calley,,@CJArndt @REALNickDeLeeuw 6 people out of 7 million doses administered so far.,en,[],[],[],1,0,2,[],[],https://twitter.com/briancalley/status/1381994318743924739,False,,0,,,,,,,,"[{'screen_name': 'CJArndt', 'name': 'Chris Arndt', 'id': '15986096'}, {'screen_name': 'REALNickDeLeeuw', 'name': 'Nick De Leeuw', 'id': '80574154'}]",,,,
1381981416678957059,1381981416678957059,2021-04-13 20:13:40 IST,2021-04-13,20:13:40,+0530,18299237,briancalley,Brian Calley,,I can’t imagine a more effective ally of the anti-vaccine movement than the US Federal Government.,en,[],[],[],7,7,19,[],[],https://twitter.com/briancalley/status/1381981416678957059,False,https://twitter.com/RepMeijer/status/1381968816243048456,0,,,,,,,,[],,,,
1381706181085904901,1381702764900847616,2021-04-13 01:59:59 IST,2021-04-13,01:59:59,+0530,18299237,briancalley,Brian Calley,,"@CraigDMauger Anytime you’re over 3% positive, you know you’re missing cases. At 14% or 16%, you’re missing a lot of cases. The fact that we now have 100k fewer tests and only a marginal difference in the percent positive is kind of puzzling. Seems like the % positive would be much higher now.",en,[],[],[],1,0,1,[],[],https://twitter.com/briancalley/status/1381706181085904901,False,,0,,,,,,,,"[{'screen_name': 'CraigDMauger', 'name': 'Craig Mauger', 'id': '158891867'}]",,,,
1381703799698513921,1381702764900847616,2021-04-13 01:50:31 IST,2021-04-13,01:50:31,+0530,18299237,briancalley,Brian Calley,,"@CraigDMauger Generally speaking, the more tests you do, the lower the percentage positive is. So the fact that the fall wave had a lower percent positive peak makes sense because the denominator in the fraction was bigger (more tests).",en,[],[],[],1,0,2,[],[],https://twitter.com/briancalley/status/1381703799698513921,False,,0,,,,,,,,"[{'screen_name': 'CraigDMauger', 'name': 'Craig Mauger', 'id': '158891867'}]",,,,
1381674424915660805,1381670882586791938,2021-04-12 23:53:47 IST,2021-04-12,23:53:47,+0530,18299237,briancalley,Brian Calley,,@MikePleyte The Governor started asking for additional vaccines in late March. There was a very small response to that request initially and then nothing... until the denial.,en,[],[],[],1,0,2,[],[],https://twitter.com/briancalley/status/1381674424915660805,False,,0,,,,,,,,"[{'screen_name': 'MikePleyte', 'name': 'Mike Pleyte', 'id': '564549632'}]",,,,
1381670882586791938,1381670882586791938,2021-04-12 23:39:43 IST,2021-04-12,23:39:43,+0530,18299237,briancalley,Brian Calley,,I’m old enough to remember when they turned Michigan’s vaccine surge request down.,en,[],[],[],3,2,18,[],[],https://twitter.com/briancalley/status/1381670882586791938,False,https://twitter.com/alwilsonDN/status/1381645337153171457,0,,,,,,,,[],,,,
1381597565842493440,1381595633807732738,2021-04-12 18:48:23 IST,2021-04-12,18:48:23,+0530,18299237,briancalley,Brian Calley,,"@rbeggin @CraigDMauger @nannburke People talk a lot about redistricting, but earmarks are one of the most powerful incumbency tools. They are also a powerful way to ensure that members of Congress line up more easily with the larger priorities of their party leadership.",en,[],[],[],2,0,0,[],[],https://twitter.com/briancalley/status/1381597565842493440,False,,0,,,,,,,,"[{'screen_name': 'rbeggin', 'name': 'Riley Beggin', 'id': '172638742'}, {'screen_name': 'CraigDMauger', 'name': 'Craig Mauger', 'id': '158891867'}, {'screen_name': 'nannburke', 'name': 'Melissa Nann Burke', 'id': '21877897'}]",,,,
1381305751189217281,1381305751189217281,2021-04-11 23:28:49 IST,2021-04-11,23:28:49,+0530,18299237,briancalley,Brian Calley,,"This thread appears to suggest that Michigan’s method of sticking with second doses on schedule (rather than going with increased first doses) may be the better long-run approach, especially given the prevalence of the British variant here.",en,[],[],[],1,3,7,[],[],https://twitter.com/briancalley/status/1381305751189217281,False,https://twitter.com/SternLab/status/1380922920734711811,0,,,,,,,,[],,,,
1381006186326151171,1381005914266865669,2021-04-11 03:38:27 IST,2021-04-11,03:38:27,+0530,18299237,briancalley,Brian Calley,,"Not much surprises me, but the POTUS denial of the Governor’s request is very surprising.",en,[],[],[],0,1,3,[],[],https://twitter.com/briancalley/status/1381006186326151171,False,,0,,,,,,,,[],,,,
1381005914266865669,1381005914266865669,2021-04-11 03:37:22 IST,2021-04-11,03:37:22,+0530,18299237,briancalley,Brian Calley,,"“At this point that’s not being deployed, but I am not giving up,” Ms. Whitmer said, describing a call Thursday evening with the president. “Today it’s Michigan and the Midwest. Tomorrow it could be another section of our country.”   https://t.co/yXcyGN1hgN",en,[],['https://www.nytimes.com/2021/04/09/us/politics/johnson-johnson-coronavirus-vaccine.html'],[],2,0,4,[],[],https://twitter.com/briancalley/status/1381005914266865669,False,,0,,,,,,,,[],,,,
1380601874223673344,1380601874223673344,2021-04-10 00:51:51 IST,2021-04-10,00:51:51,+0530,18299237,briancalley,Brian Calley,,"The Governor is right. Variant concentration should be a priority in vaccine distribution. And there is a clear national interest in factoring it in. After all, there is no peeing section in the swimming pool.",en,[],[],[],5,7,43,[],[],https://twitter.com/briancalley/status/1380601874223673344,False,https://twitter.com/jonathanoosting/status/1380599655520735243,0,,,,,,,,[],,,,
1380481011121799170,1380481011121799170,2021-04-09 16:51:35 IST,2021-04-09,16:51:35,+0530,18299237,briancalley,Brian Calley,,Perhaps the most important person in the world today. An extraordinary story about an extraordinary life. And I don’t think we are anywhere near understanding how important her discoveries will be to the future of health and curing disease.   https://t.co/RzYRhJLXnZ,en,[],['https://www.nytimes.com/2021/04/08/health/coronavirus-mrna-kariko.html#click=https://t.co/YgZohwB3Dq'],[],2,8,27,[],[],https://twitter.com/briancalley/status/1380481011121799170,False,,0,,,,,,,,[],,,,
1380345160228278272,1380271588419964928,2021-04-09 07:51:46 IST,2021-04-09,07:51:46,+0530,18299237,briancalley,Brian Calley,,@SumnerHeather French fries on the floor of the car... Reminds me of my mom’s car growing up. She was a saint putting up with me and my siblings.,en,[],[],[],0,0,0,[],[],https://twitter.com/briancalley/status/1380345160228278272,False,,0,,,,,,,,"[{'screen_name': 'SumnerHeather', 'name': 'Sumnerd', 'id': '143158174'}]",,,,
1380325388660977664,1380271588419964928,2021-04-09 06:33:12 IST,2021-04-09,06:33:12,+0530,18299237,briancalley,Brian Calley,,@SumnerHeather Hand washing is always a good idea. So is wiping down commonly touched surfaces. But the “deep cleaning” nonsense is just a lot of wasted energy.,en,[],[],[],1,0,1,[],[],https://twitter.com/briancalley/status/1380325388660977664,False,,0,,,,,,,,"[{'screen_name': 'SumnerHeather', 'name': 'Sumnerd', 'id': '143158174'}]",,,,
1380271588419964928,1380271588419964928,2021-04-09 02:59:25 IST,2021-04-09,02:59:25,+0530,18299237,briancalley,Brian Calley,,"“But the era of “hygiene theater” may have come to an unofficial end this week, when the C.D.C. updated its surface cleaning guidelines and noted that the risk of contracting the virus from touching a contaminated surface was less than 1 in 10,000.”  https://t.co/mE0gMGgLsx",en,[],['https://www.nytimes.com/2021/04/08/health/coronavirus-hygiene-cleaning-surfaces.html?campaign_id=154&emc=edit_cb_20210408&instance_id=29011&nl=coronavirus-briefing&regi_id=94056216&segment_id=55222&te=1&user_id=deda2db004b7a35f473fce3ce548e6ab'],[],2,4,11,[],[],https://twitter.com/briancalley/status/1380271588419964928,False,,0,,,,,,,,[],,,,
1379997763795099654,1379735953808449536,2021-04-08 08:51:20 IST,2021-04-08,08:51:20,+0530,18299237,briancalley,Brian Calley,,"@detroitnews During my years in office, a visit with the Munising News was a must when I was in town.",en,[],[],[],0,0,0,[],[],https://twitter.com/briancalley/status/1379997763795099654,False,,0,,,,,,,,"[{'screen_name': 'detroitnews', 'name': 'The Detroit News', 'id': '16543775'}]",,,,
1379805686205407236,1379729653921943554,2021-04-07 20:08:05 IST,2021-04-07,20:08:05,+0530,18299237,briancalley,Brian Calley,,@glennrstevens Such a wonderful river trail. Great community asset.,en,[],[],[],1,0,0,[],[],https://twitter.com/briancalley/status/1379805686205407236,False,,0,,,,,,,,"[{'screen_name': 'glennrstevens', 'name': 'Glenn Stevens', 'id': '79883392'}]",,,,
1379795114810355720,1379729653921943554,2021-04-07 19:26:05 IST,2021-04-07,19:26:05,+0530,18299237,briancalley,Brian Calley,,"@glennrstevens @freep “Advertised as 95% effective, the vaccine works far better than expected”",en,[],[],[],1,0,4,[],[],https://twitter.com/briancalley/status/1379795114810355720,False,,0,,,,,,,,"[{'screen_name': 'glennrstevens', 'name': 'Glenn Stevens', 'id': '79883392'}, {'screen_name': 'freep', 'name': 'Detroit Free Press', 'id': '8795772'}]",,,,
1379057961750962177,1379057961750962177,2021-04-05 18:36:54 IST,2021-04-05,18:36:54,+0530,18299237,briancalley,Brian Calley,,The two top things you can do to help small businesses make it: 1) Shop Small 2) Get your vaccine,en,[],[],[],0,20,115,[],[],https://twitter.com/briancalley/status/1379057961750962177,False,https://twitter.com/jonathanoosting/status/1379057372447047689,0,,,,,,,,[],,,,
1379055253266518024,1379040180498268160,2021-04-05 18:26:08 IST,2021-04-05,18:26:08,+0530,18299237,briancalley,Brian Calley,,"@ron_fournier @lori4nier This picture is a great example of what I think we lost with camera phones. Endless tries at the perfect shot have crowded out the beautiful, authentic, candid pictures of real life.   Congratulations on your anniversary!",en,[],[],[],1,0,7,[],[],https://twitter.com/briancalley/status/1379055253266518024,False,,0,,,,,,,,"[{'screen_name': 'ron_fournier', 'name': 'Ron Fournier', 'id': '14268812'}, {'screen_name': 'lori4nier', 'name': 'lori', 'id': '2500278163'}]",,,,
1378408740748136449,1378408193777369093,2021-04-03 23:37:08 IST,2021-04-03,23:37:08,+0530,18299237,briancalley,Brian Calley,,"This vaccine is not yet approved in the US. But in France where it is a key part of the vaccine strategy, polling shows 60% of the population has lost faith in the vaccine because of a *potential* 1 in 1 million risk.",en,[],[],[],1,1,0,[],[],https://twitter.com/briancalley/status/1378408740748136449,False,,0,,,,,,,,[],,,,
1378408193777369093,1378408193777369093,2021-04-03 23:34:57 IST,2021-04-03,23:34:57,+0530,18299237,briancalley,Brian Calley,,"Relative risk assessment is a causality.  “We’re in the midst of a global public-health crisis, &amp; regulators must address the possibility (still unproved) that perhaps one in every 1 million vaccinated people could have a potentially fatal drug reaction”   https://t.co/dYJv4kYxG5",en,[],['https://www.theatlantic.com/health/archive/2021/03/astrazeneca-vaccine-blood-clot-issue-wont-go-away/618451/'],[],2,0,1,[],[],https://twitter.com/briancalley/status/1378408193777369093,False,,0,,,,,,,,[],,,,
1378354186262302720,1378163392213581825,2021-04-03 20:00:21 IST,2021-04-03,20:00:21,+0530,18299237,briancalley,Brian Calley,,"@nick_ponton Hate to break it to you, but it was a long time ago.",en,[],[],[],1,0,0,[],[],https://twitter.com/briancalley/status/1378354186262302720,False,,0,,,,,,,,"[{'screen_name': 'nick_ponton', 'name': 'Nick Ponton', 'id': '155466579'}]",,,,
1378347516555591683,1378347516555591683,2021-04-03 19:33:51 IST,2021-04-03,19:33:51,+0530,18299237,briancalley,Brian Calley,,Ish-bi-a! Ish-bi-a!  On this day 21 years ago.  https://t.co/JKGGA9VxWs,en,[],[],['https://pbs.twimg.com/media/EyDfwjCWgAEo5bP.jpg'],1,0,17,[],[],https://twitter.com/briancalley/status/1378347516555591683,False,,1,https://pbs.twimg.com/media/EyDfwjCWgAEo5bP.jpg,,,,,,,[],,,,
1377664495879925761,1377651500789469192,2021-04-01 22:19:46 IST,2021-04-01,22:19:46,+0530,18299237,briancalley,Brian Calley,,"@AdrianHemond @ChadLivengood @JarrettSkorup I could give you good &amp; bad examples of each type of legislature. Bottom line is: good people make for good government, regardless of the system type. And no system can cure bad actors. Full time vs part time is a matter of preference. Either can work well or poorly.",en,[],[],[],1,0,5,[],[],https://twitter.com/briancalley/status/1377664495879925761,False,,0,,,,,,,,"[{'screen_name': 'AdrianHemond', 'name': 'Adrian J Hemond 🦈', 'id': '3871948878'}, {'screen_name': 'ChadLivengood', 'name': 'Chad Livengood', 'id': '23545095'}, {'screen_name': 'JarrettSkorup', 'name': 'Jarrett Skorup', 'id': '802656048'}]",,,,
1377663195846938629,1377663195846938629,2021-04-01 22:14:36 IST,2021-04-01,22:14:36,+0530,18299237,briancalley,Brian Calley,,Yikes. Looks like the fire truck was avoiding another vehicle swerving into its path. Fires are dangerous enough without other drivers failing to yield/pull over.,en,[],[],[],0,0,6,[],[],https://twitter.com/briancalley/status/1377663195846938629,False,https://twitter.com/nightcam/status/1377412408734547968,0,,,,,,,,[],,,,
1377660785481109507,1377632594339188737,2021-04-01 22:05:01 IST,2021-04-01,22:05:01,+0530,18299237,briancalley,Brian Calley,,@michiganstateu @MSUArchives I wonder if those are the same sidewalk lights or replicas.,en,[],[],[],0,0,3,[],[],https://twitter.com/briancalley/status/1377660785481109507,False,,0,,,,,,,,"[{'screen_name': 'michiganstateu', 'name': 'MSU', 'id': '41346792'}, {'screen_name': 'MSUArchives', 'name': 'MSU Archives', 'id': '460442596'}]",,,,
1377656765685317639,1377656765685317639,2021-04-01 21:49:03 IST,2021-04-01,21:49:03,+0530,18299237,briancalley,Brian Calley,,"Many people with disabilities rely on others for transportation &amp; many have difficulty navigating the electronic signup systems. We have to find them &amp; will often need to go to them. Local pharmacies, doctor’s offices, senior orgs, etc. will be key.   https://t.co/md7ph9SJae",en,[],['https://www.crainsdetroit.com/coronavirus/who-are-people-forgotten-push-vaccinate-against-covid-19'],[],0,0,4,[],[],https://twitter.com/briancalley/status/1377656765685317639,False,,0,,,,,,,,[],,,,
1377426920007106560,1377424539236270083,2021-04-01 06:35:43 IST,2021-04-01,06:35:43,+0530,18299237,briancalley,Brian Calley,,@ChadLivengood I’ve had no problems returning cans since late last summer. I better keep my place secret.,en,[],[],[],0,0,0,[],[],https://twitter.com/briancalley/status/1377426920007106560,False,,0,,,,,,,,"[{'screen_name': 'ChadLivengood', 'name': 'Chad Livengood', 'id': '23545095'}]",,,,
1377266797104226307,1376973989558550538,2021-03-31 19:59:27 IST,2021-03-31,19:59:27,+0530,18299237,briancalley,Brian Calley,,"@heyadiana I once ran a half marathon with “Till I Collapse” on loop. 2 hours, one song.",en,[],[],[],1,0,2,[],[],https://twitter.com/briancalley/status/1377266797104226307,False,,0,,,,,,,,"[{'screen_name': 'heyadiana', 'name': 'Diana Hussein', 'id': '23894101'}]",,,,
1377110632852426756,1377110632852426756,2021-03-31 09:38:55 IST,2021-03-31,09:38:55,+0530,18299237,briancalley,Brian Calley,,Watch out for those play-in teams.,en,[],[],[],0,0,3,[],[],https://twitter.com/briancalley/status/1377110632852426756,False,https://twitter.com/marchmadness/status/1377109943300485126,0,,,,,,,,[],,,,
1376201487290929159,1376201487290929159,2021-03-28 21:26:17 IST,2021-03-28,21:26:17,+0530,18299237,briancalley,Brian Calley,,"Having strong, talented, dedicated, and passionate board members is a key factor in top performing organizations. And they don’t come any better than @ron_fournier.",en,"[{'screen_name': 'ron_fournier', 'name': 'ron fournier', 'id': '14268812'}]",[],[],1,0,23,[],[],https://twitter.com/briancalley/status/1376201487290929159,False,https://twitter.com/ron_fournier/status/1376197803215585285,0,,,,,,,,[],,,,
1376192330617790468,1375985372925157378,2021-03-28 20:49:54 IST,2021-03-28,20:49:54,+0530,18299237,briancalley,Brian Calley,,"@PeterSpadafore In the Spring and Fall of 2020, Michigan experienced waves that foretold increases more broadly. For unknown reasons we appear to be early each time, not unique, in case increase trends.  2021 has new dynamic factors (vaccines &amp; variants). Hopefully the former blunts the latter.",en,[],[],[],1,0,0,[],[],https://twitter.com/briancalley/status/1376192330617790468,False,,0,,,,,,,,"[{'screen_name': 'PeterSpadafore', 'name': 'Peter Spadafore', 'id': '15078634'}]",,,,
1376175491774869504,1376175491774869504,2021-03-28 19:43:00 IST,2021-03-28,19:43:00,+0530,18299237,briancalley,Brian Calley,,"Community pharmacies could play a much larger and more important role than they are today. They know their patients and their patients trust them.   I understand the logistical challenges, but these small businesses will be key to reaching herd immunity.    https://t.co/7KpjHQd35D",en,[],['https://www.crainsdetroit.com/health-care/community-pharmacies-see-opportunity-challenges-covid-19-vaccine-rollout'],[],0,1,3,[],[],https://twitter.com/briancalley/status/1376175491774869504,False,,0,,,,,,,,[],,,,
1376002287437500419,1376002287437500419,2021-03-28 08:14:44 IST,2021-03-28,08:14:44,+0530,18299237,briancalley,Brian Calley,,"And Minnesota brags about having 10,000. Pft.   Plus, four out of five Great Lakes prefer Michigan.",en,[],[],[],3,5,65,[],[],https://twitter.com/briancalley/status/1376002287437500419,False,https://twitter.com/PureMichigan/status/1375930687702859784,0,,,,,,,,[],,,,
