id,conversation_id,created_at,date,time,timezone,user_id,username,name,place,tweet,language,mentions,urls,photos,replies_count,retweets_count,likes_count,hashtags,cashtags,link,retweet,quote_url,video,thumbnail,near,geo,source,user_rt_id,user_rt,retweet_id,reply_to,retweet_date,translate,trans_src,trans_dest
984844887651528704,984844886577897473,2018-04-13 22:54:53 IST,2018-04-13,22:54:53,+0530,383817609,burnsjunction,Andy Williams,,(Reminds me of my own cannabis wedding that I wrote about in @Leafly last October. Check it out:  https://t.co/z55oX1fnLJ)  https://t.co/eyg3GMtwsj,en,"[{'screen_name': 'leafly', 'name': 'leafly', 'id': '147821538'}]",['http://bit.ly/2FhpAuK'],['https://pbs.twimg.com/media/DarfEw4VMAAe5Ui.jpg'],0,0,0,[],[],https://twitter.com/BurnsJunction/status/984844887651528704,False,,1,https://pbs.twimg.com/media/DarfEw4VMAAe5Ui.jpg,,,,,,,[],,,,
984844886577897473,984844886577897473,2018-04-13 22:54:53 IST,2018-04-13,22:54:53,+0530,383817609,burnsjunction,Andy Williams,,"Keep this in mind for your upcoming nuptials: @BuzzFeed declares “weed weddings are here to stay, people.”   https://t.co/zncw9Iu1Bn",en,"[{'screen_name': 'buzzfeed', 'name': 'buzzfeed', 'id': '5695632'}]",['https://bzfd.it/2GUNbp7'],[],1,0,0,[],[],https://twitter.com/BurnsJunction/status/984844886577897473,False,,0,,,,,,,,[],,,,
984499514202505216,984499514202505216,2018-04-13 00:02:29 IST,2018-04-13,00:02:29,+0530,383817609,burnsjunction,Andy Williams,,"I’d rather see politicians take a positive stance about cannabis when they have the power to enact change, rather than when it benefits them financially. What do you think? Via: @CNN  https://t.co/nsTGVbNTL9  https://t.co/gZ71oU1mEL",en,"[{'screen_name': 'cnn', 'name': 'cnn', 'id': '759251'}]",['https://cnn.it/2HdRKKz'],['https://pbs.twimg.com/media/DamlBf_UwAA4BRo.jpg'],3,1,2,[],[],https://twitter.com/BurnsJunction/status/984499514202505216,False,,1,https://pbs.twimg.com/media/DamlBf_UwAA4BRo.jpg,,,,,,,[],,,,
984106594916028416,984106594916028416,2018-04-11 22:01:10 IST,2018-04-11,22:01:10,+0530,383817609,burnsjunction,Andy Williams,,"“The cannabis industry continues to prove that it has what it takes to breathe new life into towns ravaged by the fall of better times.” — @Forbes contributor @mikeadams73, on a new report about a phoenix-like revival in Pueblo, Colo., thanks to cannabis.  https://t.co/0zPkAyaApN  https://t.co/lt0SkO34w0",en,"[{'screen_name': 'forbes', 'name': 'forbes', 'id': '91478624'}, {'screen_name': 'mikeadams73', 'name': 'mike adams 🌀', 'id': '46612419'}]",['http://bit.ly/2JDvQyO'],['https://pbs.twimg.com/media/Dag_u3bW0AUGoUP.jpg'],0,1,3,[],[],https://twitter.com/BurnsJunction/status/984106594916028416,False,,1,https://pbs.twimg.com/media/Dag_u3bW0AUGoUP.jpg,,,,,,,[],,,,
983768922347388929,983768922347388929,2018-04-10 23:39:23 IST,2018-04-10,23:39:23,+0530,383817609,burnsjunction,Andy Williams,,"The Trump administration is seeking input from “interested persons” on whether cannabis should be reclassified from Schedule 1. Rescheduling could open doors to further research, and law reform in areas such as banking so the industry can thrive.  https://t.co/BtdojyN6t0  https://t.co/pP79xh6fWp",en,[],['http://bit.ly/2JC1hJB'],['https://pbs.twimg.com/media/DacMj-uU8AA7fuB.png'],0,1,1,[],[],https://twitter.com/BurnsJunction/status/983768922347388929,False,,1,https://pbs.twimg.com/media/DacMj-uU8AA7fuB.png,,,,,,,[],,,,
983384316192481281,983384316192481281,2018-04-09 22:11:06 IST,2018-04-09,22:11:06,+0530,383817609,burnsjunction,Andy Williams,,Can cannabis cure cancer? It’s been proven to treat symptoms and even inhibit or kill cancer cells in mice; but two major things stand in the way for proving its power in human trials: money and politics. Via: @Herbworthy  https://t.co/Q7beYK5IeK,en,"[{'screen_name': 'herbworthy', 'name': 'herb', 'id': '2268074444'}]",['http://bit.ly/2GN0tQc'],[],0,1,1,[],[],https://twitter.com/BurnsJunction/status/983384316192481281,False,,0,,,,,,,,[],,,,
982293343651618819,982293343651618819,2018-04-06 21:55:57 IST,2018-04-06,21:55:57,+0530,383817609,burnsjunction,Andy Williams,,"When that pesky pothole on your street is repaved this year, you can thank Colorado cannabis. Part of the revenue from cannabis taxes goes to schools, industry regulation and law enforcement, but this $1.2M is coming from the General Fund.  https://t.co/elxStA7vQc  https://t.co/a68khWnYzi",en,[],['http://bit.ly/2Ep1dJx'],['https://pbs.twimg.com/media/DaHOhv6V4AEUQCl.jpg'],0,0,0,[],[],https://twitter.com/BurnsJunction/status/982293343651618819,False,,1,https://pbs.twimg.com/media/DaHOhv6V4AEUQCl.jpg,,,,,,,[],,,,
981958783629836288,981958783629836288,2018-04-05 23:46:32 IST,2018-04-05,23:46:32,+0530,383817609,burnsjunction,Andy Williams,,"People often ask me how to maintain relationships with employees as a company grows. Building trust doesn't take much time, just a new perspective. Some inspiring examples of leaders showing they care via @TEDRadioHour &amp; @NPR:   https://t.co/bySGg7ERht  https://t.co/U6CjNyoOTI",en,"[{'screen_name': 'tedradiohour', 'name': 'ted radio hour', 'id': '555198400'}, {'screen_name': 'npr', 'name': 'npr', 'id': '5392522'}]",['https://n.pr/2q7ZnZg'],['https://pbs.twimg.com/media/DaCeQAdU8AAcwe2.jpg'],0,0,1,[],[],https://twitter.com/BurnsJunction/status/981958783629836288,False,,1,https://pbs.twimg.com/media/DaCeQAdU8AAcwe2.jpg,,,,,,,[],,,,
981567798500577280,981567798500577280,2018-04-04 21:52:54 IST,2018-04-04,21:52:54,+0530,383817609,burnsjunction,Andy Williams,,"If you missed last week’s 2017 Report conference call, check out this report with highlights from @MedicineManTech’s ($MDCL) incredible year of growth. Get on the Medicine Man email distro list by emailing MDCL@kcsa.com with ""MDCL"" in the subject.  https://t.co/78PIqD35qT",en,"[{'screen_name': 'medicinemantech', 'name': 'medicine man tech', 'id': '2657808960'}]",['http://bit.ly/2q5jFTa'],[],0,0,1,[],[],https://twitter.com/BurnsJunction/status/981567798500577280,False,,0,,,,,,,,[],,,,
981223835155361792,981223835155361792,2018-04-03 23:06:07 IST,2018-04-03,23:06:07,+0530,383817609,burnsjunction,Andy Williams,,"This April 20th, I’ll be celebrating how far cannabis has come in Colorado. Join me for games, vendors, fun people and great deals at your favorite @MedicineManDen location: Denver, Aurora or Thornton.  https://t.co/O9LaNG2TGx  https://t.co/JjnnbN5wbN",en,"[{'screen_name': 'medicinemanden', 'name': 'medicine man', 'id': '216150349'}]",['http://bit.ly/2Jg70Vp'],['https://pbs.twimg.com/media/DZ4BzkEVMAA-bop.jpg'],0,1,2,[],[],https://twitter.com/BurnsJunction/status/981223835155361792,False,,1,https://pbs.twimg.com/media/DZ4BzkEVMAA-bop.jpg,,,,,,,[],,,,
980850972292366341,980850972292366341,2018-04-02 22:24:29 IST,2018-04-02,22:24:29,+0530,383817609,burnsjunction,Andy Williams,,"Check out Colorado LEADS, a Coalition of Cannabis Business Leaders. A great resource for legislation, medical research and politics on cannabis in Colorado. Here's my quote they posted on why HB 1011 is important to all of Colorado, not just cannabis.  https://t.co/7lWMUrBNgt  https://t.co/HtwVLD93Ra",en,[],['http://bit.ly/2JdArYf'],['https://pbs.twimg.com/media/DZyuMo-V4AAQgRt.jpg'],0,1,2,[],[],https://twitter.com/BurnsJunction/status/980850972292366341,False,,1,https://pbs.twimg.com/media/DZyuMo-V4AAQgRt.jpg,,,,,,,[],,,,
979762664481079297,979762664481079297,2018-03-30 22:19:56 IST,2018-03-30,22:19:56,+0530,383817609,burnsjunction,Andy Williams,,"It may be spring break for some of you, but if you want to study up on how to grow 25 pounds of (legal) cannabis per day, check this out.  https://t.co/O82xMWHpHR  https://t.co/dC5CEG95fu",en,[],['https://youtu.be/9hZTfNgf8vw'],['https://pbs.twimg.com/media/DZjQtapU0AAX-Jw.jpg'],0,0,0,[],[],https://twitter.com/BurnsJunction/status/979762664481079297,False,,1,https://pbs.twimg.com/media/DZjQtapU0AAX-Jw.jpg,,,,,,,[],,,,
979419551833112577,979419551833112577,2018-03-29 23:36:32 IST,2018-03-29,23:36:32,+0530,383817609,burnsjunction,Andy Williams,,"Medical marijuana is protected again, until September, at least. But what I’d really like to see is a permanent legislative change that protects the entire cannabis industry, bringing billions of dollars into the national economy.  https://t.co/52TrJF7h7F  https://t.co/viQh3y46EM",en,[],['http://bit.ly/2IT8x3i'],['https://pbs.twimg.com/media/DZeYwG0VoAApQic.jpg'],0,0,2,[],[],https://twitter.com/BurnsJunction/status/979419551833112577,False,,1,https://pbs.twimg.com/media/DZeYwG0VoAApQic.jpg,,,,,,,[],,,,
979022017092452353,979022017092452353,2018-03-28 21:16:52 IST,2018-03-28,21:16:52,+0530,383817609,burnsjunction,Andy Williams,,"Regardless of how feasible these jobs might be, they point out that there are a myriad of unique ways to make a living. Wealth isn’t determined by money; it’s determined by the love in your life, and what you do everyday.  https://t.co/XAeLdfXdLh #WednesdayWisdom  https://t.co/fihSDxzZOX",en,[],['http://bit.ly/2GxT6Q1'],['https://pbs.twimg.com/media/DZYvMf9VAAAAFaS.jpg'],0,1,3,['wednesdaywisdom'],[],https://twitter.com/BurnsJunction/status/979022017092452353,False,,1,https://pbs.twimg.com/media/DZYvMf9VAAAAFaS.jpg,,,,,,,[],,,,
978655447606484993,978655447606484993,2018-03-27 21:00:15 IST,2018-03-27,21:00:15,+0530,383817609,burnsjunction,Andy Williams,,@MedicineManTech ($MDCL) CEO and co-founder Brett Roper will hold a conference call tomorrow at 9 a.m. MT (11 a.m. CT) to review our 2017 results and answer shareholder questions.  https://t.co/WXWAQoDkof  https://t.co/7oUFNrtivy,en,[],['http://bit.ly/2DYGlst'],['https://pbs.twimg.com/media/DZTh0yyVwAEE0OF.jpg'],0,0,1,[],[],https://twitter.com/BurnsJunction/status/978655447606484993,False,,1,https://pbs.twimg.com/media/DZTh0yyVwAEE0OF.jpg,,,,,,,[],,,,
978303518736986112,978303518736986112,2018-03-26 21:41:49 IST,2018-03-26,21:41:49,+0530,383817609,burnsjunction,Andy Williams,,"“We don't want to do a bait-and-switch on the tourists or Colorado citizens who choose to use this legal product."" - State Rep. Jonathan Singer on House Bill 1258, which was approved by the Colorado General Assembly House committee.  https://t.co/OtwhLSgr0Z  https://t.co/EeLjFA4SuP",en,[],['http://bit.ly/2Gq5KR3'],['https://pbs.twimg.com/media/DZOh0xuVoAAEBQX.jpg'],0,0,2,[],[],https://twitter.com/BurnsJunction/status/978303518736986112,False,,1,https://pbs.twimg.com/media/DZOh0xuVoAAEBQX.jpg,,,,,,,[],,,,
977210339946250240,977210339946250240,2018-03-23 21:17:55 IST,2018-03-23,21:17:55,+0530,383817609,burnsjunction,Andy Williams,,It’s important we hold our representatives accountable when they’re not acting according to the will of the people. It’s also important to let them know when they’re doing a good job. I wrote this to @SenCoryGardner; check it out!  https://t.co/QlJitsupcS  https://t.co/x9NG7t50Pi,en,"[{'screen_name': 'sencorygardner', 'name': 'cory gardner', 'id': '235217558'}]",['http://bit.ly/2GeTd2N'],['https://pbs.twimg.com/media/DY-_eR8VMAAXHTv.jpg'],0,0,1,[],[],https://twitter.com/BurnsJunction/status/977210339946250240,False,,1,https://pbs.twimg.com/media/DY-_eR8VMAAXHTv.jpg,,,,,,,[],,,,
976853091990503424,976853091990503424,2018-03-22 21:38:20 IST,2018-03-22,21:38:20,+0530,383817609,burnsjunction,Andy Williams,,"Get a glimpse of the @MedicineManDen origin story today over at @Entrepreneur, where they’re featuring an excerpt from @JavierHasse's book Start Your Own Cannabis Business.  https://t.co/pwNyNVSIF9  https://t.co/2XG2K8dFNM",en,"[{'screen_name': 'medicinemanden', 'name': 'medicine man', 'id': '216150349'}, {'screen_name': 'entrepreneur', 'name': 'entrepreneur', 'id': '19407053'}, {'screen_name': 'javierhasse', 'name': 'javier hasse', 'id': '879711720'}]",['http://bit.ly/2HY2A3N'],['https://pbs.twimg.com/media/DY56RUOWsAAtq0G.jpg'],0,1,4,[],[],https://twitter.com/BurnsJunction/status/976853091990503424,False,,1,https://pbs.twimg.com/media/DY56RUOWsAAtq0G.jpg,,,,,,,[],,,,
976504721736257536,976504721736257536,2018-03-21 22:34:02 IST,2018-03-21,22:34:02,+0530,383817609,burnsjunction,Andy Williams,,I absolutely love this story. Watch how a potential phishing scam was turned on its head into a triumph of entrepreneurship. @pleasantgreen   https://t.co/JOUlznT9TZ,en,"[{'screen_name': 'pleasantgreen', 'name': 'pleasant green', 'id': '845720833477664768'}]",['https://youtu.be/A_yEnZlZFnM'],[],0,0,3,[],[],https://twitter.com/BurnsJunction/status/976504721736257536,False,,0,,,,,,,,[],,,,
