id,conversation_id,created_at,date,time,timezone,user_id,username,name,place,tweet,language,mentions,urls,photos,replies_count,retweets_count,likes_count,hashtags,cashtags,link,retweet,quote_url,video,thumbnail,near,geo,source,user_rt_id,user_rt,retweet_id,reply_to,retweet_date,translate,trans_src,trans_dest
1304551188227125248,1304551188227125248,2020-09-12 04:13:35 IST,2020-09-12,04:13:35,+0530,753233791733334016,digmortgage,Digital Mortgage,,Don't miss your chance to join us for the industry's world-class digital experience—#DigMortgage20. Hear from leaders @ @WellsFargo @betterdotcom @loanDepot  @EllieMaeInc @blendlabsinc @salesforce @QuickenLoans &amp; many more. Join us:  https://t.co/n0mTTZ1GrY #mortgagetech #mortgage,en,"[{'screen_name': 'wellsfargo', 'name': 'wells fargo', 'id': '1178011'}, {'screen_name': 'betterdotcom', 'name': 'better', 'id': '619195928'}, {'screen_name': 'loandepot', 'name': 'loandepot', 'id': '2456807131'}, {'screen_name': 'blendlabsinc', 'name': 'blend', 'id': '585186481'}, {'screen_name': 'salesforce', 'name': 'salesforce', 'id': '33612317'}, {'screen_name': 'quickenloans', 'name': 'quicken loans', 'id': '14336163'}]",['http://bit.ly/31y3alu'],[],0,0,2,"['digmortgage20', 'mortgagetech', 'mortgage']",[],https://twitter.com/DigMortgage/status/1304551188227125248,False,https://twitter.com/NatMortgageNews/status/1304418228882608132,0,,,,,,,,[],,,,
1303380004861079552,1303380004861079552,2020-09-08 22:39:43 IST,2020-09-08,22:39:43,+0530,753233791733334016,digmortgage,Digital Mortgage,,What to expect at Digital Mortgage 2020  https://t.co/2Rgx0FJf9j,en,[],['https://www.nationalmortgagenews.com/list/digital-mortgage-2020-preview'],[],0,0,0,[],[],https://twitter.com/DigMortgage/status/1303380004861079552,False,,0,,,,,,,,[],,,,
1301317697653870595,1301317697653870595,2020-09-03 06:04:51 IST,2020-09-03,06:04:51,+0530,753233791733334016,digmortgage,Digital Mortgage,,"DIGITAL MORTGAGE will be a world-class digital event featuring enhanced sessions, an on-demand library with downloadable content, a virtual exhibit hall &amp; many ways to connect with your fellow mortgage industry leaders. Take a tour of the experience →  https://t.co/FhaNBRgpPa  https://t.co/3guCCqY0hp",en,[],['http://bit.ly/3bmFynt'],['https://pbs.twimg.com/media/Eg81BkzXcAE4xhy.jpg'],0,3,2,[],[],https://twitter.com/DigMortgage/status/1301317697653870595,False,,1,https://pbs.twimg.com/media/Eg81BkzXcAE4xhy.jpg,,,,,,,[],,,,
1299141778948395009,1299141778948395009,2020-08-28 05:58:31 IST,2020-08-28,05:58:31,+0530,753233791733334016,digmortgage,Digital Mortgage,,"Amb. Susan Rice joins the DIGITAL MORTGAGE speaker lineup to share experience and perspective on empowerment, adversity &amp; industry transformation. Get unparalleled insight into what it’s like to be a powerful woman in a changing world. Reserve your seat:  https://t.co/n0mTTZ1GrY  https://t.co/NDYmDwJEHp",en,[],['http://bit.ly/31y3alu'],['https://pbs.twimg.com/media/Egd4_rlXkAAqQ10.jpg'],0,1,2,[],[],https://twitter.com/DigMortgage/status/1299141778948395009,False,,1,https://pbs.twimg.com/media/Egd4_rlXkAAqQ10.jpg,,,,,,,[],,,,
1295817470608117761,1295817470608117761,2020-08-19 01:48:54 IST,2020-08-19,01:48:54,+0530,753233791733334016,digmortgage,Digital Mortgage,,"DIGITAL MORTGAGE proudly welcomes a leader in the next wave of mortgage tech —  @BobWaltersQL, President and Chief Operating Officer of @QuickenLoans — as this year’s opening keynote. Join us for this must-see session:  https://t.co/tHFdTEeMIz #DigMortgage20 #mortgage #lending  https://t.co/PHUSlyGnhL",en,"[{'screen_name': 'bobwaltersql', 'name': 'bob walters', 'id': '2174538186'}, {'screen_name': 'quickenloans', 'name': 'quicken loans', 'id': '14336163'}]",['https://bit.ly/3223hF7'],['https://pbs.twimg.com/media/Efupj2aWkAQayu4.jpg'],0,1,3,"['digmortgage20', 'mortgage', 'lending']",[],https://twitter.com/DigMortgage/status/1295817470608117761,False,,1,https://pbs.twimg.com/media/Efupj2aWkAQayu4.jpg,,,,,,,[],,,,
1285197840944439297,1285197840944439297,2020-07-20 18:30:17 IST,2020-07-20,18:30:17,+0530,753233791733334016,digmortgage,Digital Mortgage,,"The #DigitalMortgage preliminary agenda is here! Check out the sessions, speakers, and networking opportunities behind this year's world-class digital experience.  #mortgageevent #mortgagetech #digitaltransformation #digitalinnovation    https://t.co/QCY6suXtez  https://t.co/8MdeP848qe",en,[],['https://www.nationalmortgagenews.com/conference/digitalmortgage/agenda'],['https://pbs.twimg.com/media/EdXwmOeX0AEj3rZ.jpg'],0,0,2,"['digitalmortgage', 'mortgageevent', 'mortgagetech', 'digitaltransformation', 'digitalinnovation']",[],https://twitter.com/DigMortgage/status/1285197840944439297,False,,1,https://pbs.twimg.com/media/EdXwmOeX0AEj3rZ.jpg,,,,,,,[],,,,
1280246768089825280,1275542180497698816,2020-07-07 02:36:30 IST,2020-07-07,02:36:30,+0530,753233791733334016,digmortgage,Digital Mortgage,,"@frokita @NatMortgageNews @Apple Thanks for the feedback. There is a very wide range of pricing for virtual events - some less than ours, some substantially more. We feel this is a fair price for the value we will offer. Hope to see you there!",en,[],[],[],0,0,0,[],[],https://twitter.com/DigMortgage/status/1280246768089825280,False,,0,,,,,,,,"[{'screen_name': 'frokita', 'name': 'Filip Rokita', 'id': '312883584'}, {'screen_name': 'NatMortgageNews', 'name': 'National Mortgage News', 'id': '28361130'}, {'screen_name': 'Apple', 'name': 'Apple', 'id': '380749300'}]",,,,
1275485384722591744,1275485384722591744,2020-06-23 23:16:27 IST,2020-06-23,23:16:27,+0530,753233791733334016,digmortgage,Digital Mortgage,,"This September, we’ll be bringing the #DigitalMortgage experience to your home office — with live discussions, panels, 1:1 meetings, on-demand channels, &amp; more.  Join us where the industry comes to transform. More details here:  https://t.co/RRfLoTGyjz  🏘️",en,[],['http://bit.ly/3170qfe'],[],0,1,0,['digitalmortgage'],[],https://twitter.com/DigMortgage/status/1275485384722591744,False,,0,,,,,,,,[],,,,
1175129018615717889,1175129018615717889,2019-09-21 00:56:05 IST,2019-09-21,00:56:05,+0530,753233791733334016,digmortgage,Digital Mortgage,,What technology is everyone else using? Where can I get the straight story on technology? And what should I do next?  https://t.co/aBZBPa3WiA  https://t.co/7LqgHL2C9I,en,[],['https://trib.al/zCVGPoi'],['https://pbs.twimg.com/media/EE7lnVmXoAAw6lp.jpg'],0,0,1,[],[],https://twitter.com/DigMortgage/status/1175129018615717889,False,,1,https://pbs.twimg.com/media/EE7lnVmXoAAw6lp.jpg,,,,,,,[],,,,
1175098564059586560,1175098564059586560,2019-09-20 22:55:04 IST,2019-09-20,22:55:04,+0530,753233791733334016,digmortgage,Digital Mortgage,,Consumers are expecting more from their lenders. Something that goes beyond the traditional application through the closing process and that focuses on the end to end home ownership journey and seamlessly connects different ecosystem players.  https://t.co/t3ppeVWuht  https://t.co/xkfSW4SrsI,en,[],['https://trib.al/Qc1F4Fj'],['https://pbs.twimg.com/media/EE7J6pHWkAASppn.jpg'],0,0,0,[],[],https://twitter.com/DigMortgage/status/1175098564059586560,False,,1,https://pbs.twimg.com/media/EE7J6pHWkAASppn.jpg,,,,,,,[],,,,
1175053262195777538,1175053262195777538,2019-09-20 19:55:03 IST,2019-09-20,19:55:03,+0530,753233791733334016,digmortgage,Digital Mortgage,,"Hear from Origence! Learn more about the cutting-edge, #digitalmortgage tech they'll be showcasing:  https://t.co/2K8gkvh3Wv  https://t.co/f9HCBpntwk",en,[],['https://trib.al/FjuWtvF'],['https://pbs.twimg.com/media/EE6gtvjWsAE5FJW.jpg'],0,0,0,['digitalmortgage'],[],https://twitter.com/DigMortgage/status/1175053262195777538,False,,1,https://pbs.twimg.com/media/EE6gtvjWsAE5FJW.jpg,,,,,,,[],,,,
1174766131380441088,1174766131380441088,2019-09-20 00:54:06 IST,2019-09-20,00:54:06,+0530,753233791733334016,digmortgage,Digital Mortgage,,"Multi-channel marketing is no longer the way of the future, but the way of today – and has brought with it a new level of marketing complexity.  https://t.co/2UxSuC7BRe  https://t.co/MN8yo4TRJk",en,[],['https://trib.al/XPinCPP'],['https://pbs.twimg.com/media/EE2bkfvWsAAc8Zp.jpg'],0,0,1,[],[],https://twitter.com/DigMortgage/status/1174766131380441088,False,,1,https://pbs.twimg.com/media/EE2bkfvWsAAc8Zp.jpg,,,,,,,[],,,,
1174735914490388481,1174735914490388481,2019-09-19 22:54:02 IST,2019-09-19,22:54:02,+0530,753233791733334016,digmortgage,Digital Mortgage,,"Must-attend session: Disruption Is Just Beginning: The Savior &amp; Threat of Big Tech, iBuyers, Lead Providers.  https://t.co/jul3UqDWcR  https://t.co/og7Dt0Gp91",en,[],['https://trib.al/gzssjpK'],['https://pbs.twimg.com/media/EE2AFqfXUAEgPAH.jpg'],0,0,0,[],[],https://twitter.com/DigMortgage/status/1174735914490388481,False,,1,https://pbs.twimg.com/media/EE2AFqfXUAEgPAH.jpg,,,,,,,[],,,,
1174690369885417473,1174690369885417473,2019-09-19 19:53:03 IST,2019-09-19,19:53:03,+0530,753233791733334016,digmortgage,Digital Mortgage,,"As Fannie Mae, Freddie Mac, mortgage lenders, and fintechs come together, we’re within striking distance of a fully digital process that responsibly serves consumers, lenders, taxpayers and the global financial system.  https://t.co/IMW4qTVdO5  https://t.co/PZ83Gvyf2z",en,[],['https://trib.al/UUSrKP1'],['https://pbs.twimg.com/media/EE1WqmrXsAE42gh.jpg'],0,0,1,[],[],https://twitter.com/DigMortgage/status/1174690369885417473,False,,1,https://pbs.twimg.com/media/EE1WqmrXsAE42gh.jpg,,,,,,,[],,,,
1174373297355665408,1174373297355665408,2019-09-18 22:53:07 IST,2019-09-18,22:53:07,+0530,753233791733334016,digmortgage,Digital Mortgage,,"Customers expect a one-stop shop for buying, financing, improving, and selling their homes. Lenders, realtors/iBuyers, lead providers, and Big Tech now compete as much as collaborate to acquire and serve customers.  https://t.co/vSVbG8wnn2  https://t.co/ktZql3tdUa",en,[],['https://trib.al/trm6Y4a'],['https://pbs.twimg.com/media/EEw2SkFXoAASW6y.jpg'],0,0,0,[],[],https://twitter.com/DigMortgage/status/1174373297355665408,False,,1,https://pbs.twimg.com/media/EEw2SkFXoAASW6y.jpg,,,,,,,[],,,,
1174327989628280832,1174327989628280832,2019-09-18 19:53:05 IST,2019-09-18,19:53:05,+0530,753233791733334016,digmortgage,Digital Mortgage,,"Find out how GSEs, Lenders, Technology and Valuation Providers are partnering together to embrace mobile technology, data driven decisioning, and smart labor force management to radically reduce cost and time, and how you can get on board as well.  https://t.co/TFivsQprQB  https://t.co/u8qVaAu7nV",en,[],['https://trib.al/iOZfKuf'],['https://pbs.twimg.com/media/EEwNFTnWkAALeqh.jpg'],0,0,0,[],[],https://twitter.com/DigMortgage/status/1174327989628280832,False,,1,https://pbs.twimg.com/media/EEwNFTnWkAALeqh.jpg,,,,,,,[],,,,
1174055951227412480,1174055951227412480,2019-09-18 01:52:06 IST,2019-09-18,01:52:06,+0530,753233791733334016,digmortgage,Digital Mortgage,,Strangling the Monolith - Microservice-based System Architectures for Customer-Centric Organizations.  https://t.co/9iIyBkKm7U  https://t.co/aIJAhhD43u,en,[],['https://trib.al/O7H5Eua'],['https://pbs.twimg.com/media/EEsVqlLWsAQoDmz.jpg'],0,0,0,[],[],https://twitter.com/DigMortgage/status/1174055951227412480,False,,1,https://pbs.twimg.com/media/EEsVqlLWsAQoDmz.jpg,,,,,,,[],,,,
1174010653679509505,1174010653679509505,2019-09-17 22:52:06 IST,2019-09-17,22:52:06,+0530,753233791733334016,digmortgage,Digital Mortgage,,"With the rise of Broker-focused tech, the Wholesale market share is expected to nearly double in the next year. Join   https://t.co/VNVe9WY5Jt  https://t.co/66YmI9pgnJ",en,[],['https://trib.al/mZIKHVt'],['https://pbs.twimg.com/media/EErsd8iXYAABROR.jpg'],0,0,0,[],[],https://twitter.com/DigMortgage/status/1174010653679509505,False,,1,https://pbs.twimg.com/media/EErsd8iXYAABROR.jpg,,,,,,,[],,,,
1174010398833631232,1174010398833631232,2019-09-17 22:51:05 IST,2019-09-17,22:51:05,+0530,753233791733334016,digmortgage,Digital Mortgage,,Session: Leveraging Appraisal Modernization: How to Use Emerging Tech For a Better Customer Experience.  https://t.co/RaKfwlGYdE  https://t.co/JjPncIDJBS,en,[],['https://trib.al/HiyGHfz'],['https://pbs.twimg.com/media/EErsPFIWwAE2M4p.jpg'],0,0,0,[],[],https://twitter.com/DigMortgage/status/1174010398833631232,False,,1,https://pbs.twimg.com/media/EErsPFIWwAE2M4p.jpg,,,,,,,[],,,,
1173965085427019776,1173965085427019776,2019-09-17 19:51:02 IST,2019-09-17,19:51:02,+0530,753233791733334016,digmortgage,Digital Mortgage,,"With 88% of consumers choosing to fund their mortgage with the first or second lender they engage with, it is becoming vitally important to gain a better understanding of consumers along their shopping journey.  https://t.co/cJxcTraLzO  https://t.co/8Mu5QObpx5",en,[],['https://trib.al/IcBSu20'],['https://pbs.twimg.com/media/EErDBf6XkAIg5Gf.jpg'],0,0,0,[],[],https://twitter.com/DigMortgage/status/1173965085427019776,False,,1,https://pbs.twimg.com/media/EErDBf6XkAIg5Gf.jpg,,,,,,,[],,,,
1173693060104052737,1173693060104052737,2019-09-17 01:50:06 IST,2019-09-17,01:50:06,+0530,753233791733334016,digmortgage,Digital Mortgage,,"Multi-channel marketing is no longer the way of the future, but the way of today – and has brought with it a new level of marketing complexity.  https://t.co/x4i8CT2RIV  https://t.co/xL2ka9wYKs",en,[],['https://trib.al/zBvVcTm'],['https://pbs.twimg.com/media/EEnLnimXYAEAT1v.jpg'],0,0,0,[],[],https://twitter.com/DigMortgage/status/1173693060104052737,False,,1,https://pbs.twimg.com/media/EEnLnimXYAEAT1v.jpg,,,,,,,[],,,,
1173647778356060167,1173647778356060167,2019-09-16 22:50:10 IST,2019-09-16,22:50:10,+0530,753233791733334016,digmortgage,Digital Mortgage,,Let’s bring the secondary mindset to the first position and have a conversation around best execution.  https://t.co/l5LCYhiuuk  https://t.co/0lTPLqR50e,en,[],['https://trib.al/94s3mQT'],['https://pbs.twimg.com/media/EEmibz1WsAAr4p6.jpg'],0,0,0,[],[],https://twitter.com/DigMortgage/status/1173647778356060167,False,,1,https://pbs.twimg.com/media/EEmibz1WsAAr4p6.jpg,,,,,,,[],,,,
1172604874611204097,1172604874611204097,2019-09-14 01:46:02 IST,2019-09-14,01:46:02,+0530,753233791733334016,digmortgage,Digital Mortgage,,Top 10 Automation and Mortgage Technology Setbacks and How to Prevent Them.  https://t.co/loQYJvSrWv  https://t.co/tTiKrjeNfZ,en,[],['https://trib.al/FYywAzi'],['https://pbs.twimg.com/media/EEXt6yZWsAA2YCi.jpg'],0,0,0,[],[],https://twitter.com/DigMortgage/status/1172604874611204097,False,,1,https://pbs.twimg.com/media/EEXt6yZWsAA2YCi.jpg,,,,,,,[],,,,
1172559329737752576,1172559329737752576,2019-09-13 22:45:03 IST,2019-09-13,22:45:03,+0530,753233791733334016,digmortgage,Digital Mortgage,,Technology’s potential to radically change mortgage and consumer finance will finally be fulfilled.  https://t.co/z0vFMG2FUX  https://t.co/3utO5pCDET,en,[],['https://trib.al/JcJnix3'],['https://pbs.twimg.com/media/EEXEfwsWkAc1aot.jpg'],0,0,0,[],[],https://twitter.com/DigMortgage/status/1172559329737752576,False,,1,https://pbs.twimg.com/media/EEXEfwsWkAc1aot.jpg,,,,,,,[],,,,
1172541553392410624,1172522331081728000,2019-09-13 21:34:25 IST,2019-09-13,21:34:25,+0530,753233791733334016,digmortgage,Digital Mortgage,,@Pavasotweets We are looking forward to seeing you in Vegas on the 23rd!,en,[],[],[],0,0,1,[],[],https://twitter.com/DigMortgage/status/1172541553392410624,False,,0,,,,,,,,"[{'screen_name': 'Pavasotweets', 'name': 'Pavaso', 'id': '351023879'}]",,,,
1172514527931449344,1172514527931449344,2019-09-13 19:47:02 IST,2019-09-13,19:47:02,+0530,753233791733334016,digmortgage,Digital Mortgage,,Learn how data-driven marketers are deploying dynamic people-based marketing strategies by leveraging alternative data sets to win more business now.  https://t.co/K6xtnhBNWX  https://t.co/11fNBaw3tH,en,[],['https://trib.al/wPI3JDd'],['https://pbs.twimg.com/media/EEWbv8pWwAE86AA.jpg'],0,0,0,[],[],https://twitter.com/DigMortgage/status/1172514527931449344,False,,1,https://pbs.twimg.com/media/EEWbv8pWwAE86AA.jpg,,,,,,,[],,,,
1172514040922464259,1172514040922464259,2019-09-13 19:45:06 IST,2019-09-13,19:45:06,+0530,753233791733334016,digmortgage,Digital Mortgage,,"As more and more industry stakeholders string together an end to end digital mortgage experience for the consumer, the adoptions of electronic closings and eNotes is growing significantly.  https://t.co/HNcWQoThXd  https://t.co/5CrdXbQxkC",en,[],['https://trib.al/cdaQUp2'],['https://pbs.twimg.com/media/EEWbTmrXoAE-fT_.jpg'],0,0,0,[],[],https://twitter.com/DigMortgage/status/1172514040922464259,False,,1,https://pbs.twimg.com/media/EEWbTmrXoAE-fT_.jpg,,,,,,,[],,,,
1172242256683765762,1172242256683765762,2019-09-13 01:45:07 IST,2019-09-13,01:45:07,+0530,753233791733334016,digmortgage,Digital Mortgage,,Catch this session: Re-imagining the Digital Mortgage Experience - Going Beyond the Loan.  https://t.co/rQLpFawyIm  https://t.co/HhHgswufh3,en,[],['https://trib.al/Tx8QxxE'],['https://pbs.twimg.com/media/EESkHqxXoAEwACN.jpg'],0,0,0,[],[],https://twitter.com/DigMortgage/status/1172242256683765762,False,,1,https://pbs.twimg.com/media/EESkHqxXoAEwACN.jpg,,,,,,,[],,,,
1172196687747698688,1172196687747698688,2019-09-12 22:44:03 IST,2019-09-12,22:44:03,+0530,753233791733334016,digmortgage,Digital Mortgage,,Consider the process of retiring the 35 separate vendor solutions patchwork systems that suffocate our innovation aspirations and welcome modern microservice-based system architectures.  https://t.co/lqxbtUWncB  https://t.co/0XHgI192BW,en,[],['https://trib.al/JtaUAeD'],['https://pbs.twimg.com/media/EER6rN7XYAEGQx0.jpg'],0,0,0,[],[],https://twitter.com/DigMortgage/status/1172196687747698688,False,,1,https://pbs.twimg.com/media/EER6rN7XYAEGQx0.jpg,,,,,,,[],,,,
1172151412236701696,1172151412236701696,2019-09-12 19:44:08 IST,2019-09-12,19:44:08,+0530,753233791733334016,digmortgage,Digital Mortgage,,"Hear from @SoftWorksAI! Learn more about the cutting-edge, #digitalmortgage tech they'll be showcasing:  https://t.co/Qm53QZV9NB  https://t.co/VaIf4EyFLV",en,"[{'screen_name': 'softworksai', 'name': 'softworks ai', 'id': '894939274952544257'}]",['https://trib.al/76FteN0'],['https://pbs.twimg.com/media/EERRf1VX4AEIAdc.jpg'],0,0,0,['digitalmortgage'],[],https://twitter.com/DigMortgage/status/1172151412236701696,False,,1,https://pbs.twimg.com/media/EERRf1VX4AEIAdc.jpg,,,,,,,[],,,,
1171879357071208448,1171879357071208448,2019-09-12 01:43:05 IST,2019-09-12,01:43:05,+0530,753233791733334016,digmortgage,Digital Mortgage,,Make sure to catch this session: A Fully Digital Mortgage — It’s Closer than You Think!  https://t.co/bZ49zaEvoI  https://t.co/LLLdlunIkc,en,[],['https://trib.al/DELu3Fa'],['https://pbs.twimg.com/media/EENaEITX4AEU7aR.jpg'],0,0,1,[],[],https://twitter.com/DigMortgage/status/1171879357071208448,False,,1,https://pbs.twimg.com/media/EENaEITX4AEU7aR.jpg,,,,,,,[],,,,
1171833805147115520,1171833805147115520,2019-09-11 22:42:05 IST,2019-09-11,22:42:05,+0530,753233791733334016,digmortgage,Digital Mortgage,,"Insights that will enable lenders to proactively address the most costly, broken and ineffective processes that have led to automation and digital mortgage set-backs before they occur.  https://t.co/M60FfOqkUm  https://t.co/Z8bQVSAokg",en,[],['https://trib.al/wKXK2cZ'],['https://pbs.twimg.com/media/EEMwoqEXsAAvdgb.jpg'],0,0,0,[],[],https://twitter.com/DigMortgage/status/1171833805147115520,False,,1,https://pbs.twimg.com/media/EEMwoqEXsAAvdgb.jpg,,,,,,,[],,,,
1171788748373266433,1171788748373266433,2019-09-11 19:43:03 IST,2019-09-11,19:43:03,+0530,753233791733334016,digmortgage,Digital Mortgage,,Session: Leveraging Appraisal Modernization: How to Use Emerging Tech For a Better Customer Experience.  https://t.co/TxDi0zPRM3  https://t.co/Zj1x7snkz5,en,[],['https://trib.al/9MSCEMo'],['https://pbs.twimg.com/media/EEMHqBLXYAMzhIR.jpg'],0,0,0,[],[],https://twitter.com/DigMortgage/status/1171788748373266433,False,,1,https://pbs.twimg.com/media/EEMHqBLXYAMzhIR.jpg,,,,,,,[],,,,
1171513942750810114,1171513942750810114,2019-09-11 01:31:04 IST,2019-09-11,01:31:04,+0530,753233791733334016,digmortgage,Digital Mortgage,,Catch this session: Wholesale Market Disruption: Broker at the Center.  https://t.co/bJGamU7DYD  https://t.co/ZHG3DbfbP7,en,[],['https://trib.al/ApwcMhl'],['https://pbs.twimg.com/media/EEINuJVU4AcCtzw.jpg'],0,0,0,[],[],https://twitter.com/DigMortgage/status/1171513942750810114,False,,1,https://pbs.twimg.com/media/EEINuJVU4AcCtzw.jpg,,,,,,,[],,,,
1171468457495281664,1171468457495281664,2019-09-10 22:30:19 IST,2019-09-10,22:30:19,+0530,753233791733334016,digmortgage,Digital Mortgage,,"Curated from dozens of lenders Ellie Mae has worked with plus, results from a recent research survey, get ready to learn the top ten things that will help you as you prepare for URLA.  https://t.co/o6SThY4WBg  https://t.co/6B2TwZ5xnj",en,[],['https://trib.al/elQNMEB'],['https://pbs.twimg.com/media/EEHkWlaU4AQIkgq.jpg'],0,0,0,[],[],https://twitter.com/DigMortgage/status/1171468457495281664,False,,1,https://pbs.twimg.com/media/EEHkWlaU4AQIkgq.jpg,,,,,,,[],,,,
1171423138237861888,1171423138237861888,2019-09-10 19:30:14 IST,2019-09-10,19:30:14,+0530,753233791733334016,digmortgage,Digital Mortgage,,Leveraging the Credit Union Ecosystem to Define Your Digital Strategy.  https://t.co/IbICPniMMu  https://t.co/A6dTpQNWgy,en,[],['https://trib.al/2OfxItG'],['https://pbs.twimg.com/media/EEG7IuJWkAAUYjD.jpg'],0,0,0,[],[],https://twitter.com/DigMortgage/status/1171423138237861888,False,,1,https://pbs.twimg.com/media/EEG7IuJWkAAUYjD.jpg,,,,,,,[],,,,
1171151345904226304,1171151345904226304,2019-09-10 01:30:14 IST,2019-09-10,01:30:14,+0530,753233791733334016,digmortgage,Digital Mortgage,,Session: Blockchain - Changing the Way the World Does Home Purchase.  https://t.co/pu6VcqKgNU  https://t.co/kbl355DJe5,en,[],['https://trib.al/LmEFznb'],['https://pbs.twimg.com/media/EEDD8RTXYAAJdVH.jpg'],0,0,0,[],[],https://twitter.com/DigMortgage/status/1171151345904226304,False,,1,https://pbs.twimg.com/media/EEDD8RTXYAAJdVH.jpg,,,,,,,[],,,,
1171105750598467585,1171105750598467585,2019-09-09 22:29:03 IST,2019-09-09,22:29:03,+0530,753233791733334016,digmortgage,Digital Mortgage,,"Don't miss this session where Zillow and Credit Karma come straight at the issues we all must confront openly, so we can understand how the next phase of disruption will play out.  https://t.co/Ocn9pacYdO  https://t.co/t4hiTxpTmy",en,[],['https://trib.al/TKBGouQ'],['https://pbs.twimg.com/media/EECaeUqXsAAmtU1.jpg'],0,0,0,[],[],https://twitter.com/DigMortgage/status/1171105750598467585,False,,1,https://pbs.twimg.com/media/EECaeUqXsAAmtU1.jpg,,,,,,,[],,,,
1171060446599831553,1171060446599831553,2019-09-09 19:29:02 IST,2019-09-09,19:29:02,+0530,753233791733334016,digmortgage,Digital Mortgage,,"Hear from @LandGorilla! Learn more about the cutting-edge, #digitalmortgage tech they'll be showcasing:  https://t.co/7CXInhslwx  https://t.co/k9X1YsznXW",en,"[{'screen_name': 'landgorilla', 'name': 'land gorilla', 'id': '247480000'}]",['https://trib.al/mDza99F'],['https://pbs.twimg.com/media/EEBxRQ_WkAMTZcX.jpg'],0,0,1,['digitalmortgage'],[],https://twitter.com/DigMortgage/status/1171060446599831553,False,,1,https://pbs.twimg.com/media/EEBxRQ_WkAMTZcX.jpg,,,,,,,[],,,,
1170064176842194944,1170064176842194944,2019-09-07 01:30:13 IST,2019-09-07,01:30:13,+0530,753233791733334016,digmortgage,Digital Mortgage,,Session: A New Housing Ecosystem: $3.8 Trillion Under One Roof.  https://t.co/qP0w6pU6po  https://t.co/s0Yrwz2H6F,en,[],['https://trib.al/cNmtSkA'],['https://pbs.twimg.com/media/EDznKsuWwAADbKd.jpg'],0,0,0,[],[],https://twitter.com/DigMortgage/status/1170064176842194944,False,,1,https://pbs.twimg.com/media/EDznKsuWwAADbKd.jpg,,,,,,,[],,,,
1170018340884111360,1170018340884111360,2019-09-06 22:28:05 IST,2019-09-06,22:28:05,+0530,753233791733334016,digmortgage,Digital Mortgage,,In the age of automation and “data not documents” we have created a new type of funnel that gives borrowers options in how they share information with consumer finance companies.  https://t.co/swoMRJaKVF  https://t.co/gqbtumJAGD,en,[],['https://trib.al/VFCkuBc'],['https://pbs.twimg.com/media/EDy9evdXoAAEYw2.jpg'],0,0,0,[],[],https://twitter.com/DigMortgage/status/1170018340884111360,False,,1,https://pbs.twimg.com/media/EDy9evdXoAAEYw2.jpg,,,,,,,[],,,,
1169972795876478977,1169972795876478977,2019-09-06 19:27:06 IST,2019-09-06,19:27:06,+0530,753233791733334016,digmortgage,Digital Mortgage,,Come to #digitalmortage to see @LoanLogics launch a new solution! Learn more about them at:  https://t.co/1KOtzxU6Dp  https://t.co/7cmjefrxv0,en,"[{'screen_name': 'loanlogics', 'name': 'loanlogics', 'id': '2218490522'}]",['https://trib.al/1WonWhE'],['https://pbs.twimg.com/media/EDyUDrKXYAAPL_8.jpg'],0,1,0,['digitalmortage'],[],https://twitter.com/DigMortgage/status/1169972795876478977,False,,1,https://pbs.twimg.com/media/EDyUDrKXYAAPL_8.jpg,,,,,,,[],,,,
1169701773696802817,1169701773696802817,2019-09-06 01:30:09 IST,2019-09-06,01:30:09,+0530,753233791733334016,digmortgage,Digital Mortgage,,Bank Panel - Lessons Learned While Going Digital + What’s Next?  https://t.co/8fnbdty5IP  https://t.co/O9iDcxEf6E,en,[],['https://trib.al/wh4Rg3v'],['https://pbs.twimg.com/media/EDudkF0WwAEVU4H.jpg'],0,0,0,[],[],https://twitter.com/DigMortgage/status/1169701773696802817,False,,1,https://pbs.twimg.com/media/EDudkF0WwAEVU4H.jpg,,,,,,,[],,,,
