id,conversation_id,created_at,date,time,timezone,user_id,username,name,place,tweet,language,mentions,urls,photos,replies_count,retweets_count,likes_count,hashtags,cashtags,link,retweet,quote_url,video,thumbnail,near,geo,source,user_rt_id,user_rt,retweet_id,reply_to,retweet_date,translate,trans_src,trans_dest
1169658464567812096,1169658464567812096,2019-09-05 22:38:03 IST,2019-09-05,22:38:03,+0530,753233791733334016,digmortgage,Digital Mortgage,,"Feb 2020 URLA will be live. Much has been written, webcasts have been shared and conference sessions have spoken on this topic, but this session is different.  https://t.co/O0aAKGvFUe  https://t.co/Pr8nDIMrbq",en,[],['https://trib.al/PTqXH40'],['https://pbs.twimg.com/media/EDt2LICWsAArcIx.jpg'],0,0,0,[],[],https://twitter.com/DigMortgage/status/1169658464567812096,False,,1,https://pbs.twimg.com/media/EDt2LICWsAArcIx.jpg,,,,,,,[],,,,
1169609908553224192,1169609908553224192,2019-09-05 19:25:07 IST,2019-09-05,19:25:07,+0530,753233791733334016,digmortgage,Digital Mortgage,,"Here comes @CapsilonIQ! Learn more about the cutting-edge, #digitalmortgage tech they'll be showcasing:  https://t.co/y7cb49Rh6w  https://t.co/X1z5HPh9s8",en,"[{'screen_name': 'capsiloniq', 'name': 'capsilon', 'id': '2372557776'}]",['https://trib.al/7eRJNOs'],['https://pbs.twimg.com/media/EDtKA2RXsAANa0t.jpg'],0,1,0,['digitalmortgage'],[],https://twitter.com/DigMortgage/status/1169609908553224192,False,,1,https://pbs.twimg.com/media/EDtKA2RXsAANa0t.jpg,,,,,,,[],,,,
1169608388705234944,1169608388705234944,2019-09-05 19:19:04 IST,2019-09-05,19:19:04,+0530,753233791733334016,digmortgage,Digital Mortgage,,Learn from an expert panel of industry leaders already delivering groundbreaking results to homebuyers how to adopt new technology at scale and what to consider from a process and compliance perspective.  https://t.co/xj1UnmAXK1  https://t.co/0gGOnLGlBm,en,[],['https://trib.al/SLMrTs8'],['https://pbs.twimg.com/media/EDtIoYBXkAAV60l.jpg'],0,0,0,[],[],https://twitter.com/DigMortgage/status/1169608388705234944,False,,1,https://pbs.twimg.com/media/EDtIoYBXkAAV60l.jpg,,,,,,,[],,,,
1169339405028548609,1169339405028548609,2019-09-05 01:30:14 IST,2019-09-05,01:30:14,+0530,753233791733334016,digmortgage,Digital Mortgage,,Don’t miss: Top Five Things to Get Prepared for the New URLA.  https://t.co/2yVCmXDY2g  https://t.co/0wVjRF4Bss,en,[],['https://trib.al/dksABmf'],['https://pbs.twimg.com/media/EDpT_eTXoAAYbWE.jpg'],0,0,0,[],[],https://twitter.com/DigMortgage/status/1169339405028548609,False,,1,https://pbs.twimg.com/media/EDpT_eTXoAAYbWE.jpg,,,,,,,[],,,,
1169297091304312833,1169297091304312833,2019-09-04 22:42:05 IST,2019-09-04,22:42:05,+0530,753233791733334016,digmortgage,Digital Mortgage,,Adopt marketing strategies designed to quickly supercharge adoption within your organization and make meaning tech-driven change part of your company culture.  https://t.co/7ou19Adjwz  https://t.co/jJq7rcJUdZ,en,[],['https://trib.al/waV6tws'],['https://pbs.twimg.com/media/EDotge0W4AADW-L.jpg'],0,0,0,[],[],https://twitter.com/DigMortgage/status/1169297091304312833,False,,1,https://pbs.twimg.com/media/EDotge0W4AADW-L.jpg,,,,,,,[],,,,
1169247267104219139,1169247267104219139,2019-09-04 19:24:06 IST,2019-09-04,19:24:06,+0530,753233791733334016,digmortgage,Digital Mortgage,,"Find out how GSEs, Lenders, Technology and Valuation Providers are partnering together to embrace mobile technology, data driven decisioning, and smart labor force management to radically reduce cost and time, and how you can get on board as well.  https://t.co/iZKy1xufIy  https://t.co/AztI4F9NAj",en,[],['https://trib.al/OW88Vfn'],['https://pbs.twimg.com/media/EDoAMU4WkAAPXt6.jpg'],0,0,0,[],[],https://twitter.com/DigMortgage/status/1169247267104219139,False,,1,https://pbs.twimg.com/media/EDoAMU4WkAAPXt6.jpg,,,,,,,[],,,,
1168983777881841664,1168983777881841664,2019-09-04 01:57:05 IST,2019-09-04,01:57:05,+0530,753233791733334016,digmortgage,Digital Mortgage,,Don't miss: Bringing the Secondary Market Into the First.  https://t.co/yg0959xyLr  https://t.co/MgO0ADyNox,en,[],['https://trib.al/Ta6KnYj'],['https://pbs.twimg.com/media/EDkQjPuWsAAqf-Q.jpg'],0,0,0,[],[],https://twitter.com/DigMortgage/status/1168983777881841664,False,,1,https://pbs.twimg.com/media/EDkQjPuWsAAqf-Q.jpg,,,,,,,[],,,,
1168936971303038976,1168936971303038976,2019-09-03 22:51:06 IST,2019-09-03,22:51:06,+0530,753233791733334016,digmortgage,Digital Mortgage,,Can you even be a one-product shop anymore? Can lead providers serve the industry AND themselves? Are Big Tech companies a threat or savior to the industry?  https://t.co/qwby4nud4n  https://t.co/U5k24WgBkY,en,[],['https://trib.al/KitDh9T'],['https://pbs.twimg.com/media/EDjl-uWX4AEubtu.jpg'],0,0,0,[],[],https://twitter.com/DigMortgage/status/1168936971303038976,False,,1,https://pbs.twimg.com/media/EDjl-uWX4AEubtu.jpg,,,,,,,[],,,,
1168887384412491777,1168887384412491777,2019-09-03 19:34:03 IST,2019-09-03,19:34:03,+0530,753233791733334016,digmortgage,Digital Mortgage,,"Hear from @jane_ai! Learn more about the cutting-edge, #digitalmortgage tech they'll be showcasing:  https://t.co/2WsJnB5STV  https://t.co/UaxKsNdtpa",en,"[{'screen_name': 'jane_ai', 'name': 'jane ai', 'id': '1164535927479255041'}]",['https://trib.al/Ja5zppr'],['https://pbs.twimg.com/media/EDi44ZZWkAItmrp.jpg'],0,0,0,['digitalmortgage'],[],https://twitter.com/DigMortgage/status/1168887384412491777,False,,1,https://pbs.twimg.com/media/EDi44ZZWkAItmrp.jpg,,,,,,,[],,,,
1168616601576452096,1168616601576452096,2019-09-03 01:38:04 IST,2019-09-03,01:38:04,+0530,753233791733334016,digmortgage,Digital Mortgage,,Consider the process of retiring the 35 separate vendor solutions patchwork systems that suffocate our innovation aspirations and welcome modern microservice-based system architectures.  https://t.co/NlwTVFTNiu  https://t.co/CJ5uU7G5qz,en,[],['https://trib.al/A1qnNro'],['https://pbs.twimg.com/media/EDfCmyHXoAEr_j5.jpg'],0,0,0,[],[],https://twitter.com/DigMortgage/status/1168616601576452096,False,,1,https://pbs.twimg.com/media/EDfCmyHXoAEr_j5.jpg,,,,,,,[],,,,
1168569781630492672,1168569781630492672,2019-09-02 22:32:01 IST,2019-09-02,22:32:01,+0530,753233791733334016,digmortgage,Digital Mortgage,,"Consumers are demanding delightful digital experiences and fintechs are providing just that, therefore attracting an ever-growing number of customers.  https://t.co/jMnO5jyBZ2  https://t.co/zT7Ld8tGgU",en,[],['https://trib.al/xckjbEI'],['https://pbs.twimg.com/media/EDeYBfRW4AAmYPk.jpg'],0,0,0,[],[],https://twitter.com/DigMortgage/status/1168569781630492672,False,,1,https://pbs.twimg.com/media/EDeYBfRW4AAmYPk.jpg,,,,,,,[],,,,
1168525766675578880,1168525766675578880,2019-09-02 19:37:07 IST,2019-09-02,19:37:07,+0530,753233791733334016,digmortgage,Digital Mortgage,,"Hear from @cloudvirga! Learn more about the cutting-edge, #digitalmortgage tech they'll be showcasing:  https://t.co/7cd16EH7k0  https://t.co/ZjCoiE03ND",en,"[{'screen_name': 'cloudvirga', 'name': 'cloudvirga™', 'id': '4587009254'}]",['https://trib.al/uq9xfXH'],['https://pbs.twimg.com/media/EDdv_dLXUAIjgph.jpg'],0,0,0,['digitalmortgage'],[],https://twitter.com/DigMortgage/status/1168525766675578880,False,,1,https://pbs.twimg.com/media/EDdv_dLXUAIjgph.jpg,,,,,,,[],,,,
1167527462252793859,1167527462252793859,2019-08-31 01:30:13 IST,2019-08-31,01:30:13,+0530,753233791733334016,digmortgage,Digital Mortgage,,"Hear from First American Mortgage Solutions! Learn more about the cutting-edge, #digitalmortgage tech they'll be showcasing:  https://t.co/anDDH1Pk4n  https://t.co/oKhAQFbvGH",en,[],['https://trib.al/3vWzQqE'],['https://pbs.twimg.com/media/EDPkCe9W4AA5Wx6.jpg'],0,0,0,['digitalmortgage'],[],https://twitter.com/DigMortgage/status/1167527462252793859,False,,1,https://pbs.twimg.com/media/EDPkCe9W4AA5Wx6.jpg,,,,,,,[],,,,
1167527462219264000,1167527462219264000,2019-08-31 01:30:13 IST,2019-08-31,01:30:13,+0530,753233791733334016,digmortgage,Digital Mortgage,,"Consumers are demanding delightful digital experiences and fintechs are providing just that, therefore attracting an ever-growing number of customers.  https://t.co/R1msOiklyE  https://t.co/wXONLks1Rh",en,[],['https://trib.al/PEESqhg'],['https://pbs.twimg.com/media/EDPkCghW4AA0FvG.jpg'],0,0,0,[],[],https://twitter.com/DigMortgage/status/1167527462219264000,False,,1,https://pbs.twimg.com/media/EDPkCghW4AA0FvG.jpg,,,,,,,[],,,,
1167482167695425536,1167482167695425536,2019-08-30 22:30:14 IST,2019-08-30,22:30:14,+0530,753233791733334016,digmortgage,Digital Mortgage,,Learn how data-driven marketers are deploying dynamic people-based marketing strategies by leveraging alternative data sets to win more business now.  https://t.co/f5k915YjPS  https://t.co/Mu3kZGamRZ,en,[],['https://trib.al/b1AYIwL'],['https://pbs.twimg.com/media/EDO62BtXYAEndhz.jpg'],0,0,1,[],[],https://twitter.com/DigMortgage/status/1167482167695425536,False,,1,https://pbs.twimg.com/media/EDO62BtXYAEndhz.jpg,,,,,,,[],,,,
1167166547816833026,1167166547816833026,2019-08-30 01:36:04 IST,2019-08-30,01:36:04,+0530,753233791733334016,digmortgage,Digital Mortgage,,What benefits have been realized to date from API development and implementation? And what is already table stakes in API usage?   https://t.co/0a2fyK232S  https://t.co/NrPvHwW0Cz,en,[],['https://trib.al/BS10bba'],['https://pbs.twimg.com/media/EDKbyhjXUAIiaK-.jpg'],0,0,0,[],[],https://twitter.com/DigMortgage/status/1167166547816833026,False,,1,https://pbs.twimg.com/media/EDKbyhjXUAIiaK-.jpg,,,,,,,[],,,,
1167116977472770049,1167116977472770049,2019-08-29 22:19:06 IST,2019-08-29,22:19:06,+0530,753233791733334016,digmortgage,Digital Mortgage,,"The evolution of the home buying process requires collaboration by credit unions to ensure compliance, market survival, and technology innovation.   https://t.co/cOfrDcKCwl  https://t.co/gOPhXgnvPB",en,[],['https://trib.al/uAZfBxZ'],['https://pbs.twimg.com/media/EDJutJjXsAYTbY0.jpg'],0,0,0,[],[],https://twitter.com/DigMortgage/status/1167116977472770049,False,,1,https://pbs.twimg.com/media/EDJutJjXsAYTbY0.jpg,,,,,,,[],,,,
1167081235316924417,1167081235316924417,2019-08-29 19:57:04 IST,2019-08-29,19:57:04,+0530,753233791733334016,digmortgage,Digital Mortgage,,"Hear from @NestReady! Learn more about the cutting-edge, #digitalmortgage tech they'll be showcasing:  https://t.co/ZoIsfv60vB  https://t.co/YgUVIDJg9K",en,"[{'screen_name': 'nestready', 'name': 'nestready', 'id': '864922836267413510'}]",['https://trib.al/BqNQ6tI'],['https://pbs.twimg.com/media/EDJOMsZXsAAuF8c.jpg'],0,1,2,['digitalmortgage'],[],https://twitter.com/DigMortgage/status/1167081235316924417,False,,1,https://pbs.twimg.com/media/EDJOMsZXsAAuF8c.jpg,,,,,,,[],,,,
1166808183786090502,1166808183786090502,2019-08-29 01:52:03 IST,2019-08-29,01:52:03,+0530,753233791733334016,digmortgage,Digital Mortgage,,"Is the mortgage industry ahead of or behind the broader banking industry, and where are vendors lagging?  https://t.co/0QnOnUZayA  https://t.co/jJG1aiCEcd",en,[],['https://trib.al/PIrRiBP'],['https://pbs.twimg.com/media/EDFV2_BWwAEHyKZ.jpg'],0,0,0,[],[],https://twitter.com/DigMortgage/status/1166808183786090502,False,,1,https://pbs.twimg.com/media/EDFV2_BWwAEHyKZ.jpg,,,,,,,[],,,,
1166754070767517696,1166754070767517696,2019-08-28 22:17:02 IST,2019-08-28,22:17:02,+0530,753233791733334016,digmortgage,Digital Mortgage,,Appraisal modernization is rapidly moving from theoretical conversations and pilots to live platforms positively impacting thousands of borrowers.  https://t.co/CjveK9zjdn  https://t.co/aQce27DWiv,en,[],['https://trib.al/AHKlr4x'],['https://pbs.twimg.com/media/EDEkpNKXkAAnRFc.jpg'],0,0,0,[],[],https://twitter.com/DigMortgage/status/1166754070767517696,False,,1,https://pbs.twimg.com/media/EDEkpNKXkAAnRFc.jpg,,,,,,,[],,,,
1166708526171000832,1166708526171000832,2019-08-28 19:16:03 IST,2019-08-28,19:16:03,+0530,753233791733334016,digmortgage,Digital Mortgage,,"Multi-channel marketing is no longer the way of the future, but the way of today – and has brought with it a new level of marketing complexity.  https://t.co/fMAUd124Np  https://t.co/PKZWIPj6kX",en,[],['https://trib.al/6ZgmQAL'],['https://pbs.twimg.com/media/EDD7OKMX4AADfIU.jpg'],0,0,0,[],[],https://twitter.com/DigMortgage/status/1166708526171000832,False,,1,https://pbs.twimg.com/media/EDD7OKMX4AADfIU.jpg,,,,,,,[],,,,
1166391195578318849,1166391195578318849,2019-08-27 22:15:06 IST,2019-08-27,22:15:06,+0530,753233791733334016,digmortgage,Digital Mortgage,,"Multi-channel marketing is no longer the way of the future, but the way of today – and has brought with it a new level of marketing complexity.  https://t.co/VyyRVV3gzG  https://t.co/8dwT5UOWAf",en,[],['https://trib.al/oQt7lyC'],['https://pbs.twimg.com/media/EC_anFtXkAEYZXZ.jpg'],0,0,0,[],[],https://twitter.com/DigMortgage/status/1166391195578318849,False,,1,https://pbs.twimg.com/media/EC_anFtXkAEYZXZ.jpg,,,,,,,[],,,,
1166354702210142208,1166354702210142208,2019-08-27 19:50:05 IST,2019-08-27,19:50:05,+0530,753233791733334016,digmortgage,Digital Mortgage,,Top 10 Automation and Mortgage Technology Setbacks and How to Prevent Them.  https://t.co/baUABH2YvJ  https://t.co/2MeHKmkClb,en,[],['https://trib.al/tGFOhni'],['https://pbs.twimg.com/media/EC-5a3UW4AA5kQZ.jpg'],0,0,0,[],[],https://twitter.com/DigMortgage/status/1166354702210142208,False,,1,https://pbs.twimg.com/media/EC-5a3UW4AA5kQZ.jpg,,,,,,,[],,,,
1166088949003108357,1166088949003108357,2019-08-27 02:14:04 IST,2019-08-27,02:14:04,+0530,753233791733334016,digmortgage,Digital Mortgage,,"Will APIs reduce the centricity of the LOS as the core system of record, or even eliminate it?  https://t.co/BdurVd8yrO  https://t.co/KmRpqMMRYU",en,[],['https://trib.al/wMDzvF2'],['https://pbs.twimg.com/media/EC7HuBZXsAAdesR.jpg'],0,0,0,[],[],https://twitter.com/DigMortgage/status/1166088949003108357,False,,1,https://pbs.twimg.com/media/EC7HuBZXsAAdesR.jpg,,,,,,,[],,,,
1166033082379644929,1166033082379644929,2019-08-26 22:32:05 IST,2019-08-26,22:32:05,+0530,753233791733334016,digmortgage,Digital Mortgage,,Join industry experts as they explore the latest advancements in Broker innovation and the potential it has to disrupt the mortgage industry.  https://t.co/fZ1TJbAi76  https://t.co/PzvCN6VTUw,en,[],['https://trib.al/UfVaISW'],['https://pbs.twimg.com/media/EC6U6LMXsAAQwBi.jpg'],0,0,0,[],[],https://twitter.com/DigMortgage/status/1166033082379644929,False,,1,https://pbs.twimg.com/media/EC6U6LMXsAAQwBi.jpg,,,,,,,[],,,,
1165983249077854209,1165983249077854209,2019-08-26 19:14:04 IST,2019-08-26,19:14:04,+0530,753233791733334016,digmortgage,Digital Mortgage,,"Hear from @FinLocker! Learn more about the cutting-edge, #digitalmortgage tech they'll be showcasing:  https://t.co/xy8LsNzKSr  https://t.co/mAdaBk5rg2",en,"[{'screen_name': 'finlocker', 'name': 'finlocker', 'id': '3655834695'}]",['https://trib.al/eYaoJcz'],['https://pbs.twimg.com/media/EC5nlepW4AU3Q6p.jpg'],0,0,0,['digitalmortgage'],[],https://twitter.com/DigMortgage/status/1165983249077854209,False,,1,https://pbs.twimg.com/media/EC5nlepW4AU3Q6p.jpg,,,,,,,[],,,,
1164992719774789633,1164992719774789633,2019-08-24 01:38:03 IST,2019-08-24,01:38:03,+0530,753233791733334016,digmortgage,Digital Mortgage,,"What true innovations will occur from APIs, and where in mortgage lending will they be?  https://t.co/Nf3vpad9LY  https://t.co/15NLx5Ybzs",en,[],['https://trib.al/GPrkzPu'],['https://pbs.twimg.com/media/ECritFzXsAchwVK.jpg'],0,0,0,[],[],https://twitter.com/DigMortgage/status/1164992719774789633,False,,1,https://pbs.twimg.com/media/ECritFzXsAchwVK.jpg,,,,,,,[],,,,
1164941127771930624,1164941127771930624,2019-08-23 22:13:03 IST,2019-08-23,22:13:03,+0530,753233791733334016,digmortgage,Digital Mortgage,,"Since late 2018, Evergreen has processed over 1,000 hybrid closings across all 65 of their offices and their 1,000+ settlement partners.  https://t.co/p8BGAdqY3a  https://t.co/7oNBt5rL3K",en,[],['https://trib.al/RaFwLN1'],['https://pbs.twimg.com/media/ECqzyB7XYAIkglq.jpg'],0,0,0,[],[],https://twitter.com/DigMortgage/status/1164941127771930624,False,,1,https://pbs.twimg.com/media/ECqzyB7XYAIkglq.jpg,,,,,,,[],,,,
1164895832736501760,1164895832736501760,2019-08-23 19:13:03 IST,2019-08-23,19:13:03,+0530,753233791733334016,digmortgage,Digital Mortgage,,"The evolution of the home buying process requires collaboration by credit unions to ensure compliance, market survival, and technology innovation.   https://t.co/iYdJodCygp  https://t.co/XGbHpiJNNe",en,[],['https://trib.al/CR3iC0W'],['https://pbs.twimg.com/media/ECqKldcXkAApF5W.jpg'],0,0,0,[],[],https://twitter.com/DigMortgage/status/1164895832736501760,False,,1,https://pbs.twimg.com/media/ECqKldcXkAApF5W.jpg,,,,,,,[],,,,
1164631593560027136,1164631593560027136,2019-08-23 01:43:04 IST,2019-08-23,01:43:04,+0530,753233791733334016,digmortgage,Digital Mortgage,,Session: Mortgage APIs 2.0: Where Will True API Innovation Come From?  https://t.co/Yp16dhq3sy  https://t.co/ZumXzNijby,en,[],['https://trib.al/xfSmMnQ'],['https://pbs.twimg.com/media/ECmaQyCXYAA6fRM.jpg'],0,0,1,[],[],https://twitter.com/DigMortgage/status/1164631593560027136,False,,1,https://pbs.twimg.com/media/ECmaQyCXYAA6fRM.jpg,,,,,,,[],,,,
1164578495248445449,1164578495248445449,2019-08-22 22:12:04 IST,2019-08-22,22:12:04,+0530,753233791733334016,digmortgage,Digital Mortgage,,"Understanding the millennial mindset, their values and communication styles are key in reaching this group of first-time homebuyers.  https://t.co/8iczTRImdg  https://t.co/RDlStWe391",en,[],['https://trib.al/PelW3aR'],['https://pbs.twimg.com/media/EClp-CoWsAAso2T.jpg'],0,0,0,[],[],https://twitter.com/DigMortgage/status/1164578495248445449,False,,1,https://pbs.twimg.com/media/EClp-CoWsAAso2T.jpg,,,,,,,[],,,,
1164548051194798086,1164548051194798086,2019-08-22 20:11:06 IST,2019-08-22,20:11:06,+0530,753233791733334016,digmortgage,Digital Mortgage,,"Hear from @BeSmartee! Learn more about the cutting-edge, #digitalmortgage tech they'll be showcasing:  https://t.co/lj6s07orbD  https://t.co/ePcYcx3iim",en,"[{'screen_name': 'besmartee', 'name': 'besmartee®', 'id': '416887488'}]",['https://trib.al/i7DNWwW'],['https://pbs.twimg.com/media/EClOR-FW4AIV6kM.jpg'],0,0,1,['digitalmortgage'],[],https://twitter.com/DigMortgage/status/1164548051194798086,False,,1,https://pbs.twimg.com/media/EClOR-FW4AIV6kM.jpg,,,,,,,[],,,,
1164537744531611649,1164537744531611649,2019-08-22 19:30:09 IST,2019-08-22,19:30:09,+0530,753233791733334016,digmortgage,Digital Mortgage,,"Hear from @WoltersKluwerFS! Learn more about the cutting-edge, #digitalmortgage tech they'll be showcasing:  https://t.co/oZyE9Qhx2p  https://t.co/5zus91X85c",en,"[{'screen_name': 'wolterskluwerfs', 'name': 'wolters kluwer fs', 'id': '456912277'}]",['https://trib.al/sZDatHp'],['https://pbs.twimg.com/media/EClE6DTW4AY7O2f.jpg'],0,0,0,['digitalmortgage'],[],https://twitter.com/DigMortgage/status/1164537744531611649,False,,1,https://pbs.twimg.com/media/EClE6DTW4AY7O2f.jpg,,,,,,,[],,,,
1164265964978003968,1164265964978003968,2019-08-22 01:30:11 IST,2019-08-22,01:30:11,+0530,753233791733334016,digmortgage,Digital Mortgage,,Don't miss this session: Give It to Me Straight: Technology and Digital Trends in the Mortgage Industry.  https://t.co/ttSvKIgdVa  https://t.co/vfvwcqcjRt,en,[],['https://trib.al/iWed6x6'],['https://pbs.twimg.com/media/EChNuQzWwAg2dNq.jpg'],0,0,0,[],[],https://twitter.com/DigMortgage/status/1164265964978003968,False,,1,https://pbs.twimg.com/media/EChNuQzWwAg2dNq.jpg,,,,,,,[],,,,
1164260892416122880,1164260892416122880,2019-08-22 01:10:02 IST,2019-08-22,01:10:02,+0530,753233791733334016,digmortgage,Digital Mortgage,,"As more and more industry stakeholders string together an end to end digital mortgage experience for the consumer, the adoptions of electronic closings and eNotes is growing significantly.  https://t.co/sObceo045T  https://t.co/peayGNrSR5",en,[],['https://trib.al/Mxhz9hY'],['https://pbs.twimg.com/media/EChJHISX4AA5ZHK.jpg'],0,0,0,[],[],https://twitter.com/DigMortgage/status/1164260892416122880,False,,1,https://pbs.twimg.com/media/EChJHISX4AA5ZHK.jpg,,,,,,,[],,,,
1164215346624192513,1164215346624192513,2019-08-21 22:09:03 IST,2019-08-21,22:09:03,+0530,753233791733334016,digmortgage,Digital Mortgage,,What is your primary focus in determining your strategy? Is it best to invest in emerging technologies that are easily implemented?  https://t.co/Nave6Ex6S3  https://t.co/cVzvhMmYgY,en,[],['https://trib.al/zY4dIZq'],['https://pbs.twimg.com/media/ECgfr_dXYAEjEF0.jpg'],0,0,0,[],[],https://twitter.com/DigMortgage/status/1164215346624192513,False,,1,https://pbs.twimg.com/media/ECgfr_dXYAEjEF0.jpg,,,,,,,[],,,,
1164185418268631041,1164185418268631041,2019-08-21 20:10:07 IST,2019-08-21,20:10:07,+0530,753233791733334016,digmortgage,Digital Mortgage,,"Must-attend session: Disruption Is Just Beginning: The Savior &amp; Threat of Big Tech, iBuyers, Lead Providers.  https://t.co/NWF7G4Jy64  https://t.co/A6PS3b06fb",en,[],['https://trib.al/hTl8gaH'],['https://pbs.twimg.com/media/ECgEd9EXsAIagv7.jpg'],0,0,0,[],[],https://twitter.com/DigMortgage/status/1164185418268631041,False,,1,https://pbs.twimg.com/media/ECgEd9EXsAIagv7.jpg,,,,,,,[],,,,
1163913098153091072,1163913098153091072,2019-08-21 02:08:01 IST,2019-08-21,02:08:01,+0530,753233791733334016,digmortgage,Digital Mortgage,,"Since late 2018, Evergreen has processed over 1,000 hybrid closings across all 65 of their offices and their 1,000+ settlement partners.  https://t.co/RrBLVG81UD  https://t.co/To3KsCjtYC",en,[],['https://trib.al/OX5wsOs'],['https://pbs.twimg.com/media/ECcMy00WsAM1T4K.jpg'],0,0,0,[],[],https://twitter.com/DigMortgage/status/1163913098153091072,False,,1,https://pbs.twimg.com/media/ECcMy00WsAM1T4K.jpg,,,,,,,[],,,,
1163852972050329600,1163852972050329600,2019-08-20 22:09:06 IST,2019-08-20,22:09:06,+0530,753233791733334016,digmortgage,Digital Mortgage,,Data and insights on the technology investment and products being used today to help you plan for tomorrow. And maybe a few jokes.  https://t.co/2XzsFWPE1P  https://t.co/GdnYb3rBEk,en,[],['https://trib.al/wXaoMe5'],['https://pbs.twimg.com/media/ECbWHB8X4AANuAc.jpg'],0,0,0,[],[],https://twitter.com/DigMortgage/status/1163852972050329600,False,,1,https://pbs.twimg.com/media/ECbWHB8X4AANuAc.jpg,,,,,,,[],,,,
1163807419081920513,1163807419081920513,2019-08-20 19:08:05 IST,2019-08-20,19:08:05,+0530,753233791733334016,digmortgage,Digital Mortgage,,Adopt marketing strategies designed to quickly supercharge adoption within your organization and make meaning tech-driven change part of your company culture.  https://t.co/luHQUw3sfx  https://t.co/M3EYOV4wTs,en,[],['https://trib.al/0HdWzYm'],['https://pbs.twimg.com/media/ECasrguX4AAaBIG.jpg'],0,0,0,[],[],https://twitter.com/DigMortgage/status/1163807419081920513,False,,1,https://pbs.twimg.com/media/ECasrguX4AAaBIG.jpg,,,,,,,[],,,,
1163550469077102592,1163550469077102592,2019-08-20 02:07:04 IST,2019-08-20,02:07:04,+0530,753233791733334016,digmortgage,Digital Mortgage,,Evergreen Home Loans successfully implemented hybrid closings on 99% of their loan volume in under 5 months.  https://t.co/R5aOqs4yqa  https://t.co/2shjTFrrFV,en,[],['https://trib.al/POg16GS'],['https://pbs.twimg.com/media/ECXC_B0WkAEVAnO.jpg'],0,0,0,[],[],https://twitter.com/DigMortgage/status/1163550469077102592,False,,1,https://pbs.twimg.com/media/ECXC_B0WkAEVAnO.jpg,,,,,,,[],,,,
1163490075075850242,1163490075075850242,2019-08-19 22:07:05 IST,2019-08-19,22:07:05,+0530,753233791733334016,digmortgage,Digital Mortgage,,What benefits have been realized to date from API development and implementation? And what is already table stakes in API usage?   https://t.co/fHffxZe6T7  https://t.co/ae30TtOQXP,en,[],['https://trib.al/S2HVLAe'],['https://pbs.twimg.com/media/ECWMDqdWkAEiCab.jpg'],0,0,1,[],[],https://twitter.com/DigMortgage/status/1163490075075850242,False,,1,https://pbs.twimg.com/media/ECWMDqdWkAEiCab.jpg,,,,,,,[],,,,
1163459620825964545,1163459620825964545,2019-08-19 20:06:04 IST,2019-08-19,20:06:04,+0530,753233791733334016,digmortgage,Digital Mortgage,,"Hear from @snapdocs! Learn more about the cutting-edge, #digitalmortgage tech they'll be showcasing:  https://t.co/dS2sMt9xia  https://t.co/0ReMT0RwDZ",en,"[{'screen_name': 'snapdocs', 'name': 'snapdocs', 'id': '482670866'}]",['https://trib.al/t4Np4gr'],['https://pbs.twimg.com/media/ECVwW-wWwAAx5MN.jpg'],0,0,1,['digitalmortgage'],[],https://twitter.com/DigMortgage/status/1163459620825964545,False,,1,https://pbs.twimg.com/media/ECVwW-wWwAAx5MN.jpg,,,,,,,[],,,,
1162463057970438144,1162463057970438144,2019-08-17 02:06:05 IST,2019-08-17,02:06:05,+0530,753233791733334016,digmortgage,Digital Mortgage,,Achieving Hybrid Digital Closings at Scale: Evergreen’s Success Story.  https://t.co/P6P9iVuFcZ  https://t.co/hfsquiRfXN,en,[],['https://trib.al/5fcZq0Y'],['https://pbs.twimg.com/media/ECHl_aDW4AINM70.jpg'],0,0,0,[],[],https://twitter.com/DigMortgage/status/1162463057970438144,False,,1,https://pbs.twimg.com/media/ECHl_aDW4AINM70.jpg,,,,,,,[],,,,
1162402652635967489,1162402652635967489,2019-08-16 22:06:03 IST,2019-08-16,22:06:03,+0530,753233791733334016,digmortgage,Digital Mortgage,,Join this panel of innovators to envision what the home purchasing experience could really look like in the years to come.  https://t.co/7y2JLqCEj2  https://t.co/DP8Ba01wvg,en,[],['https://trib.al/f4y1qki'],['https://pbs.twimg.com/media/ECGvDVaX4AA4t2q.jpg'],0,0,0,[],[],https://twitter.com/DigMortgage/status/1162402652635967489,False,,1,https://pbs.twimg.com/media/ECGvDVaX4AA4t2q.jpg,,,,,,,[],,,,
