id,conversation_id,created_at,date,time,timezone,user_id,username,name,place,tweet,language,mentions,urls,photos,replies_count,retweets_count,likes_count,hashtags,cashtags,link,retweet,quote_url,video,thumbnail,near,geo,source,user_rt_id,user_rt,retweet_id,reply_to,retweet_date,translate,trans_src,trans_dest
1054759282405789697,1054759282405789697,2018-10-23 21:09:44 IST,2018-10-23,21:09:44,+0530,113036476,onetoughnerd,Rick Snyder,,"We must lead the talent revolution to attract the best and brightest workers. The state that best closes the talent gap will have a competitive advantage over others when companies look at places to locate, expand and create jobs. #IBuildFor",en,[],[],[],3,2,13,['ibuildfor'],[],https://twitter.com/onetoughnerd/status/1054759282405789697,False,https://twitter.com/onetoughnerd/status/1054759027631099904,0,,,,,,,,[],,,,
1054759027631099904,1054759027631099904,2018-10-23 21:08:43 IST,2018-10-23,21:08:43,+0530,113036476,onetoughnerd,Rick Snyder,,Happy to be with @MayorMikeDuggan for this incredible event!  https://t.co/UQ3Ob8KyiD,en,"[{'screen_name': 'mayormikeduggan', 'name': 'mayor mike duggan', 'id': '822713107'}]",[],['https://pbs.twimg.com/media/DqNBvVIXQAAiOdH.jpg'],2,1,12,[],[],https://twitter.com/onetoughnerd/status/1054759027631099904,False,,1,https://pbs.twimg.com/media/DqNBvVIXQAAiOdH.jpg,,,,,,,[],,,,
1054756194492076032,1054756194492076032,2018-10-23 20:57:27 IST,2018-10-23,20:57:27,+0530,113036476,onetoughnerd,Rick Snyder,,Thank you to @Carhartt and all the incredible sponsors at the @SachseConstruct Construction Academy. I even had the chance to make a Carhartt bag! #IBuildFor  https://t.co/rAwJ2PIJIH,en,"[{'screen_name': 'carhartt', 'name': 'carhartt', 'id': '14934247'}, {'screen_name': 'sachseconstruct', 'name': 'sachse construction', 'id': '37746405'}]",[],"['https://pbs.twimg.com/media/DqM_Kc7XcAARXQD.jpg', 'https://pbs.twimg.com/media/DqM_Kc6XQAEdI5j.jpg']",2,2,8,['ibuildfor'],[],https://twitter.com/onetoughnerd/status/1054756194492076032,False,,1,https://pbs.twimg.com/media/DqM_Kc7XcAARXQD.jpg,,,,,,,[],,,,
1054754427914084352,1054754427914084352,2018-10-23 20:50:26 IST,2018-10-23,20:50:26,+0530,113036476,onetoughnerd,Rick Snyder,,"From HVAC to general construction, there are so many great opportunities for students to learn at the @SachseConstruct Construction Academy! #IBuildFor  https://t.co/Tepp0rjXgy",en,"[{'screen_name': 'sachseconstruct', 'name': 'sachse construction', 'id': '37746405'}]",[],['https://pbs.twimg.com/media/DqM9ju_VYAA1cYO.jpg'],1,1,5,['ibuildfor'],[],https://twitter.com/onetoughnerd/status/1054754427914084352,False,,1,https://pbs.twimg.com/media/DqM9ju_VYAA1cYO.jpg,,,,,,,[],,,,
1054753847846019072,1054753847846019072,2018-10-23 20:48:08 IST,2018-10-23,20:48:08,+0530,113036476,onetoughnerd,Rick Snyder,,Students are learning about bricklaying and they actually have the chance to learn how to use an electronic bricklayer. #IBuildFor  https://t.co/9SlPWH7dnw,en,[],[],"['https://pbs.twimg.com/media/DqM9B5EU0AEqG8L.jpg', 'https://pbs.twimg.com/media/DqM9B5FUwAAW2A2.jpg']",2,3,10,['ibuildfor'],[],https://twitter.com/onetoughnerd/status/1054753847846019072,False,,1,https://pbs.twimg.com/media/DqM9B5EU0AEqG8L.jpg,,,,,,,[],,,,
1054753358773477376,1054753358773477376,2018-10-23 20:46:11 IST,2018-10-23,20:46:11,+0530,113036476,onetoughnerd,Rick Snyder,,Excited to be in Detroit today at the @SachseConstruct Construction Academy! This is an incredible program that helps connect young people to critically important careers in the professional trades! #IBuildFor  https://t.co/7Iuw7T1WUk,en,"[{'screen_name': 'sachseconstruct', 'name': 'sachse construction', 'id': '37746405'}]",[],['https://pbs.twimg.com/media/DqM8lh8X0AAqOEj.jpg'],1,3,7,['ibuildfor'],[],https://twitter.com/onetoughnerd/status/1054753358773477376,False,,1,https://pbs.twimg.com/media/DqM8lh8X0AAqOEj.jpg,,,,,,,[],,,,
1054376021162713089,1054376021162713089,2018-10-22 19:46:47 IST,2018-10-22,19:46:47,+0530,113036476,onetoughnerd,Rick Snyder,,[READ] Lt. Gov. Calley: Opioid Addiction Awareness Week calls attention to rising epidemic and what Michiganders can do to stop it. #MIOpioidsAwareness  https://t.co/3Fan1U8PkG,en,[],['https://bit.ly/2AlPo8a'],[],2,0,1,['miopioidsawareness'],[],https://twitter.com/onetoughnerd/status/1054376021162713089,False,,0,,,,,,,,[],,,,
1053763025499553792,1053763025499553792,2018-10-21 03:10:57 IST,2018-10-21,03:10:57,+0530,113036476,onetoughnerd,Rick Snyder,,"I’m really looking forward to seeing how you look in maize and blue, @briancalley! #GOBLUE",en,"[{'screen_name': 'briancalley', 'name': 'brian calley', 'id': '18299237'}]",[],[],7,8,76,['goblue'],[],https://twitter.com/onetoughnerd/status/1053763025499553792,False,https://twitter.com/briancalley/status/1053759144631644160,0,,,,,,,,[],,,,
1053282211829559302,1053282211829559302,2018-10-19 19:20:22 IST,2018-10-19,19:20:22,+0530,113036476,onetoughnerd,Rick Snyder,,"Tomorrow is the Michigan/Michigan State game &amp; in the spirit of the rivalry, Lt. Gov. @briancalley &amp; I have made a friendly wager. The loser will have to wear the winner's sweatshirt for a day. #GoBlue   Where do Michiganders stand? RT for @UMichFootball or like for @MSU_Football  https://t.co/Okqpv2DF2n",en,"[{'screen_name': 'briancalley', 'name': 'brian calley', 'id': '18299237'}, {'screen_name': 'umichfootball', 'name': 'michigan football', 'id': '27902825'}, {'screen_name': 'msu_football', 'name': 'michigan state football', 'id': '33587536'}]",[],['https://pbs.twimg.com/media/Dp37cAgXcAAOOTr.jpg'],7,29,67,['goblue'],[],https://twitter.com/onetoughnerd/status/1053282211829559302,False,,1,https://pbs.twimg.com/media/Dp37cAgXcAAOOTr.jpg,,,,,,,[],,,,
1052955245024808960,1052955245024808960,2018-10-18 21:41:08 IST,2018-10-18,21:41:08,+0530,113036476,onetoughnerd,Rick Snyder,,"Thank you to the commission and corporate partners who helped make this important memorial possible. This constant reminder of sacrifice is a wonderful, lasting tribute to the heroes we lost and the families who lost their loved ones.",en,[],[],[],2,6,13,[],[],https://twitter.com/onetoughnerd/status/1052955245024808960,False,https://twitter.com/migovernment/status/1052952706820833288,0,,,,,,,,[],,,,
