id,conversation_id,created_at,date,time,timezone,user_id,username,name,place,tweet,language,mentions,urls,photos,replies_count,retweets_count,likes_count,hashtags,cashtags,link,retweet,quote_url,video,thumbnail,near,geo,source,user_rt_id,user_rt,retweet_id,reply_to,retweet_date,translate,trans_src,trans_dest
1385626551472070656,1385626551472070656,2021-04-23 21:38:08 IST,2021-04-23,21:38:08,+0530,15999704,sbam,SBAM,,"With the cost of responding to a cyber-attack now averaging almost $4 million, small businesses need to ensure they are prepared and ready to respond. Join @BrooksKushman next week for a webinar to learn aspects of a cybersecurity plan you should consider.  https://t.co/YOfW7ipdCG",en,"[{'screen_name': 'brookskushman', 'name': 'brooks kushman', 'id': '493348492'}]",['https://bit.ly/3ndqLkV'],[],0,0,0,[],[],https://twitter.com/SBAM/status/1385626551472070656,False,,0,,,,,,,,[],,,,
1385622770717970438,1385622770717970438,2021-04-23 21:23:06 IST,2021-04-23,21:23:06,+0530,15999704,sbam,SBAM,,"Restaurant Revitalization Fund provides emergency assistance for eligible restaurants, bars, and other qualifying businesses impacted by COVID-19.  https://t.co/X3DAydJ00X",en,[],['https://bit.ly/3sLG3hZ'],[],0,0,0,[],[],https://twitter.com/SBAM/status/1385622770717970438,False,,0,,,,,,,,[],,,,
1385606405177151496,1385606405177151496,2021-04-23 20:18:04 IST,2021-04-23,20:18:04,+0530,15999704,sbam,SBAM,,"Upper Peninsula small business owners, join us next Wednesday for a virtual Owner2Owner exclusive to small business owners in your area! Register today ➡️  https://t.co/QRkGrDE0lg",en,[],['https://bit.ly/2QesDh6'],[],0,0,0,[],[],https://twitter.com/SBAM/status/1385606405177151496,False,,0,,,,,,,,[],,,,
1385330132169236480,1385330132169236480,2021-04-23 02:00:16 IST,2021-04-23,02:00:16,+0530,15999704,sbam,SBAM,,Here's what we covered on The Small Business Briefing today: ➡ Latest infection trends ➡ Vaccine updates ➡ New tax credit  ➡ Earth Day  https://t.co/G4AjZ7CjBu,en,[],['https://bit.ly/32CpTgf'],[],0,0,1,[],[],https://twitter.com/SBAM/status/1385330132169236480,False,,0,,,,,,,,[],,,,
1384880359205220354,1384880359205220354,2021-04-21 20:13:02 IST,2021-04-21,20:13:02,+0530,15999704,sbam,SBAM,,".@ConsumersEnergy is offering a new Nest thermostat for FREE, get yours by April 22 (for qualified customers) ➡️  https://t.co/1TMHiSZCQr  https://t.co/IdqzTd7RZt",en,"[{'screen_name': 'consumersenergy', 'name': 'consumers energy', 'id': '63735119'}]",['https://bit.ly/3atSmcm'],['https://pbs.twimg.com/media/EzgVWNPWEAQyb_2.jpg'],0,0,0,[],[],https://twitter.com/SBAM/status/1384880359205220354,False,,1,https://pbs.twimg.com/media/EzgVWNPWEAQyb_2.jpg,,,,,,,[],,,,
1384568847223635969,1384568847223635969,2021-04-20 23:35:11 IST,2021-04-20,23:35:11,+0530,15999704,sbam,SBAM,,"Tomorrow, understand the good, bad and ugly of the Biden Tax and Spending Plan in our webinar with industry experts! Register now ➡️  https://t.co/nkfn7F51Zy",en,[],['https://bit.ly/324DQTy'],[],0,0,0,[],[],https://twitter.com/SBAM/status/1384568847223635969,False,,0,,,,,,,,[],,,,
1384235331684212749,1384235331684212749,2021-04-20 01:29:55 IST,2021-04-20,01:29:55,+0530,15999704,sbam,SBAM,,Did you miss today's briefing? Hosts Rob Fowler and Brian Calley covered: ➡ Newest trends for #DataMonday ➡ Signals from the governor on the potential for further restrictions ➡ Vaccine updates ➡ Lessons from other countries ➡ Restaurant jobs report  https://t.co/ThlousxzQk,en,[],['https://bit.ly/2QGpztP'],[],0,0,1,['datamonday'],[],https://twitter.com/SBAM/status/1384235331684212749,False,,0,,,,,,,,[],,,,
1384189428503957517,1384189428503957517,2021-04-19 22:27:31 IST,2021-04-19,22:27:31,+0530,15999704,sbam,SBAM,,"Hosts Rob Fowler and Brian Calley are bringing you the latest news impacting Michigan small business on today's episode of The Small Business Briefing. Join us live on Facebook at 3 PM, or watch via Zoom ➡️  https://t.co/T3vODhBdjV  https://t.co/ImntK0xgeg",en,[],['https://bit.ly/3du5D6E'],['https://pbs.twimg.com/media/EzWg8ooVcAUu1Ti.jpg'],0,0,0,[],[],https://twitter.com/SBAM/status/1384189428503957517,False,,1,https://pbs.twimg.com/media/EzWg8ooVcAUu1Ti.jpg,,,,,,,[],,,,
1384180006071406596,1384180006071406596,2021-04-19 21:50:04 IST,2021-04-19,21:50:04,+0530,15999704,sbam,SBAM,,"Midland, Saginaw, and Bay City area small business owners, join us this Thursday for a virtual Owner2Owner event! These events are exclusively for small business owners to build a sense of community in your region. Register here ➡️  https://t.co/Wkm5pROGpb",en,[],['https://bit.ly/3x5O5FJ'],[],0,0,0,[],[],https://twitter.com/SBAM/status/1384180006071406596,False,,0,,,,,,,,[],,,,
1383144742989479939,1383144742989479939,2021-04-17 01:16:18 IST,2021-04-17,01:16:18,+0530,15999704,sbam,SBAM,,This revised epidemic order states that masks are now required for children ages 2 and up. Previous orders stated a minimum age of 5.,en,[],[],[],0,0,0,[],[],https://twitter.com/SBAM/status/1383144742989479939,False,https://twitter.com/migovernment/status/1383133786104328192,0,,,,,,,,[],,,,
1383070953006104579,1383070953006104579,2021-04-16 20:23:06 IST,2021-04-16,20:23:06,+0530,15999704,sbam,SBAM,,"Save the date! @themcsb Small Business Awards Gala will be held on July 20, 2021 in Lansing. Visit  https://t.co/DFqk0V9xRz to reserve your spot. #celebratesmall #smallbusiness #supportsmall  https://t.co/jdz3GoZNqw",en,"[{'screen_name': 'themcsb', 'name': 'michigan celebrates', 'id': '80911604'}]",['http://michigancelebrates.org'],['https://pbs.twimg.com/media/EzGns1eXAAAGX3S.jpg'],0,0,0,"['celebratesmall', 'smallbusiness', 'supportsmall']",[],https://twitter.com/SBAM/status/1383070953006104579,False,,1,https://pbs.twimg.com/media/EzGns1eXAAAGX3S.jpg,,,,,,,[],,,,
1382795894421082115,1382795894421082115,2021-04-16 02:10:06 IST,2021-04-16,02:10:06,+0530,15999704,sbam,SBAM,,How would your team describe meetings in your organization?  Inspiring? Fun? Productive? But what would the honest answer often be?  Boring? Repetitive? Inefficient?  https://t.co/PmdSiSyyAi,en,[],['https://bit.ly/3gbFTO0'],[],0,0,0,[],[],https://twitter.com/SBAM/status/1382795894421082115,False,,0,,,,,,,,[],,,,
1382795389498183681,1382795389498183681,2021-04-16 02:08:06 IST,2021-04-16,02:08:06,+0530,15999704,sbam,SBAM,,"Today on the Small Business Briefing, hosts Rob Fowler and Brian Calley covered: ➡ COVID-19 workplace safety rules extended ➡ Shuttered venues grant update ➡ Facebook releases a survey on the impact of the pandemic on small business ➡ J&amp;J vaccine pause  https://t.co/ukrREOD1h0",en,[],['https://bit.ly/2QxgAvi'],[],0,0,0,[],[],https://twitter.com/SBAM/status/1382795389498183681,False,,0,,,,,,,,[],,,,
1382728943883681795,1382728943883681795,2021-04-15 21:44:04 IST,2021-04-15,21:44:04,+0530,15999704,sbam,SBAM,,"Understand the good, bad and ugly of the Biden Tax and Spending Plan in our upcoming webinar! We have a great panel of speakers dedicated to helping small businesses, register below!  https://t.co/nkfn7F51Zy",en,[],['https://bit.ly/324DQTy'],[],0,0,0,[],[],https://twitter.com/SBAM/status/1382728943883681795,False,,0,,,,,,,,[],,,,
1382435587639087105,1382435587639087105,2021-04-15 02:18:23 IST,2021-04-15,02:18:23,+0530,15999704,sbam,SBAM,,"The governor is calling on high schools to voluntarily pause in-person learning for two weeks after their spring break, that youth sports also be suspended for two weeks, and that Michigan residents choose to avoid indoor dining.  https://t.co/fQoS2LR3H2",en,[],['https://bit.ly/3deIqFj'],[],0,0,0,[],[],https://twitter.com/SBAM/status/1382435587639087105,False,,0,,,,,,,,[],,,,
1381665761735888897,1381665761735888897,2021-04-12 23:19:22 IST,2021-04-12,23:19:22,+0530,15999704,sbam,SBAM,,"It's #DataMonday on The Small Business Briefing. Tune in at 3pm ET for a look at the latest infection and vaccine trends, plus: updated CDC guidance and when we might expect to return to in-person office work.    https://t.co/VGa9zLgs5l",en,[],['https://www.sbam.org/event/the-small-business-briefing/2021-04-12/'],[],0,0,1,['datamonday'],[],https://twitter.com/SBAM/status/1381665761735888897,False,,0,,,,,,,,[],,,,
1381650089131839491,1381650089131839491,2021-04-12 22:17:05 IST,2021-04-12,22:17:05,+0530,15999704,sbam,SBAM,,MIOSHA Emergency Rules put in place last October remain in effect until at least April 16th and are expected to be extended possibly for another six months.  https://t.co/hlqqo3oqym,en,[],['https://bit.ly/2PPWb4C'],[],0,0,1,[],[],https://twitter.com/SBAM/status/1381650089131839491,False,,0,,,,,,,,[],,,,
1380582567905222662,1380582567905222662,2021-04-09 23:35:08 IST,2021-04-09,23:35:08,+0530,15999704,sbam,SBAM,,"Understand the good, bad and ugly of the Biden Tax and Spending Plan. Some are direct to a business or individual, some change intrafamily transactions and others change portfolio valuations and investing.  https://t.co/nkfn7F51Zy",en,[],['https://bit.ly/324DQTy'],[],0,0,1,[],[],https://twitter.com/SBAM/status/1380582567905222662,False,,0,,,,,,,,[],,,,
1380580042565156871,1380580042565156871,2021-04-09 23:25:06 IST,2021-04-09,23:25:06,+0530,15999704,sbam,SBAM,,"It’s official. We have survived one year of a global pandemic. While the world tries to navigate this new normal, employers are faced with an ongoing challenge: how to support employees in an ever-changing business environment. #pandemic #newnormal  https://t.co/1vvZGV2xnS",en,[],['https://bit.ly/2Rl8wxZ'],[],0,0,1,"['pandemic', 'newnormal']",[],https://twitter.com/SBAM/status/1380580042565156871,False,,0,,,,,,,,[],,,,
1380261708413997057,1380261708413997057,2021-04-09 02:20:09 IST,2021-04-09,02:20:09,+0530,15999704,sbam,SBAM,,"Macomb area small business owners, be sure to join us next Wednesday for an Owner2Owner event and connect with other business owners in your area! Register here ➡️   https://t.co/hR8VwPeLjU. #smallbusiness #network #supportsmall",en,[],['https://bit.ly/3dJvHJO'],[],0,0,0,"['smallbusiness', 'network', 'supportsmall']",[],https://twitter.com/SBAM/status/1380261708413997057,False,,0,,,,,,,,[],,,,
1380191470842437635,1380191470842437635,2021-04-08 21:41:04 IST,2021-04-08,21:41:04,+0530,15999704,sbam,SBAM,,"With hosts Rob Fowler and Brian Calley out, today's episode of the Small Business Briefing has been cancelled. Be sure to tune in Monday, April 12 for the latest news affecting small businesses, and of course, #DataMonday ➡️  https://t.co/MkJKpTGWXT.",en,[],['https://bit.ly/2POpapl'],[],0,0,0,['datamonday'],[],https://twitter.com/SBAM/status/1380191470842437635,False,,0,,,,,,,,[],,,,
1379838407371788292,1379838407371788292,2021-04-07 22:18:07 IST,2021-04-07,22:18:07,+0530,15999704,sbam,SBAM,,"The Department of Health and Human Services is reinstating a standard 14-day quarantine for those who have had close contact with anyone who has had COVID-19, which removes the option for a 10-day quarantine.  https://t.co/5rj4Fj3jYo",en,[],['https://bit.ly/3cUPnvc'],[],0,0,0,[],[],https://twitter.com/SBAM/status/1379838407371788292,False,,0,,,,,,,,[],,,,
1379501399898263553,1379501399898263553,2021-04-06 23:58:58 IST,2021-04-06,23:58:58,+0530,15999704,sbam,SBAM,,"SBAM president @briancalley stated, ""If used effectively, these dollars can help Michigan rebound from the economic, health and educational gaps the pandemic created.” Read the press release➡️   https://t.co/6QGCMPFx6u",en,"[{'screen_name': 'briancalley', 'name': 'brian calley', 'id': '18299237'}]",['https://bit.ly/2PW4eMN'],[],0,1,9,[],[],https://twitter.com/SBAM/status/1379501399898263553,False,https://twitter.com/DetroitChamber/status/1379458038260768770,0,,,,,,,,[],,,,
1379482820549210112,1379482820549210112,2021-04-06 22:45:08 IST,2021-04-06,22:45:08,+0530,15999704,sbam,SBAM,,U.S. employers are taking measures to make vaccines more accessible to their employees and communicating plans to bring their employees back to the office.  https://t.co/C6mBVnY1vM,en,[],['https://bit.ly/3fZgreP'],[],0,0,0,[],[],https://twitter.com/SBAM/status/1379482820549210112,False,,0,,,,,,,,[],,,,
1379169495898587143,1379169495898587143,2021-04-06 02:00:06 IST,2021-04-06,02:00:06,+0530,15999704,sbam,SBAM,,"On The Small Business Briefing today: ➡ Check out the latest numbers for #DataMonday ➡ Special guest Terry Terry, owner of MessageMakers and UrbanBeat ➡ #Unemployment expansion expired, what are the implications? ➡ #PPP and EIDL changes  https://t.co/HtMQZ541LM",en,[],['https://bit.ly/2PVYanE'],[],0,1,1,"['datamonday', 'unemployment', 'ppp']",[],https://twitter.com/SBAM/status/1379169495898587143,False,,0,,,,,,,,[],,,,
1378067228936003584,1378067228936003584,2021-04-03 01:00:05 IST,2021-04-03,01:00:05,+0530,15999704,sbam,SBAM,,Set sail on Lake Huron during a summer sunset while focusing on a simple breathing technique in @BCBSM webinar next week ➡️  https://t.co/RNbdiPJmBk,en,"[{'screen_name': 'bcbsm', 'name': 'bcbsm', 'id': '40766251'}]",['https://bit.ly/2OhQ9cb'],[],0,0,1,[],[],https://twitter.com/SBAM/status/1378067228936003584,False,,0,,,,,,,,[],,,,
1377998034416627712,1377998034416627712,2021-04-02 20:25:08 IST,2021-04-02,20:25:08,+0530,15999704,sbam,SBAM,,A remote work site is an extension of the company office and should be reasonably safe and secure in order to prevent employee injuries. Check out these helpful tips from @accidentfund.  https://t.co/KTZxP0KIxK,en,"[{'screen_name': 'accidentfund', 'name': 'accident fund', 'id': '148366756'}]",['https://bit.ly/2Pf6TkU'],[],0,0,0,[],[],https://twitter.com/SBAM/status/1377998034416627712,False,,0,,,,,,,,[],,,,
1377650229999198209,1377650229999198209,2021-04-01 21:23:04 IST,2021-04-01,21:23:04,+0530,15999704,sbam,SBAM,,"Gen Z feel like they are missing out on career growth due to remote work. Born between 1997 and 2012, it’s those in their early 20’s that are facing these drawbacks to remote work.  https://t.co/BWhi7mNL8W",en,[],['https://bit.ly/2Pqrti1'],[],0,0,0,[],[],https://twitter.com/SBAM/status/1377650229999198209,False,,0,,,,,,,,[],,,,
1377641680636088323,1377641680636088323,2021-04-01 20:49:06 IST,2021-04-01,20:49:06,+0530,15999704,sbam,SBAM,,Tune in to The Small Business Briefing at 3pm ET with @rob_fowler_sbam and @briancalley --   ➡  Conversation with @BrownIronBrew owner ➡  Lots of vaccine news ➡  Is the Governor considering new restrictions? ➡  Why is the virus spreading so fast?   https://t.co/SLG8bE98h7,en,"[{'screen_name': 'rob_fowler_sbam', 'name': 'rob fowler', 'id': '92356276'}, {'screen_name': 'briancalley', 'name': 'brian calley', 'id': '18299237'}, {'screen_name': 'brownironbrew', 'name': 'brown iron brewhouse', 'id': '2319895399'}]",['https://www.sbam.org/event/the-small-business-briefing/2021-04-01/'],[],0,0,0,[],[],https://twitter.com/SBAM/status/1377641680636088323,False,,0,,,,,,,,[],,,,
1377301189373612035,1377301189373612035,2021-03-31 22:16:07 IST,2021-03-31,22:16:07,+0530,15999704,sbam,SBAM,,CDC issues employer vaccination program guidance.  https://t.co/QCMrEzHz1R,en,[],['https://bit.ly/3wcxFe9'],[],0,0,0,[],[],https://twitter.com/SBAM/status/1377301189373612035,False,,0,,,,,,,,[],,,,
1376999928636055558,1376999928636055558,2021-03-31 02:19:01 IST,2021-03-31,02:19:01,+0530,15999704,sbam,SBAM,,New legislation extends the PPP application deadline from March 31 to May 31.  https://t.co/i8spyr3K6W,en,[],['https://bit.ly/39tm68G'],[],0,1,0,[],[],https://twitter.com/SBAM/status/1376999928636055558,False,,0,,,,,,,,[],,,,
1376959688424763393,1376959688424763393,2021-03-30 23:39:07 IST,2021-03-30,23:39:07,+0530,15999704,sbam,SBAM,,Learn everything you need to know about the American Rescue Plan tomorrow in an informative webinar with The Ahola Corporation.  https://t.co/zqPZapUlEP,en,[],['https://bit.ly/3d1aH0Q'],[],0,0,0,[],[],https://twitter.com/SBAM/status/1376959688424763393,False,,0,,,,,,,,[],,,,
1376636033136263168,1376636033136263168,2021-03-30 02:13:01 IST,2021-03-30,02:13:01,+0530,15999704,sbam,SBAM,,"Ann Arbor small business owners, we would love to see you at our regional Owner2Owner virtual event this Wednesday! #smallbusiness #network  https://t.co/dPtDZXZqYq",en,[],['https://bit.ly/31ARayN'],[],0,0,0,"['smallbusiness', 'network']",[],https://twitter.com/SBAM/status/1376636033136263168,False,,0,,,,,,,,[],,,,
1376581691037343753,1376581691037343753,2021-03-29 22:37:05 IST,2021-03-29,22:37:05,+0530,15999704,sbam,SBAM,,"There is no lack of information on issues confronting small businesses, particularly post-COVID. But knowing the challenges is not the same as knowing how to solve them. The real challenge, then, is about “how.” How does your business respond?  https://t.co/9Wum203rCd",en,[],['https://bit.ly/3cvDQSE'],[],0,0,0,[],[],https://twitter.com/SBAM/status/1376581691037343753,False,,0,,,,,,,,[],,,,
1375459796934086659,1375459796934086659,2021-03-26 20:19:05 IST,2021-03-26,20:19:05,+0530,15999704,sbam,SBAM,,"Join us next Wednesday for an informative webinar with @AholaCorp where we breakdown the American Rescue Plan Act, the newest COVID-19 stimulus package signed into law March 2021.  https://t.co/zqPZapUlEP",en,"[{'screen_name': 'aholacorp', 'name': 'ahola hr solutions | payroll', 'id': '1934787619'}]",['https://bit.ly/3d1aH0Q'],[],0,2,1,[],[],https://twitter.com/SBAM/status/1375459796934086659,False,,0,,,,,,,,[],,,,
1375141028601196551,1375141028601196551,2021-03-25 23:12:24 IST,2021-03-25,23:12:24,+0530,15999704,sbam,SBAM,,#tbt 1 year ago today @briancalley was celebrating his birthday socially-distanced in his car 🎉 At least he's out of the car this year! Tune in to the Small Business Briefing today at 3 ➡️  https://t.co/TWb7fV1Jy4.  https://t.co/UXAnX2NK1e,en,"[{'screen_name': 'briancalley', 'name': 'brian calley', 'id': '18299237'}]",['https://bit.ly/3rikIvz'],[],0,0,5,['tbt'],[],https://twitter.com/SBAM/status/1375141028601196551,False,,1,https://pbs.twimg.com/ext_tw_video_thumb/1375140994950238211/pu/img/ljASX0gL3pSSVEC8.jpg,,,,,,,[],,,,
1374769286217150465,1374769286217150465,2021-03-24 22:35:14 IST,2021-03-24,22:35:14,+0530,15999704,sbam,SBAM,,COBRA and the ARPA – what you need to know if you have 20 or more employees.  https://t.co/Ou5TzpjA6A,en,[],['https://bit.ly/2P35GwL'],[],0,0,0,[],[],https://twitter.com/SBAM/status/1374769286217150465,False,,0,,,,,,,,[],,,,
1374377159536431116,1374377159536431116,2021-03-23 20:37:04 IST,2021-03-23,20:37:04,+0530,15999704,sbam,SBAM,,Don't miss out! Make sure to join us and @Facebook tomorrow for a webinar that will teach you about what the platform can offer your small business ➡️  https://t.co/ZyL8UUbEEq.  https://t.co/HCvyRBKBPX,en,"[{'screen_name': 'facebook', 'name': 'facebook', 'id': '2425151'}]",['https://bit.ly/3bOSq7D'],['https://pbs.twimg.com/media/ExLEvXvUYAsmC-q.png'],0,0,0,[],[],https://twitter.com/SBAM/status/1374377159536431116,False,,1,https://pbs.twimg.com/media/ExLEvXvUYAsmC-q.png,,,,,,,[],,,,
1374058811871399939,1374058811871399939,2021-03-22 23:32:04 IST,2021-03-22,23:32:04,+0530,15999704,sbam,SBAM,,"Today's episode of the Small Business Briefing will cover the new epidemic order, the AstraZeneca U.S. trial results and of course the latest trends in data on #DataMonday. Watch live on Facebook or via Zoom in an hour ➡️  https://t.co/Huj5flxdg6.  https://t.co/h74KJj13Zf",en,[],['https://bit.ly/3c7ME14'],['https://pbs.twimg.com/media/ExGjNP7WUAE3Xmx.jpg'],0,0,0,['datamonday'],[],https://twitter.com/SBAM/status/1374058811871399939,False,,1,https://pbs.twimg.com/media/ExGjNP7WUAE3Xmx.jpg,,,,,,,[],,,,
1374034396332888070,1374034396332888070,2021-03-22 21:55:03 IST,2021-03-22,21:55:03,+0530,15999704,sbam,SBAM,,Join @MichiganLEO next week for a webinar on Employment and Training and discover the variety of employer resources they can provide your business with. Register here ➡️  https://t.co/Q65Bf5uLVE.,en,"[{'screen_name': 'michiganleo', 'name': 'michigan dept. of labor and economic opportunity', 'id': '414299045'}]",['https://bit.ly/2OSmuGB'],[],0,0,0,[],[],https://twitter.com/SBAM/status/1374034396332888070,False,,0,,,,,,,,[],,,,
1372932422266986496,1372932422266986496,2021-03-19 20:56:11 IST,2021-03-19,20:56:11,+0530,15999704,sbam,SBAM,,The MDHHS Gatherings and Face Mask Order has been updated to increase capacity at outdoor stadiums and arenas. Take a look.   https://t.co/CNbk93weSi,en,[],['https://www.sbam.org/mdhhs-updates-gatherings-and-face-mask-order-effective-march-22/'],[],0,0,1,[],[],https://twitter.com/SBAM/status/1372932422266986496,False,,0,,,,,,,,[],,,,
1372919305843658754,1372919305843658754,2021-03-19 20:04:04 IST,2021-03-19,20:04:04,+0530,15999704,sbam,SBAM,,"Make sure to join us and @Facebook next Wednesday to learn more about what Facebook's platform has to offer your small business. Don't miss out, register now! ➡️  https://t.co/ZyL8UUtg30.  https://t.co/8yDQrdXF5H",en,"[{'screen_name': 'facebook', 'name': 'facebook', 'id': '2425151'}]",['https://bit.ly/3bOSq7D'],['https://pbs.twimg.com/media/Ew2W1SQW8AIH1xs.png'],0,0,0,[],[],https://twitter.com/SBAM/status/1372919305843658754,False,,1,https://pbs.twimg.com/media/Ew2W1SQW8AIH1xs.png,,,,,,,[],,,,
1372603435917393923,1372603435917393923,2021-03-18 23:08:55 IST,2021-03-18,23:08:55,+0530,15999704,sbam,SBAM,,"Today on The Small Business Briefing: ➡ A conversation with Regina Gaines, owner of @HouseofPureVin  ➡ Budget update ➡ A look at relief for restaurants  Thank you to our sponsor HealthScreen and HealthyVisitor.    https://t.co/loMaxghlz1",en,"[{'screen_name': 'houseofpurevin', 'name': 'house of pure vin', 'id': '3311826127'}]",['https://www.sbam.org/event/the-small-business-briefing-2021-03-18/'],[],0,0,0,[],[],https://twitter.com/SBAM/status/1372603435917393923,False,,0,,,,,,,,[],,,,
1372580272827478027,1372580272827478027,2021-03-18 21:36:53 IST,2021-03-18,21:36:53,+0530,15999704,sbam,SBAM,,Take a look at how AJ's Walleye Lodge Bar &amp; Grille created an outdoor space in the UP from the Weatherization grants we distributed earlier this year. #supportMIrestaurants  https://t.co/UWlLPBF8uj,en,[],[],[],0,0,1,['supportmirestaurants'],[],https://twitter.com/SBAM/status/1372580272827478027,False,,1,https://pbs.twimg.com/ext_tw_video_thumb/1372580237557514240/pu/img/F-5wRnp8D1BMNwE5.jpg,,,,,,,[],,,,
1372339991041380357,1372339991041380357,2021-03-18 05:42:05 IST,2021-03-18,05:42:05,+0530,15999704,sbam,SBAM,,"As eligibility expands for the COVID-19 vaccine, do you know what options are available to you?  https://t.co/xWco4ax5nj",en,[],['https://bit.ly/3twhZQU'],[],0,0,0,[],[],https://twitter.com/SBAM/status/1372339991041380357,False,,0,,,,,,,,[],,,,
1372235958486196224,1372235958486196224,2021-03-17 22:48:42 IST,2021-03-17,22:48:42,+0530,15999704,sbam,SBAM,,"Employees are stressed out and need support from their managers. They are tired of the pandemic, tired of zoom calls, and for some…tired of working from home.  https://t.co/g11GndwL5h",en,[],['https://bit.ly/3eMTIlh'],[],0,1,0,[],[],https://twitter.com/SBAM/status/1372235958486196224,False,,0,,,,,,,,[],,,,
1371910184184913921,1371910184184913921,2021-03-17 01:14:11 IST,2021-03-17,01:14:11,+0530,15999704,sbam,SBAM,,We're looking forward to this! Here's how to sign up:  https://t.co/AgPEAo1rSH,en,[],['https://www.sbam.org/event/raising-awareness-of-your-business-offerings-presented-by-facebook/'],[],0,0,1,[],[],https://twitter.com/SBAM/status/1371910184184913921,False,https://twitter.com/deteconomicclub/status/1371902722761498627,0,,,,,,,,[],,,,
1371888800398475264,1371888800398475264,2021-03-16 23:49:13 IST,2021-03-16,23:49:13,+0530,15999704,sbam,SBAM,,A big thank you to @kerryebersole and Dr. Mona Hanna-Attisha for joining today's #LC2021 meeting to discuss the rollout of the safe and effective COVID-19 vaccines here in Michigan.  https://t.co/JqSCm8YjMV,en,"[{'screen_name': 'kerryebersole', 'name': 'kerry ebersole', 'id': '92118635'}]",[],['https://pbs.twimg.com/media/Ewns4haXAAEIDCH.jpg'],0,0,3,['lc2021'],[],https://twitter.com/SBAM/status/1371888800398475264,False,,1,https://pbs.twimg.com/media/Ewns4haXAAEIDCH.jpg,,,,,,,[],,,,
1371887804930781193,1371887804930781193,2021-03-16 23:45:15 IST,2021-03-16,23:45:15,+0530,15999704,sbam,SBAM,,Next Wednesday we're hosting a webinar in partnership with Facebook to help small business owners understand what Facebook's platform has to offer your business. Don't want to miss this exclusive opportunity ➡️  https://t.co/ZyL8UUtg30.  https://t.co/j2SnTbf21I,en,[],['https://bit.ly/3bOSq7D'],['https://pbs.twimg.com/media/Ewnsr8AWEAUpRZl.jpg'],0,1,1,[],[],https://twitter.com/SBAM/status/1371887804930781193,False,,1,https://pbs.twimg.com/media/Ewnsr8AWEAUpRZl.jpg,,,,,,,[],,,,
1371876644881903616,1371876644881903616,2021-03-16 23:00:55 IST,2021-03-16,23:00:55,+0530,15999704,sbam,SBAM,,"The SBAM Leadership Council is meeting virtually. Right now the group is hearing from four justices on the Michigan Supreme Court: @BridgetMaryMc, @EMerrillWelch, @_JusticeClement and Justice Cavanagh. Thank you for spending time sharing your insight with our members. #LC2021  https://t.co/TMdLwjUSrP",en,"[{'screen_name': 'bridgetmarymc', 'name': 'chief justice mccormack', 'id': '374784784'}, {'screen_name': 'emerrillwelch', 'name': 'elizabeth welch', 'id': '926983469355454464'}, {'screen_name': '_justiceclement', 'name': 'elizabeth clement', 'id': '976561606283988992'}]",[],['https://pbs.twimg.com/media/EwnhTvlWgAE8WcZ.png'],0,1,8,['lc2021'],[],https://twitter.com/SBAM/status/1371876644881903616,False,,1,https://pbs.twimg.com/media/EwnhTvlWgAE8WcZ.png,,,,,,,[],,,,
