id,conversation_id,created_at,date,time,timezone,user_id,username,name,place,tweet,language,mentions,urls,photos,replies_count,retweets_count,likes_count,hashtags,cashtags,link,retweet,quote_url,video,thumbnail,near,geo,source,user_rt_id,user_rt,retweet_id,reply_to,retweet_date,translate,trans_src,trans_dest
1357765946824343556,1357765946824343556,2021-02-06 00:30:02 IST,2021-02-06,00:30:02,+0530,44674512,wallstsurvivor,Wall Street Survivor,,Become so financially secure that you forget it's pay day #personalfinance #inspiration  https://t.co/5VlTHFZzxB,en,[],[],['https://pbs.twimg.com/media/EtfA7lVXAAA1R_I.jpg'],2,1,2,"['personalfinance', 'inspiration']",[],https://twitter.com/wallstsurvivor/status/1357765946824343556,False,,1,https://pbs.twimg.com/media/EtfA7lVXAAA1R_I.jpg,,,,,,,[],,,,
1357705548595101697,1357705548595101697,2021-02-05 20:30:02 IST,2021-02-05,20:30:02,+0530,44674512,wallstsurvivor,Wall Street Survivor,,You every month until you started taking advantage of  https://t.co/VX4csHly5F for free saving and investment tips and resources.  https://t.co/FUWDGXMKP2,en,[],['http://WallStreetSurvivor.com'],['https://pbs.twimg.com/media/EteJ_36WQAEAKYk.jpg'],0,1,0,[],[],https://twitter.com/wallstsurvivor/status/1357705548595101697,False,,1,https://pbs.twimg.com/media/EteJ_36WQAEAKYk.jpg,,,,,,,[],,,,
1357403560674213888,1357403560674213888,2021-02-05 00:30:02 IST,2021-02-05,00:30:02,+0530,44674512,wallstsurvivor,Wall Street Survivor,,"Create your own #StockMarketGame for your class or club, or join one of our Monthly Contests and compete for your share of $2,000 in prizes! --&amp;gt;  https://t.co/F9WAx4Dtfg  https://t.co/EaoB0iXemx",en,[],['https://www.wallstreetsurvivor.com/stock-market-game/'],['https://pbs.twimg.com/media/EtZ3V6EXcAAYfFi.jpg'],0,0,0,['stockmarketgame'],[],https://twitter.com/wallstsurvivor/status/1357403560674213888,False,,1,https://pbs.twimg.com/media/EtZ3V6EXcAAYfFi.jpg,,,,,,,[],,,,
1357371971953115136,1357371971953115136,2021-02-04 22:24:31 IST,2021-02-04,22:24:31,+0530,44674512,wallstsurvivor,Wall Street Survivor,,"Did you know you can create a league on the Wall Street Survivor website?  The league can be public, allowing access to several people, but it can also be private, and you can send the invitation only to your close friends or family. Learn more here:  https://t.co/NTcKnkO77I  https://t.co/7d6EsOOlrU",en,[],['http://bit.ly/3tunjEY'],[],0,0,0,[],[],https://twitter.com/wallstsurvivor/status/1357371971953115136,False,,1,https://pbs.twimg.com/ext_tw_video_thumb/1357371726326292485/pu/img/8piIxfTjrg6MVQEb.jpg,,,,,,,[],,,,
1357343190534082561,1357343190534082561,2021-02-04 20:30:09 IST,2021-02-04,20:30:09,+0530,44674512,wallstsurvivor,Wall Street Survivor,,"DOLLAR COST AVERAGING: Investing the same amount of money at regular intervals over an extended period of time, regardless of the share price. By investing a fixed amount, you purchase more shares when prices are low, and fewer shares when prices are high. #financialeducation  https://t.co/ChrgaHIXLI",en,[],[],['https://pbs.twimg.com/media/EtZAaJzVIAkoKoc.jpg'],0,0,0,['financialeducation'],[],https://twitter.com/wallstsurvivor/status/1357343190534082561,False,,1,https://pbs.twimg.com/media/EtZAaJzVIAkoKoc.jpg,,,,,,,[],,,,
1357041172472991744,1357041172472991744,2021-02-04 00:30:02 IST,2021-02-04,00:30:02,+0530,44674512,wallstsurvivor,Wall Street Survivor,,"Our step-by-step courses, dead-simple articles and videos and real-time simulator will help you develop the skills you need to take control of your nest-egg. Get started at  https://t.co/VX4csHD8Xd #StockMarketInvesting #InvestingforBeginners  https://t.co/TRDCq8zfvq",en,[],['http://WallStreetSurvivor.com'],['https://pbs.twimg.com/media/EtUtwFTWYAEojcz.jpg'],0,0,1,"['stockmarketinvesting', 'investingforbeginners']",[],https://twitter.com/wallstsurvivor/status/1357041172472991744,False,,1,https://pbs.twimg.com/media/EtUtwFTWYAEojcz.jpg,,,,,,,[],,,,
1356986110480683015,1356986110480683015,2021-02-03 20:51:14 IST,2021-02-03,20:51:14,+0530,44674512,wallstsurvivor,Wall Street Survivor,,"How much money do you want to have in the future?  The average stock from Motley Fool Rule Breakers has quadrupled over the last five years! Their top stock pick is up to 5,285%! For more information, read this article:  https://t.co/UFSyO9dG2Z  https://t.co/kSFSQK0xFu",en,[],['https://bit.ly/39J8gQ4'],['https://pbs.twimg.com/media/EtT7owvXcAERPqV.jpg'],0,0,0,[],[],https://twitter.com/wallstsurvivor/status/1356986110480683015,False,,1,https://pbs.twimg.com/media/EtT7owvXcAERPqV.jpg,,,,,,,[],,,,
1356980772956233730,1356980772956233730,2021-02-03 20:30:02 IST,2021-02-03,20:30:02,+0530,44674512,wallstsurvivor,Wall Street Survivor,,Buy these 5 stocks that are more likely to double than all the others. --&amp;gt;  https://t.co/mhKntBhvgP  https://t.co/VtJVO8P0BA,en,[],['https://bit.ly/2vWy1ro'],['https://pbs.twimg.com/media/EtT20a8WYAAzEqU.png'],1,0,0,[],[],https://twitter.com/wallstsurvivor/status/1356980772956233730,False,,1,https://pbs.twimg.com/media/EtT20a8WYAAzEqU.png,,,,,,,[],,,,
1356678785203109892,1356678785203109892,2021-02-03 00:30:02 IST,2021-02-03,00:30:02,+0530,44674512,wallstsurvivor,Wall Street Survivor,,4 Ways New Businesses Can Secure Financing --&amp;gt;   https://t.co/PsBurJFcHh #BusinessPlan  https://t.co/ufVg2vdlya,en,[],['https://blog.wallstreetsurvivor.com/2019/04/23/4-ways-new-businesses-can-secure-financing/'],['https://pbs.twimg.com/media/EtPkKXAXcAQ01IQ.jpg'],0,0,0,['businessplan'],[],https://twitter.com/wallstsurvivor/status/1356678785203109892,False,,1,https://pbs.twimg.com/media/EtPkKXAXcAQ01IQ.jpg,,,,,,,[],,,,
1356618395622510593,1356618395622510593,2021-02-02 20:30:04 IST,2021-02-02,20:30:04,+0530,44674512,wallstsurvivor,Wall Street Survivor,,"Start building your future in minutes with 1,000,000 other users - for just $0.   https://t.co/VX4csHly5F  https://t.co/1g41IaZqfx",en,[],['http://WallStreetSurvivor.com'],['https://pbs.twimg.com/media/EtOtOtOXcAM6hV1.jpg'],0,0,0,[],[],https://twitter.com/wallstsurvivor/status/1356618395622510593,False,,1,https://pbs.twimg.com/media/EtOtOtOXcAM6hV1.jpg,,,,,,,[],,,,
1356316399485005825,1356316399485005825,2021-02-02 00:30:03 IST,2021-02-02,00:30:03,+0530,44674512,wallstsurvivor,Wall Street Survivor,,Value trading? Growth investing? Mutual Funds? We help it all make sense. Get ahead of the game 👉  https://t.co/iGntI7qajU #StockMarketEducation  https://t.co/IYWfpNCWsJ,en,[],['https://www.wallstreetsurvivor.com/investing-ideas'],['https://pbs.twimg.com/media/EtKakqiXcAM2cvR.jpg'],0,0,2,['stockmarketeducation'],[],https://twitter.com/wallstsurvivor/status/1356316399485005825,False,,1,https://pbs.twimg.com/media/EtKakqiXcAM2cvR.jpg,,,,,,,[],,,,
1356290914000527360,1356290914000527360,2021-02-01 22:48:47 IST,2021-02-01,22:48:47,+0530,44674512,wallstsurvivor,Wall Street Survivor,,"This and many other memes summarize how it was last week in the financial markets. If you don't understand the joke, read this text:  https://t.co/j74xxJcRlZ Then, come back here to laugh! 😜  https://t.co/1kOShvC0C7",en,[],['https://bit.ly/39AzOXI'],['https://pbs.twimg.com/media/EtKDYWoXIAIGqXr.jpg'],0,0,1,[],[],https://twitter.com/wallstsurvivor/status/1356290914000527360,False,,1,https://pbs.twimg.com/media/EtKDYWoXIAIGqXr.jpg,,,,,,,[],,,,
1356256004284035073,1356256004284035073,2021-02-01 20:30:04 IST,2021-02-01,20:30:04,+0530,44674512,wallstsurvivor,Wall Street Survivor,,"How to take advantage of Robinhood's free stock promotion and get up to $1,000 in free shares for your account ➡️  https://t.co/NWlBfNnVVL  https://t.co/6ecb9dLXLh",en,[],['http://www.wallstreetsurvivor.com/robinhood-free-stock'],['https://pbs.twimg.com/media/EtJjo6jW8AcR9OI.jpg'],1,0,0,[],[],https://twitter.com/wallstsurvivor/status/1356256004284035073,False,,1,https://pbs.twimg.com/media/EtJjo6jW8AcR9OI.jpg,,,,,,,[],,,,
1355954010071707654,1355954010071707654,2021-02-01 00:30:03 IST,2021-02-01,00:30:03,+0530,44674512,wallstsurvivor,Wall Street Survivor,,How To Buy Stocks + 9 Tips From the Pros - Wall Street Survivor 👉  https://t.co/kDw3Qi2zrl #stockmarket #howtoinvest  https://t.co/XFo72CKuug,en,[],['https://www.wallstreetsurvivor.com/starter-guides/how-to-buy-stocks/#.XK-lR39I3Mo.twitter'],['https://pbs.twimg.com/media/EtFQ-4eXIAA13MW.png'],0,0,2,"['stockmarket', 'howtoinvest']",[],https://twitter.com/wallstsurvivor/status/1355954010071707654,False,,1,https://pbs.twimg.com/media/EtFQ-4eXIAA13MW.png,,,,,,,[],,,,
1355893617920012289,1355893617920012289,2021-01-31 20:30:04 IST,2021-01-31,20:30:04,+0530,44674512,wallstsurvivor,Wall Street Survivor,,Master Our Finance and Investment Courses:  ✅ Getting started in the market. ✅ Building the perfect budget. ✅ Creating your investment strategy. ✅ Intro to financial statements.  And so much more! 👉  https://t.co/FdluX3VgV9  https://t.co/co7juC1XgH,en,[],['http://www.courses.wallstreetsurvivor.com/invest-smarter'],['https://pbs.twimg.com/media/EtEaDJ2XEAE20wt.jpg'],1,0,0,[],[],https://twitter.com/wallstsurvivor/status/1355893617920012289,False,,1,https://pbs.twimg.com/media/EtEaDJ2XEAE20wt.jpg,,,,,,,[],,,,
1355591615277105153,1355591615277105153,2021-01-31 00:30:01 IST,2021-01-31,00:30:01,+0530,44674512,wallstsurvivor,Wall Street Survivor,,HOW AND WHERE TO BUY #PENNYSTOCKS:  https://t.co/Tu79zBO85C #StockMarketEducation #Investing,en,[],['https://www.wallstreetsurvivor.com/starter-guides/how-to-buy-penny-stocks/'],[],0,0,1,"['pennystocks', 'stockmarketeducation', 'investing']",[],https://twitter.com/wallstsurvivor/status/1355591615277105153,False,,0,,,,,,,,[],,,,
1355531221414125569,1355531221414125569,2021-01-30 20:30:02 IST,2021-01-30,20:30:02,+0530,44674512,wallstsurvivor,Wall Street Survivor,,Moon’s Rocket Trades Review – Is It Legit?   https://t.co/9bDhZoToHG #RocketTrades  https://t.co/uPFEfSFbdn,en,[],['https://blog.wallstreetsurvivor.com/2020/09/18/moons-rocket-trades-review-is-it-legit/'],['https://pbs.twimg.com/media/Es_QdaMXIAIZ2VU.jpg'],0,0,0,['rockettrades'],[],https://twitter.com/wallstsurvivor/status/1355531221414125569,False,,1,https://pbs.twimg.com/media/Es_QdaMXIAIZ2VU.jpg,,,,,,,[],,,,
1355229233686175749,1355229233686175749,2021-01-30 00:30:02 IST,2021-01-30,00:30:02,+0530,44674512,wallstsurvivor,Wall Street Survivor,,"Create your own #StockMarketGame for your class or club, or join one of our Monthly Contests and compete for your share of $2,000 in prizes! --&amp;gt;  https://t.co/F9WAx4Dtfg  https://t.co/E3AjVW8QCw",en,[],['https://www.wallstreetsurvivor.com/stock-market-game/'],['https://pbs.twimg.com/media/Es69zbjXIAEjjo-.jpg'],0,0,0,['stockmarketgame'],[],https://twitter.com/wallstsurvivor/status/1355229233686175749,False,,1,https://pbs.twimg.com/media/Es69zbjXIAEjjo-.jpg,,,,,,,[],,,,
1355176250541793286,1355176250541793286,2021-01-29 20:59:30 IST,2021-01-29,20:59:30,+0530,44674512,wallstsurvivor,Wall Street Survivor,,"Join a League for Cash Prices!  Create your own contest, or join our monthly contests and compete for your share of $2,000 in prizes 2. Take our free courses and learn to build a stock portfolio 3. Practice investing before using your money! Register Now:  https://t.co/SpVMCV9htP  https://t.co/GwpfsKUmHc",en,[],['http://bit.ly/3iY80Qc'],['https://pbs.twimg.com/media/Es6NPi5XAAIBNAm.jpg'],0,0,0,[],[],https://twitter.com/wallstsurvivor/status/1355176250541793286,False,,1,https://pbs.twimg.com/media/Es6NPi5XAAIBNAm.jpg,,,,,,,[],,,,
1355168846689292289,1355168846689292289,2021-01-29 20:30:05 IST,2021-01-29,20:30:05,+0530,44674512,wallstsurvivor,Wall Street Survivor,,Ready to start creating your Investment Strategy? Make sure you master these topics first 👉 https://t.co/61rc2WxoXh #investing #stockmarketeducation  https://t.co/8Hnc8e79yH,en,[],['http://courses.wallstreetsurvivor.com/is/12-creating-your-investment-strategy/?fbclid=IwAR33m_mmhi2mArEMQaqhNHAIOFvNixTU9FVnyfWiDh42YqhKoiAFfxVFMsM'],['https://pbs.twimg.com/media/Es6G3vKXAAE6xdR.png'],0,0,0,"['investing', 'stockmarketeducation']",[],https://twitter.com/wallstsurvivor/status/1355168846689292289,False,,1,https://pbs.twimg.com/media/Es6G3vKXAAE6xdR.png,,,,,,,[],,,,
1354873267056730117,1354873267056730117,2021-01-29 00:55:33 IST,2021-01-29,00:55:33,+0530,44674512,wallstsurvivor,Wall Street Survivor,,Do you know what is short-selling? 🤔  https://t.co/6aFVoohrt5,en,[],[],['https://pbs.twimg.com/media/Es16DMIXIAEHAkn.jpg'],0,0,2,[],[],https://twitter.com/wallstsurvivor/status/1354873267056730117,False,,1,https://pbs.twimg.com/media/Es16DMIXIAEHAkn.jpg,,,,,,,[],,,,
1354866839789195267,1354866839789195267,2021-01-29 00:30:01 IST,2021-01-29,00:30:01,+0530,44674512,wallstsurvivor,Wall Street Survivor,,The First Stock Everyone Should Buy  https://t.co/hWNVomSyif via @YouTube,en,"[{'screen_name': 'youtube', 'name': 'youtube', 'id': '10228272'}]",['https://youtu.be/keWIdDi7dSg'],[],0,0,0,[],[],https://twitter.com/wallstsurvivor/status/1354866839789195267,False,,0,,,,,,,,[],,,,
1354806454356635655,1354806454356635655,2021-01-28 20:30:04 IST,2021-01-28,20:30:04,+0530,44674512,wallstsurvivor,Wall Street Survivor,,Get Started With Bitcoin - an easy to navigate guide:  https://t.co/MVOAKPN4wK  https://t.co/Kn4xobvKbu,en,[],['https://blog.wallstreetsurvivor.com/2020/07/01/get-started-with-bitcoin/#.XwX_TjRRlFk.twitter'],['https://pbs.twimg.com/media/Es09R-jUUAQBS_M.jpg'],0,0,0,[],[],https://twitter.com/wallstsurvivor/status/1354806454356635655,False,,1,https://pbs.twimg.com/media/Es09R-jUUAQBS_M.jpg,,,,,,,[],,,,
1354504456763748359,1354504456763748359,2021-01-28 00:30:02 IST,2021-01-28,00:30:02,+0530,44674512,wallstsurvivor,Wall Street Survivor,,"Nearly half of Americans don’t even understand the basic financial markets, which is crucial to understanding the market as a whole. #investingnews #FinancialLiteracy  https://t.co/TLjTTpfLRW",en,[],[],['https://pbs.twimg.com/media/Eswqn6iXYAYhGPu.jpg'],1,0,2,"['investingnews', 'financialliteracy']",[],https://twitter.com/wallstsurvivor/status/1354504456763748359,False,,1,https://pbs.twimg.com/media/Eswqn6iXYAYhGPu.jpg,,,,,,,[],,,,
1354444073411760130,1354444073411760130,2021-01-27 20:30:06 IST,2021-01-27,20:30:06,+0530,44674512,wallstsurvivor,Wall Street Survivor,,"Join 1,000,000 other traders to practice your skills in the stock market at  https://t.co/VX4csHly5F! #StockMarketEducation #StockMarketGames  https://t.co/p6ncxGqIZt",en,[],['http://WallStreetSurvivor.com'],['https://pbs.twimg.com/media/EsvzsNZW8AMCxaV.jpg'],0,0,0,"['stockmarketeducation', 'stockmarketgames']",[],https://twitter.com/wallstsurvivor/status/1354444073411760130,False,,1,https://pbs.twimg.com/media/EsvzsNZW8AMCxaV.jpg,,,,,,,[],,,,
1354443838602039297,1354443838602039297,2021-01-27 20:29:10 IST,2021-01-27,20:29:10,+0530,44674512,wallstsurvivor,Wall Street Survivor,,"It can seem that most Americans are interested in the stock market, presumably because they have a stake in it.  But only 55% do, according to a Gallup survey taken in April 2020. Gallup has asked the question repeatedly, with replies since 1998 ranging between 52% and 67%.  https://t.co/ZXHKmFrEtU",en,[],[],['https://pbs.twimg.com/media/EsvzY4WXAAMf2iO.jpg'],1,0,1,[],[],https://twitter.com/wallstsurvivor/status/1354443838602039297,False,,1,https://pbs.twimg.com/media/EsvzY4WXAAMf2iO.jpg,,,,,,,[],,,,
1354142080654688256,1354142080654688256,2021-01-27 00:30:05 IST,2021-01-27,00:30:05,+0530,44674512,wallstsurvivor,Wall Street Survivor,,Trending stocks have very high trade volume. We tell you how to read and find trending stocks. 👇👇   https://t.co/h4VFnFXABp  https://t.co/Hrw7Ec7T09,en,[],['http://www.wallstreetsurvivor.com/investing-ideas/trending'],['https://pbs.twimg.com/media/EsrhCIeXYAU7ECp.jpg'],0,0,0,[],[],https://twitter.com/wallstsurvivor/status/1354142080654688256,False,,1,https://pbs.twimg.com/media/EsrhCIeXYAU7ECp.jpg,,,,,,,[],,,,
1354136217307258882,1354136217307258882,2021-01-27 00:06:47 IST,2021-01-27,00:06:47,+0530,44674512,wallstsurvivor,Wall Street Survivor,,"Also known as Generation Y, the millennials are people born between 1981 and 1996.  These people currently lead the job market and, to better understand their attitudes about spending, saving, and investing, @Investopedia released a survey.  Read more:  https://t.co/pzoiytVW1Y  https://t.co/qWvpqjHvgx",en,"[{'screen_name': 'investopedia', 'name': 'investopedia', 'id': '21459600'}]",['http://bit.ly/2MoQmJa'],['https://pbs.twimg.com/media/EsrbcaiWMAE_gc-.jpg'],0,0,0,[],[],https://twitter.com/wallstsurvivor/status/1354136217307258882,False,,1,https://pbs.twimg.com/media/EsrbcaiWMAE_gc-.jpg,,,,,,,[],,,,
1354081671612665858,1354081671612665858,2021-01-26 20:30:02 IST,2021-01-26,20:30:02,+0530,44674512,wallstsurvivor,Wall Street Survivor,,Want to change the world by investing? 92% of millennial investors say they would be likely to put ALL of their investment holdings in responsible investing. #Millennial #investments  https://t.co/b5BTcffI81,en,[],[],['https://pbs.twimg.com/media/EsqqGeJXcAoK_QT.jpg'],0,0,0,"['millennial', 'investments']",[],https://twitter.com/wallstsurvivor/status/1354081671612665858,False,,1,https://pbs.twimg.com/media/EsqqGeJXcAoK_QT.jpg,,,,,,,[],,,,
1353779727312580610,1353779727312580610,2021-01-26 00:30:13 IST,2021-01-26,00:30:13,+0530,44674512,wallstsurvivor,Wall Street Survivor,,How does Wall Street Survivor help you learn the #StockMarket? By simplifying strategies by making it easy for you to understand. Our games are designed to help you grow as a savvy investor.  https://t.co/uzwyzxO7Az,en,[],[],['https://pbs.twimg.com/media/EsmXcblXMAEo0cT.jpg'],0,0,0,['stockmarket'],[],https://twitter.com/wallstsurvivor/status/1353779727312580610,False,,1,https://pbs.twimg.com/media/EsmXcblXMAEo0cT.jpg,,,,,,,[],,,,
1353736084551835651,1353736084551835651,2021-01-25 21:36:48 IST,2021-01-25,21:36:48,+0530,44674512,wallstsurvivor,Wall Street Survivor,,Stocks' return potential gives the best chance to beat inflation over long periods. That's why they're an essential part of a good retirement portfolio.  Click here to learn how to select the best stocks to invest in:  https://t.co/SU45vzAoTJ  https://t.co/sWGnK1YQz5,en,[],['http://bit.ly/2MnXfKU'],['https://pbs.twimg.com/media/EslvunmXUAIs3cz.jpg'],0,0,0,[],[],https://twitter.com/wallstsurvivor/status/1353736084551835651,False,,1,https://pbs.twimg.com/media/EslvunmXUAIs3cz.jpg,,,,,,,[],,,,
1353719295965097985,1353719295965097985,2021-01-25 20:30:05 IST,2021-01-25,20:30:05,+0530,44674512,wallstsurvivor,Wall Street Survivor,,⚡️ The Motley Fool Stock Advisor just released 15 stocks that you should plan on holding for the next 3 to 5 years. Get the newsletter to see their picks:  https://t.co/pV0aNeXTkq  https://t.co/dzk76dPJ2p,en,[],['https://www.wallstreetsurvivor.com/best-investment-newsletters/?fbclid=IwAR3heqq62K_WLnbk1jBXGqicWTQae0Uam6JABWDjqntMjuLz5s3Rc5zsQPQ'],['https://pbs.twimg.com/media/EslgguNW8AAylIw.jpg'],0,0,0,[],[],https://twitter.com/wallstsurvivor/status/1353719295965097985,False,,1,https://pbs.twimg.com/media/EslgguNW8AAylIw.jpg,,,,,,,[],,,,
1353417287772979200,1353417287772979200,2021-01-25 00:30:01 IST,2021-01-25,00:30:01,+0530,44674512,wallstsurvivor,Wall Street Survivor,,"Why you should invest: Each year, your cash is worth less due to inflation. #Investing helps you offset and beat the dreaded inflation.",en,[],[],[],0,0,0,['investing'],[],https://twitter.com/wallstsurvivor/status/1353417287772979200,False,,0,,,,,,,,[],,,,
1353413585083523072,1353413585083523072,2021-01-25 00:15:18 IST,2021-01-25,00:15:18,+0530,44674512,wallstsurvivor,Wall Street Survivor,,"It's crucial to create goals that match where you are in your financial journey, starting with taking advantage of the benefits of compounding as soon as possible.  https://t.co/axbWCKAtLV",en,[],['https://www.cnbc.com/guide/retirement-planning-decade-by-decade/#introduction'],[],0,0,0,[],[],https://twitter.com/wallstsurvivor/status/1353413585083523072,False,,0,,,,,,,,[],,,,
1353356900478365703,1353356900478365703,2021-01-24 20:30:03 IST,2021-01-24,20:30:03,+0530,44674512,wallstsurvivor,Wall Street Survivor,,Get in on the action. Start trading today using fake cash and real market conditions 👉  https://t.co/VX4csHly5F  https://t.co/2dvLDDDGn7,en,[],['http://WallStreetSurvivor.com'],['https://pbs.twimg.com/media/EsgW7ADW4AUx1np.jpg'],0,0,0,[],[],https://twitter.com/wallstsurvivor/status/1353356900478365703,False,,1,https://pbs.twimg.com/media/EsgW7ADW4AUx1np.jpg,,,,,,,[],,,,
1353054900796710912,1353054900796710912,2021-01-24 00:30:01 IST,2021-01-24,00:30:01,+0530,44674512,wallstsurvivor,Wall Street Survivor,,The Relationship Between the U.S. Stock Market and Japan  https://t.co/RTYtCSv0jV,en,[],['https://blog.wallstreetsurvivor.com/2020/08/24/the-relationship-between-the-u-s-stock-market-and-japan/#.X0u9ah2rSbU.twitter'],[],0,0,1,[],[],https://twitter.com/wallstsurvivor/status/1353054900796710912,False,,0,,,,,,,,[],,,,
1352994507273474049,1352994507273474049,2021-01-23 20:30:02 IST,2021-01-23,20:30:02,+0530,44674512,wallstsurvivor,Wall Street Survivor,,Moon’s Rocket Trades Review – Is It Legit?   https://t.co/9bDhZoToHG #RocketTrades  https://t.co/ICNzwkvi1C,en,[],['https://blog.wallstreetsurvivor.com/2020/09/18/moons-rocket-trades-review-is-it-legit/'],['https://pbs.twimg.com/media/EsbNVOFXAAkfJ_K.jpg'],0,0,0,['rockettrades'],[],https://twitter.com/wallstsurvivor/status/1352994507273474049,False,,1,https://pbs.twimg.com/media/EsbNVOFXAAkfJ_K.jpg,,,,,,,[],,,,
1352692518333374464,1352692518333374464,2021-01-23 00:30:02 IST,2021-01-23,00:30:02,+0530,44674512,wallstsurvivor,Wall Street Survivor,,Only 33% of millennials are saving for retirement. Even saving a small portion of your paycheck for retirement goes a long way when you invest it. #retirement #personalfinance  https://t.co/t37UpDG7G3,en,[],[],['https://pbs.twimg.com/media/EsW6rLlW4AISjXa.jpg'],0,0,0,"['retirement', 'personalfinance']",[],https://twitter.com/wallstsurvivor/status/1352692518333374464,False,,1,https://pbs.twimg.com/media/EsW6rLlW4AISjXa.jpg,,,,,,,[],,,,
1352632113942695944,1352632113942695944,2021-01-22 20:30:01 IST,2021-01-22,20:30:01,+0530,44674512,wallstsurvivor,Wall Street Survivor,,.@CNBC just rated this course one of the best online investing courses for beginners.  Watch Levi tell you all about this investing 101 course and show you how to access this course for free!  https://t.co/8DnnKnDXxd via @YouTube,en,"[{'screen_name': 'cnbc', 'name': 'cnbc', 'id': '20402945'}, {'screen_name': 'youtube', 'name': 'youtube', 'id': '10228272'}]",['https://youtu.be/-tbAcFFQlb4'],[],0,0,0,[],[],https://twitter.com/wallstsurvivor/status/1352632113942695944,False,,0,,,,,,,,[],,,,
1352368935086256130,1352368935086256130,2021-01-22 03:04:14 IST,2021-01-22,03:04:14,+0530,44674512,wallstsurvivor,Wall Street Survivor,,"FANG stocks include Facebook, Amazon, Netflix, and Google. Here is some great information from CNBC for our Big Tech enthusiasts.  https://t.co/7YrfhNkVCb",en,[],['https://www.cnbc.com/2021/01/21/risk-and-reward-could-continue-to-be-high-in-fang-stocks-even-if-they-lag-this-year.html'],[],0,0,0,[],[],https://twitter.com/wallstsurvivor/status/1352368935086256130,False,,0,,,,,,,,[],,,,
1352330130295762946,1352330130295762946,2021-01-22 00:30:02 IST,2021-01-22,00:30:02,+0530,44674512,wallstsurvivor,Wall Street Survivor,,"Get comprehensive advice, easy-to-learn blogs and games at  https://t.co/VX4csHly5F! 📈#StockMarket #StockMarketEducation  https://t.co/o4ouEG8sem",en,[],['http://WallStreetSurvivor.com'],['https://pbs.twimg.com/media/EsRxFcAW4AEELof.jpg'],0,0,0,"['stockmarket', 'stockmarketeducation']",[],https://twitter.com/wallstsurvivor/status/1352330130295762946,False,,1,https://pbs.twimg.com/media/EsRxFcAW4AEELof.jpg,,,,,,,[],,,,
1352269768858939399,1352269768858939399,2021-01-21 20:30:11 IST,2021-01-21,20:30:11,+0530,44674512,wallstsurvivor,Wall Street Survivor,,"""An investment in knowledge pays the best interest."" - Benjamin Franklin⠀⠀⠀  https://t.co/urWbsgOcCF",en,[],[],['https://pbs.twimg.com/media/EsQ6JroXYAId88c.jpg'],0,0,2,[],[],https://twitter.com/wallstsurvivor/status/1352269768858939399,False,,1,https://pbs.twimg.com/media/EsQ6JroXYAId88c.jpg,,,,,,,[],,,,
1351967737413828609,1351967737413828609,2021-01-21 00:30:01 IST,2021-01-21,00:30:01,+0530,44674512,wallstsurvivor,Wall Street Survivor,,4 Steps to Making More Money from Self-Made Millionaires ➡️ https://t.co/cU7UQVcNk6,en,[],['https://blog.wallstreetsurvivor.com/2017/11/02/4-steps-make-money-self-made-millionaires/'],[],0,0,0,[],[],https://twitter.com/wallstsurvivor/status/1351967737413828609,False,,0,,,,,,,,[],,,,
1351907347128590339,1351907347128590339,2021-01-20 20:30:03 IST,2021-01-20,20:30:03,+0530,44674512,wallstsurvivor,Wall Street Survivor,,What's the first step towards investing? Financial literacy is important to understand the market as a whole. We can help you learn with our fun and educating games on the stock market. #financialeducation  https://t.co/PZWtGX4xDE,en,[],[],['https://pbs.twimg.com/media/EsLwj-qWMAAkB-R.jpg'],0,0,0,['financialeducation'],[],https://twitter.com/wallstsurvivor/status/1351907347128590339,False,,1,https://pbs.twimg.com/media/EsLwj-qWMAAkB-R.jpg,,,,,,,[],,,,
1351668575149420549,1351668575149420549,2021-01-20 04:41:15 IST,2021-01-20,04:41:15,+0530,44674512,wallstsurvivor,Wall Street Survivor,,"Compounding is the ability for your money to earn even more money by keeping your capital gains, dividends, and interest invested.   https://t.co/3faqi0J5jb #StockMarketEducation  https://t.co/xRdg8EJUUd",en,[],['https://blog.wallstreetsurvivor.com/2016/02/24/the-magic-of-compound-interest/'],['https://pbs.twimg.com/media/EsIXZ5PXIAIhVZW.jpg'],0,0,1,['stockmarketeducation'],[],https://twitter.com/wallstsurvivor/status/1351668575149420549,False,,1,https://pbs.twimg.com/media/EsIXZ5PXIAIhVZW.jpg,,,,,,,[],,,,
