id,conversation_id,created_at,date,time,timezone,user_id,username,name,place,tweet,language,mentions,urls,photos,replies_count,retweets_count,likes_count,hashtags,cashtags,link,retweet,quote_url,video,thumbnail,near,geo,source,user_rt_id,user_rt,retweet_id,reply_to,retweet_date,translate,trans_src,trans_dest
1351605359832657920,1351605359832657920,2021-01-20 00:30:04 IST,2021-01-20,00:30:04,+0530,44674512,wallstsurvivor,Wall Street Survivor,,Get Started With Bitcoin - an easy to navigate guide:  https://t.co/MVOAKQ4FVk  https://t.co/jIts775GmS,en,[],['https://blog.wallstreetsurvivor.com/2020/07/01/get-started-with-bitcoin/#.XwX_TjRRlFk.twitter'],['https://pbs.twimg.com/media/EsHd56cXcAQ7nb7.jpg'],0,0,0,[],[],https://twitter.com/wallstsurvivor/status/1351605359832657920,False,,1,https://pbs.twimg.com/media/EsHd56cXcAQ7nb7.jpg,,,,,,,[],,,,
1351544950559797258,1351544950559797258,2021-01-19 20:30:01 IST,2021-01-19,20:30:01,+0530,44674512,wallstsurvivor,Wall Street Survivor,,Best Stocks to Buy Now - Is the Motley Fool Legit?  https://t.co/s7zl4UrSrM via @YouTube,en,"[{'screen_name': 'youtube', 'name': 'youtube', 'id': '10228272'}]",['https://youtu.be/sDjPl_dcLw4'],[],0,0,0,[],[],https://twitter.com/wallstsurvivor/status/1351544950559797258,False,,0,,,,,,,,[],,,,
1351242968099909635,1351242968099909635,2021-01-19 00:30:03 IST,2021-01-19,00:30:03,+0530,44674512,wallstsurvivor,Wall Street Survivor,,"It’s one thing to keep up with the stock market, yet it’s like entering a whole new realm trying to invest in the stock market. The good thing is there are plenty of resources out there for those ready to try! READ:  https://t.co/QVGuHbqUfk #invest #stocks #resource  https://t.co/094RVcBJP0",en,[],['https://blog.wallstreetsurvivor.com/2020/01/13/getting-started-with-investing-here-are-5-awesome-resources/'],['https://pbs.twimg.com/media/EsCUUNTXMAoEBJ4.jpg'],0,0,0,"['invest', 'stocks', 'resource']",[],https://twitter.com/wallstsurvivor/status/1351242968099909635,False,,1,https://pbs.twimg.com/media/EsCUUNTXMAoEBJ4.jpg,,,,,,,[],,,,
1351182575352610818,1351182575352610818,2021-01-18 20:30:04 IST,2021-01-18,20:30:04,+0530,44674512,wallstsurvivor,Wall Street Survivor,,"Asset allocation is not a one size fits all solution. It's a combination of assets that are based on a person's investment goals, risk tolerance, and the time they have available. Learn more at  https://t.co/VX4csHly5F #StockMarketEducation  https://t.co/PIcv5ZZDXX",en,[],['http://WallStreetSurvivor.com'],['https://pbs.twimg.com/media/EsBdYcMW8AQnf6R.jpg'],0,0,0,['stockmarketeducation'],[],https://twitter.com/wallstsurvivor/status/1351182575352610818,False,,1,https://pbs.twimg.com/media/EsBdYcMW8AQnf6R.jpg,,,,,,,[],,,,
1350880647716417538,1350880647716417538,2021-01-18 00:30:19 IST,2021-01-18,00:30:19,+0530,44674512,wallstsurvivor,Wall Street Survivor,,Just trying to live my life over here but it's so hard and expensive. #FinanceQuotes #FinancialEducation  https://t.co/trbDqCLScm,en,[],[],['https://pbs.twimg.com/media/Er9KuaoW4AEroOY.jpg'],0,0,0,"['financequotes', 'financialeducation']",[],https://twitter.com/wallstsurvivor/status/1350880647716417538,False,,1,https://pbs.twimg.com/media/Er9KuaoW4AEroOY.jpg,,,,,,,[],,,,
1350820186157441026,1350820186157441026,2021-01-17 20:30:04 IST,2021-01-17,20:30:04,+0530,44674512,wallstsurvivor,Wall Street Survivor,,Ready to increase your credit score this year? We've got 5 easy tips to start 👉  https://t.co/NigVh59buJ  https://t.co/Q0GY4s0VQq,en,[],['https://bit.ly/36tGZ07'],['https://pbs.twimg.com/media/Er8TyrLWMAQIPtN.jpg'],1,0,0,[],[],https://twitter.com/wallstsurvivor/status/1350820186157441026,False,,1,https://pbs.twimg.com/media/Er8TyrLWMAQIPtN.jpg,,,,,,,[],,,,
1350518203395485698,1350518203395485698,2021-01-17 00:30:05 IST,2021-01-17,00:30:05,+0530,44674512,wallstsurvivor,Wall Street Survivor,,"A budget may seem like extra work, but at the end of the day it helps you reach your financial goals faster. #budgeting #moneytips  https://t.co/jQz47I0Wis",en,[],[],['https://pbs.twimg.com/media/Er4BJAfXUAI6vEK.png'],0,0,1,"['budgeting', 'moneytips']",[],https://twitter.com/wallstsurvivor/status/1350518203395485698,False,,1,https://pbs.twimg.com/media/Er4BJAfXUAI6vEK.png,,,,,,,[],,,,
1350457798207877120,1350457798207877120,2021-01-16 20:30:04 IST,2021-01-16,20:30:04,+0530,44674512,wallstsurvivor,Wall Street Survivor,,"To succeed as a #Forex trader, you need to do a lot of hard work and read all the investing advice that you can.  Here are 3 tips to help you grow your investing account 👇   https://t.co/HM8YW3l7z2  https://t.co/yqgetboNJE",en,[],['https://bit.ly/2ugpAtl'],['https://pbs.twimg.com/media/Er3KNBuW4AAwRtl.jpg'],0,0,0,['forex'],[],https://twitter.com/wallstsurvivor/status/1350457798207877120,False,,1,https://pbs.twimg.com/media/Er3KNBuW4AAwRtl.jpg,,,,,,,[],,,,
