id,conversation_id,created_at,date,time,timezone,user_id,username,name,place,tweet,language,mentions,urls,photos,replies_count,retweets_count,likes_count,hashtags,cashtags,link,retweet,quote_url,video,thumbnail,near,geo,source,user_rt_id,user_rt,retweet_id,reply_to,retweet_date,translate,trans_src,trans_dest
1384948435716083712,1384948435716083712,2021-04-22 00:43:32 IST,2021-04-22,00:43:32,+0530,44674512,wallstsurvivor,Wall Street Survivor,,"""While Bitcoin is widely seen as a pioneer in the world of cryptocurrencies, analysts adopt many approaches for evaluating tokens other than BTC."" - Investopedia  Check 10 important cryptocurrencies other than Bitcoin here:  https://t.co/W00LAZi5Z2  https://t.co/VdzAJplYyJ",en,[],['https://bit.ly/2QOCJFa'],['https://pbs.twimg.com/media/EzhTMdKXEAA_zJf.jpg'],0,0,0,[],[],https://twitter.com/wallstsurvivor/status/1384948435716083712,False,,1,https://pbs.twimg.com/media/EzhTMdKXEAA_zJf.jpg,,,,,,,[],,,,
1384173006285525004,1384173006285525004,2021-04-19 21:22:16 IST,2021-04-19,21:22:16,+0530,44674512,wallstsurvivor,Wall Street Survivor,,"""Passive investors are in the Danger Zone."" -&gt; David Trainer, Forbes Read more:  https://t.co/vagMnqE2Fr  https://t.co/nUh0t1esLa",en,[],['https://bit.ly/2QE1Drj'],['https://pbs.twimg.com/media/EzWSAQRVkAYVSxY.jpg'],0,0,0,[],[],https://twitter.com/wallstsurvivor/status/1384173006285525004,False,,1,https://pbs.twimg.com/media/EzWSAQRVkAYVSxY.jpg,,,,,,,[],,,,
1382417141304016897,1382417141304016897,2021-04-15 01:05:05 IST,2021-04-15,01:05:05,+0530,44674512,wallstsurvivor,Wall Street Survivor,,"Did you invest in these or other companies 5 years ago?  If so, how much do you have today?  https://t.co/IzsOSfMqhb",en,[],[],['https://pbs.twimg.com/media/Ey9VDPRXMAAejh_.jpg'],0,0,1,[],[],https://twitter.com/wallstsurvivor/status/1382417141304016897,False,,1,https://pbs.twimg.com/media/Ey9VDPRXMAAejh_.jpg,,,,,,,[],,,,
1379172002309812225,1379172002309812225,2021-04-06 02:10:03 IST,2021-04-06,02:10:03,+0530,44674512,wallstsurvivor,Wall Street Survivor,,Getting started in the investment world might seem a little daunting at first. Potential investors might get bewildered by the sheer number of investment tools available.  Here are the tips to help you build a stock portfolio:  https://t.co/6GdqNLjUsf  https://t.co/fjc6ACk6bS,en,[],['https://bit.ly/3fKhvCQ'],['https://pbs.twimg.com/media/EyPNlSRWQAEeOKC.jpg'],0,0,1,[],[],https://twitter.com/wallstsurvivor/status/1379172002309812225,False,,1,https://pbs.twimg.com/media/EyPNlSRWQAEeOKC.jpg,,,,,,,[],,,,
1376983699959480329,1376983699959480329,2021-03-31 01:14:31 IST,2021-03-31,01:14:31,+0530,44674512,wallstsurvivor,Wall Street Survivor,,Many of the most valuable companies in the world are technology companies.  These are some of the most dominant and impressive tech stocks:  https://t.co/wVayZg8nQ6  https://t.co/AtopwIuYLk,en,[],['https://bit.ly/3wfGfss'],['https://pbs.twimg.com/media/ExwHW3dWEAAtrk9.jpg'],0,0,0,[],[],https://twitter.com/wallstsurvivor/status/1376983699959480329,False,,1,https://pbs.twimg.com/media/ExwHW3dWEAAtrk9.jpg,,,,,,,[],,,,
1375150271903457283,1375150271903457283,2021-03-25 23:49:08 IST,2021-03-25,23:49:08,+0530,44674512,wallstsurvivor,Wall Street Survivor,,Investment newsletters make getting stock market analysis and stock recommendations easy. But… there are so many newsletters to choose from… How do you know which newsletter provides the best stock recommendations? Check this article out:  https://t.co/HE7biK0jmp  https://t.co/Y7pdIn6eyy,en,[],['https://bit.ly/2QGB2tB'],['https://pbs.twimg.com/media/ExWD3zHXIAAVEKJ.jpg'],0,0,0,[],[],https://twitter.com/wallstsurvivor/status/1375150271903457283,False,,1,https://pbs.twimg.com/media/ExWD3zHXIAAVEKJ.jpg,,,,,,,[],,,,
1374066583795027978,1374066583795027978,2021-03-23 00:02:57 IST,2021-03-23,00:02:57,+0530,44674512,wallstsurvivor,Wall Street Survivor,,"To save $3 million by the time you are 50, you’ll have to put away a substantial amount as soon as you land your first job.  Here’s how much you will need to start investing every month to reach $3 million — broken down by your target age:  https://t.co/lcJDjVFIrg  https://t.co/Yiu08VIDir",en,[],['http://cnb.cx/3cXesEv'],['https://pbs.twimg.com/media/ExGqQ43WUAI528y.jpg'],0,0,0,[],[],https://twitter.com/wallstsurvivor/status/1374066583795027978,False,,1,https://pbs.twimg.com/media/ExGqQ43WUAI528y.jpg,,,,,,,[],,,,
1373819208149139460,1373819208149139460,2021-03-22 07:39:58 IST,2021-03-22,07:39:58,+0530,44674512,wallstsurvivor,Wall Street Survivor,,A sentiment of optimism after a very tough year!  https://t.co/F228nMvm9H,en,[],['https://www.reuters.com/article/us-usa-fed-barkin/richmond-feds-barkin-u-s-may-be-on-the-brink-of-complete-recovery-idUSKBN2BE04X'],[],0,0,0,[],[],https://twitter.com/wallstsurvivor/status/1373819208149139460,False,,0,,,,,,,,[],,,,
1371845492989104135,1371845492989104135,2021-03-16 20:57:07 IST,2021-03-16,20:57:07,+0530,44674512,wallstsurvivor,Wall Street Survivor,,CNBC’s Jim Cramer said Tuesday he believes it’s a favorable environment for investors to put money to work in the U.S. stock market. Read more:  https://t.co/SwJYINMPsO  https://t.co/mHp1Ioe9YW,en,[],['http://cnb.cx/3rTAbU6'],['https://pbs.twimg.com/media/EwnGLdAW8BQz6Jb.jpg'],0,1,0,[],[],https://twitter.com/wallstsurvivor/status/1371845492989104135,False,,1,https://pbs.twimg.com/media/EwnGLdAW8BQz6Jb.jpg,,,,,,,[],,,,
1371529740297850895,1371529740297850895,2021-03-16 00:02:26 IST,2021-03-16,00:02:26,+0530,44674512,wallstsurvivor,Wall Street Survivor,,"If you are sure that you want to invest but are not aware of the right time to start investing, this article can guide you in the right direction. The right time to invest is during or after you complete your graduation, the age around 20s.  Read more:  https://t.co/7deZaV2Bje  https://t.co/b6inZDtERp",en,[],['https://bit.ly/3eIT0pg'],['https://pbs.twimg.com/media/Ewim-UmXIAACoHV.jpg'],0,0,0,[],[],https://twitter.com/wallstsurvivor/status/1371529740297850895,False,,1,https://pbs.twimg.com/media/Ewim-UmXIAACoHV.jpg,,,,,,,[],,,,
1370393965049053189,1370393965049053189,2021-03-12 20:49:16 IST,2021-03-12,20:49:16,+0530,44674512,wallstsurvivor,Wall Street Survivor,,"If you're thinking of making a change or simply looking to reinforce an existing investment strategy, here are the 10 best exchange-traded funds, or ETFs, for 2021 that collectively offer a wide variety of opportunities:  https://t.co/FArlo8pXYq  https://t.co/rO1SrB4VwT",en,[],['http://bit.ly/3vlgsi4'],['https://pbs.twimg.com/media/EwSeC10XAAIHo3-.jpg'],0,0,0,[],[],https://twitter.com/wallstsurvivor/status/1370393965049053189,False,,1,https://pbs.twimg.com/media/EwSeC10XAAIHo3-.jpg,,,,,,,[],,,,
1369432751334686723,1369432751334686723,2021-03-10 05:09:45 IST,2021-03-10,05:09:45,+0530,44674512,wallstsurvivor,Wall Street Survivor,,Check out this article detailing the relationship between the U.S. Treasury yield curve and tech stocks!  https://t.co/EAcWEL1AVM,en,[],['https://www.cnbc.com/2021/03/09/stock-market-open-to-close-news.html'],[],0,0,0,[],[],https://twitter.com/wallstsurvivor/status/1369432751334686723,False,,0,,,,,,,,[],,,,
1369381484822413313,1369381484822413313,2021-03-10 01:46:02 IST,2021-03-10,01:46:02,+0530,44674512,wallstsurvivor,Wall Street Survivor,,"Is the Motley Fool worth it? In this experiment, we compare the Motley Fool's free stock recommendations to their paid stock advice (and to the S&amp;P 500) to answer the question once and for all. Watch our video here:  https://t.co/rqYcCIERne  https://t.co/CoUO5zp1AJ",en,[],['https://bit.ly/38pPdJw'],['https://pbs.twimg.com/media/EwEFJhRXIAIaFEu.jpg'],0,0,1,[],[],https://twitter.com/wallstsurvivor/status/1369381484822413313,False,,1,https://pbs.twimg.com/media/EwEFJhRXIAIaFEu.jpg,,,,,,,[],,,,
1367622299516551169,1367622299516551169,2021-03-05 05:15:40 IST,2021-03-05,05:15:40,+0530,44674512,wallstsurvivor,Wall Street Survivor,,Check out our new video on compound interest on the WSS YouTube channel!  https://t.co/XsOqPBTDVT,en,[],['https://www.youtube.com/watch?v=u1NnXMgBKmg&ab_channel=WallStreetSurvivor'],[],0,0,0,[],[],https://twitter.com/wallstsurvivor/status/1367622299516551169,False,,0,,,,,,,,[],,,,
1367137086286032896,1367137086286032896,2021-03-03 21:07:36 IST,2021-03-03,21:07:36,+0530,44674512,wallstsurvivor,Wall Street Survivor,,"Get the daily email that makes reading the news actually enjoyable. Stay informed and entertained, for free. Subscribe now:  https://t.co/HVGFX3Q5k6  https://t.co/sKP3MJ2Bau",en,[],['https://bit.ly/3aQSymu'],['https://pbs.twimg.com/media/EvkL7LRWQAkqNPt.jpg'],0,0,0,[],[],https://twitter.com/wallstsurvivor/status/1367137086286032896,False,,1,https://pbs.twimg.com/media/EvkL7LRWQAkqNPt.jpg,,,,,,,[],,,,
1366885503564455942,1366885503564455942,2021-03-03 04:27:54 IST,2021-03-03,04:27:54,+0530,44674512,wallstsurvivor,Wall Street Survivor,,Interesting new ETF from VanEck Associates Corp.:  https://t.co/pijhp32UlH,en,[],['https://www.bloomberg.com/news/articles/2021-03-02/a-new-etf-named-buzz-wants-to-ride-the-reddit-trading-revolution'],[],0,0,0,[],[],https://twitter.com/wallstsurvivor/status/1366885503564455942,False,,0,,,,,,,,[],,,,
1366414604830707712,1366414604830707712,2021-03-01 21:16:43 IST,2021-03-01,21:16:43,+0530,44674512,wallstsurvivor,Wall Street Survivor,,"Bonds are neither as mysterious nor confusing as they may appear. As you learn about the world of bond investing, you should make sure you remember the following 10 facts about bonds:  https://t.co/2fHk9CVKaw  https://t.co/Uk2njrCdNI",en,[],['http://bit.ly/2ZYZUOH'],['https://pbs.twimg.com/media/EvZ6uDVWgAIB9Ow.jpg'],0,1,2,[],[],https://twitter.com/wallstsurvivor/status/1366414604830707712,False,,1,https://pbs.twimg.com/media/EvZ6uDVWgAIB9Ow.jpg,,,,,,,[],,,,
1365334643336237057,1365334643336237057,2021-02-26 21:45:20 IST,2021-02-26,21:45:20,+0530,44674512,wallstsurvivor,Wall Street Survivor,,"So you want to learn about the stock market… But where do you start? For stock market beginners, it's important to start broad and then narrow in on details. And we can help you out! Check out this article here, and let's get started:  https://t.co/GULuNeDCWH  https://t.co/qJrbfIUXjN",en,[],['http://bit.ly/2Pacet3'],['https://pbs.twimg.com/media/EvKkl0iWYAErL06.jpg'],0,0,1,[],[],https://twitter.com/wallstsurvivor/status/1365334643336237057,False,,1,https://pbs.twimg.com/media/EvKkl0iWYAErL06.jpg,,,,,,,[],,,,
1364600004724346883,1364600004724346883,2021-02-24 21:06:08 IST,2021-02-24,21:06:08,+0530,44674512,wallstsurvivor,Wall Street Survivor,,Do you want to wake up and be on top of all the news?  Get a summary of the stock markets emailed to you every morning before the markets open by @MorningBrew. Click the link to subscribe! It’s free:  https://t.co/Xj2jZuYPsD  https://t.co/t41Bk9pOdf,en,"[{'screen_name': 'morningbrew', 'name': 'morning brew ☕️', 'id': '3092541736'}]",['http://bit.ly/3aQSymu'],['https://pbs.twimg.com/media/EvAIbb4XYAIWeRO.jpg'],0,0,0,[],[],https://twitter.com/wallstsurvivor/status/1364600004724346883,False,,1,https://pbs.twimg.com/media/EvAIbb4XYAIWeRO.jpg,,,,,,,[],,,,
1362809344266534913,1362809344266534913,2021-02-19 22:30:42 IST,2021-02-19,22:30:42,+0530,44674512,wallstsurvivor,Wall Street Survivor,,"Do you know what bitcoin is?  Today 1 bitcoin is worth about $ 54,000!  https://t.co/9Oq8Lf0zim",en,[],[],['https://pbs.twimg.com/media/EumrtkAXUAEBlCH.jpg'],0,0,1,[],[],https://twitter.com/wallstsurvivor/status/1362809344266534913,False,,1,https://pbs.twimg.com/media/EumrtkAXUAEBlCH.jpg,,,,,,,[],,,,
1362146979896320006,1362146979896320006,2021-02-18 02:38:42 IST,2021-02-18,02:38:42,+0530,44674512,wallstsurvivor,Wall Street Survivor,,Robinhood Review 2021 with new app features and products!? We got it!  Watch our new video here:  https://t.co/apw41k4LdR  https://t.co/p5DOmJb7vC,en,[],['https://bit.ly/37q4AkD'],['https://pbs.twimg.com/media/EudRcQCXMAQ2qoG.png'],0,0,0,[],[],https://twitter.com/wallstsurvivor/status/1362146979896320006,False,,1,https://pbs.twimg.com/media/EudRcQCXMAQ2qoG.png,,,,,,,[],,,,
1361752207075459080,1361752207075459080,2021-02-17 00:30:00 IST,2021-02-17,00:30:00,+0530,44674512,wallstsurvivor,Wall Street Survivor,,The First Stock Everyone Should Buy  https://t.co/hWNVomSyif via @YouTube,en,"[{'screen_name': 'youtube', 'name': 'youtube', 'id': '10228272'}]",['https://youtu.be/keWIdDi7dSg'],[],0,0,0,[],[],https://twitter.com/wallstsurvivor/status/1361752207075459080,False,,0,,,,,,,,[],,,,
1361724243675926534,1361724243675926534,2021-02-16 22:38:53 IST,2021-02-16,22:38:53,+0530,44674512,wallstsurvivor,Wall Street Survivor,,"Today's feeling!😜 Bitcoin surpasses $50,000 for first time as major companies jump into crypto. Read more here:  https://t.co/U2VLZYnGw8  https://t.co/GYpigzUBkd",en,[],['http://cnb.cx/2ZlZNw7'],['https://pbs.twimg.com/media/EuXQ9wSXMAMINyh.jpg'],0,0,1,[],[],https://twitter.com/wallstsurvivor/status/1361724243675926534,False,,1,https://pbs.twimg.com/media/EuXQ9wSXMAMINyh.jpg,,,,,,,[],,,,
1361691809320165377,1361691809320165377,2021-02-16 20:30:01 IST,2021-02-16,20:30:01,+0530,44674512,wallstsurvivor,Wall Street Survivor,,"""Turbulence is the price you pay for flying high."" Keep investing and holding for the longterm!",en,[],[],[],0,0,1,[],[],https://twitter.com/wallstsurvivor/status/1361691809320165377,False,,0,,,,,,,,[],,,,
1361389834791759877,1361389834791759877,2021-02-16 00:30:04 IST,2021-02-16,00:30:04,+0530,44674512,wallstsurvivor,Wall Street Survivor,,Want $500 of free stock?!  https://t.co/NFIJcVCP5M  https://t.co/FdAZIgECz7,en,[],['https://www.wallstreetsurvivor.com/robinhood-free-stock/?fbclid=IwAR0iMkbLpPVqbqpMN-FHEqCoGnO3Us6nr3pih__BL4J24aqRmO2zTQBTryg'],['https://pbs.twimg.com/media/EuSg1DIWYAAmgO6.jpg'],0,0,0,[],[],https://twitter.com/wallstsurvivor/status/1361389834791759877,False,,1,https://pbs.twimg.com/media/EuSg1DIWYAAmgO6.jpg,,,,,,,[],,,,
1361367700749094912,1361367700749094912,2021-02-15 23:02:07 IST,2021-02-15,23:02:07,+0530,44674512,wallstsurvivor,Wall Street Survivor,,"Is Motley Fools' Stock Advisor worth it? In this 2021 Motley Fool review, we take a look at the stock advisor newsletter performance over 2020. Did their stock picks continue to outperform the market?  Watch this video to learn more:  https://t.co/gnxl3huiUy  https://t.co/9OvfPrkI4g",en,[],['https://bit.ly/3pl4Xmz'],['https://pbs.twimg.com/media/EuSMoxVWQAEYN22.png'],0,0,1,[],[],https://twitter.com/wallstsurvivor/status/1361367700749094912,False,,1,https://pbs.twimg.com/media/EuSMoxVWQAEYN22.png,,,,,,,[],,,,
1361329420951240706,1361329420951240706,2021-02-15 20:30:00 IST,2021-02-15,20:30:00,+0530,44674512,wallstsurvivor,Wall Street Survivor,,"Financial Security is the goal.  Start small, a little at a time.  Let compound interest do it's thing.",en,[],[],[],1,0,3,[],[],https://twitter.com/wallstsurvivor/status/1361329420951240706,False,,0,,,,,,,,[],,,,
1361027436704641024,1361027436704641024,2021-02-15 00:30:02 IST,2021-02-15,00:30:02,+0530,44674512,wallstsurvivor,Wall Street Survivor,,You every month until you started taking advantage of  https://t.co/VX4csHly5F for free saving and investment tips and resources.  https://t.co/M2Wz4xIIwg,en,[],['http://WallStreetSurvivor.com'],['https://pbs.twimg.com/media/EuNXPQ6WgAAwMfO.jpg'],0,0,0,[],[],https://twitter.com/wallstsurvivor/status/1361027436704641024,False,,1,https://pbs.twimg.com/media/EuNXPQ6WgAAwMfO.jpg,,,,,,,[],,,,
1360967094058291200,1360967094058291200,2021-02-14 20:30:15 IST,2021-02-14,20:30:15,+0530,44674512,wallstsurvivor,Wall Street Survivor,,One small financial habit can make a huge impact years from now. Get started building your wealth today at  https://t.co/VX4csHly5F ⚡️⠀⠀⠀⠀⠀⠀⠀⠀⠀  https://t.co/EWMkvr2jDi,en,[],['http://WallStreetSurvivor.com'],['https://pbs.twimg.com/media/EuMgTn1WYAEJy_M.jpg'],0,0,0,[],[],https://twitter.com/wallstsurvivor/status/1360967094058291200,False,,1,https://pbs.twimg.com/media/EuMgTn1WYAEJy_M.jpg,,,,,,,[],,,,
1360665053456924677,1360665053456924677,2021-02-14 00:30:03 IST,2021-02-14,00:30:03,+0530,44674512,wallstsurvivor,Wall Street Survivor,,Beyoncé wasn't built in a day and neither is your portfolio 🙌  https://t.co/5vjJovsDhw,en,[],[],['https://pbs.twimg.com/media/EuINpijXAAIhH6d.jpg'],0,0,0,[],[],https://twitter.com/wallstsurvivor/status/1360665053456924677,False,,1,https://pbs.twimg.com/media/EuINpijXAAIhH6d.jpg,,,,,,,[],,,,
1360604684201951233,1360604684201951233,2021-02-13 20:30:10 IST,2021-02-13,20:30:10,+0530,44674512,wallstsurvivor,Wall Street Survivor,,Financial security looks good on you. Learn the ropes at  https://t.co/VX4csHly5F  https://t.co/v1yJbl9m5a,en,[],['http://WallStreetSurvivor.com'],['https://pbs.twimg.com/media/EuHWt5DWQAEnx2v.jpg'],0,0,0,[],[],https://twitter.com/wallstsurvivor/status/1360604684201951233,False,,1,https://pbs.twimg.com/media/EuHWt5DWQAEnx2v.jpg,,,,,,,[],,,,
1360302655923499017,1360302655923499017,2021-02-13 00:30:01 IST,2021-02-13,00:30:01,+0530,44674512,wallstsurvivor,Wall Street Survivor,,"Fact of the Day: Millennials held 25% of their investments in cash, compared to 19% of investors overall. ⠀⠀⠀",en,[],[],[],0,0,0,[],[],https://twitter.com/wallstsurvivor/status/1360302655923499017,False,,0,,,,,,,,[],,,,
1360242257442582530,1360242257442582530,2021-02-12 20:30:00 IST,2021-02-12,20:30:00,+0530,44674512,wallstsurvivor,Wall Street Survivor,,Ready to buy #stocks but don't know where to start? START HERE:  https://t.co/jhHXi3gu9p #stockmarketeducation,en,[],['https://www.wallstreetsurvivor.com/starter-guides/how-to-buy-stocks/'],[],0,0,0,"['stocks', 'stockmarketeducation']",[],https://twitter.com/wallstsurvivor/status/1360242257442582530,False,,0,,,,,,,,[],,,,
1359940294289084423,1359940294289084423,2021-02-12 00:30:07 IST,2021-02-12,00:30:07,+0530,44674512,wallstsurvivor,Wall Street Survivor,,Master expert saving and investing habits that will allow a strong financial future at  https://t.co/VX4csHly5F  #FinancialLiteracy #DebtFree  https://t.co/y0DSY0MFC5,en,[],['http://WallStreetSurvivor.com'],['https://pbs.twimg.com/media/Et96eEiXcAIMUfA.jpg'],0,0,0,"['financialliteracy', 'debtfree']",[],https://twitter.com/wallstsurvivor/status/1359940294289084423,False,,1,https://pbs.twimg.com/media/Et96eEiXcAIMUfA.jpg,,,,,,,[],,,,
1359879885741768706,1359879885741768706,2021-02-11 20:30:04 IST,2021-02-11,20:30:04,+0530,44674512,wallstsurvivor,Wall Street Survivor,,Ready to start creating your Investment Strategy? Make sure you master these topics first 👉 https://t.co/61rc2WxoXh #investing #stockmarketeducation  https://t.co/x8r6GTwqXF,en,[],['http://courses.wallstreetsurvivor.com/is/12-creating-your-investment-strategy/?fbclid=IwAR33m_mmhi2mArEMQaqhNHAIOFvNixTU9FVnyfWiDh42YqhKoiAFfxVFMsM'],['https://pbs.twimg.com/media/Et9DiZfWYAUd-nk.png'],0,0,0,"['investing', 'stockmarketeducation']",[],https://twitter.com/wallstsurvivor/status/1359879885741768706,False,,1,https://pbs.twimg.com/media/Et9DiZfWYAUd-nk.png,,,,,,,[],,,,
1359577886559248388,1359577886559248388,2021-02-11 00:30:02 IST,2021-02-11,00:30:02,+0530,44674512,wallstsurvivor,Wall Street Survivor,,Only 33% of millennials are saving for retirement. Even saving a small portion of your paycheck for retirement goes a long way when you invest it. #retirement #personalfinance  https://t.co/4FgADVDNqD,en,[],[],['https://pbs.twimg.com/media/Et4w4W0XUAYDu9h.jpg'],0,0,0,"['retirement', 'personalfinance']",[],https://twitter.com/wallstsurvivor/status/1359577886559248388,False,,1,https://pbs.twimg.com/media/Et4w4W0XUAYDu9h.jpg,,,,,,,[],,,,
1359517487939932160,1359517487939932160,2021-02-10 20:30:02 IST,2021-02-10,20:30:02,+0530,44674512,wallstsurvivor,Wall Street Survivor,,We've all been there. Want to invest without risking your entire savings?  Start here 👇  https://t.co/6KsP9R6oex  https://t.co/RrisBHsM6F,en,[],['https://blog.wallstreetsurvivor.com/2019/09/19/how-to-invest-in-stocks-on-a-shoestring-budget/?fbclid=IwAR0Zi3JH6s1W-B_fSPndq28f4MDK55CkAJ1ZAWqTBXdqnNwRgeNhqFiIk6I'],['https://pbs.twimg.com/media/Et358m-XEAIWqDS.jpg'],0,0,1,[],[],https://twitter.com/wallstsurvivor/status/1359517487939932160,False,,1,https://pbs.twimg.com/media/Et358m-XEAIWqDS.jpg,,,,,,,[],,,,
1359216995942748163,1359216995942748163,2021-02-10 00:35:59 IST,2021-02-10,00:35:59,+0530,44674512,wallstsurvivor,Wall Street Survivor,,"Wall Street Survivor courses are the very best way to get the hang of how to trade. Courses are a step-by-step learning experience that combines great articles, images, videos, and trading in a fun and rewarding way. Get started:  https://t.co/4DwkWLeA2i  https://t.co/DC4cHQxCjO",en,[],['http://bit.ly/2OhLW7L'],['https://pbs.twimg.com/media/EtzopVfXYAoWOvX.jpg'],0,0,0,[],[],https://twitter.com/wallstsurvivor/status/1359216995942748163,False,,1,https://pbs.twimg.com/media/EtzopVfXYAoWOvX.jpg,,,,,,,[],,,,
1359215497745731586,1359215497745731586,2021-02-10 00:30:02 IST,2021-02-10,00:30:02,+0530,44674512,wallstsurvivor,Wall Street Survivor,,ENTER THE COMPLICATED WORLD OF OIL MAJORS &amp; CLIMATE CHANGES --&gt;  https://t.co/ViTL2Xd7gq  https://t.co/hzmmF6Zl71,en,[],['https://blog.wallstreetsurvivor.com/2019/05/29/enter-the-complicated-world-of-oil-majors-climate-changes/'],['https://pbs.twimg.com/media/EtznSj0XUAASNil.jpg'],0,0,0,[],[],https://twitter.com/wallstsurvivor/status/1359215497745731586,False,,1,https://pbs.twimg.com/media/EtznSj0XUAASNil.jpg,,,,,,,[],,,,
1359155099810078733,1359155099810078733,2021-02-09 20:30:02 IST,2021-02-09,20:30:02,+0530,44674512,wallstsurvivor,Wall Street Survivor,,"Investing can be tough, especially if the timing is off. As an investor getting in on the ground floor can be hugely beneficial, but navigating the waters of startups is no easy feat. LEARN MORE about investing in startups:  https://t.co/r1v2S1grbm #startups #investing #profits  https://t.co/nbhMFWfouW",en,[],['https://blog.samaltman.com/how-to-invest-in-startups'],['https://pbs.twimg.com/media/EtywW6EXIAI5cvb.jpg'],0,0,0,"['startups', 'investing', 'profits']",[],https://twitter.com/wallstsurvivor/status/1359155099810078733,False,,1,https://pbs.twimg.com/media/EtywW6EXIAI5cvb.jpg,,,,,,,[],,,,
1358853105258004483,1358853105258004483,2021-02-09 00:30:01 IST,2021-02-09,00:30:01,+0530,44674512,wallstsurvivor,Wall Street Survivor,,"Financial Security is the goal.  Start small, a little at a time.  Let compound interest do it's thing.",en,[],[],[],0,0,1,[],[],https://twitter.com/wallstsurvivor/status/1358853105258004483,False,,0,,,,,,,,[],,,,
1358824152908587008,1358824152908587008,2021-02-08 22:34:58 IST,2021-02-08,22:34:58,+0530,44674512,wallstsurvivor,Wall Street Survivor,,"Mutual funds are operated by professional money managers, who allocate the fund's assets and attempt to produce capital gains or income for the fund's investors. (source: @Investopedia)  https://t.co/yQMTNIACcc",en,"[{'screen_name': 'investopedia', 'name': 'investopedia', 'id': '21459600'}]",[],['https://pbs.twimg.com/media/EtuDSVyXcAIfN3O.jpg'],0,0,0,[],[],https://twitter.com/wallstsurvivor/status/1358824152908587008,False,,1,https://pbs.twimg.com/media/EtuDSVyXcAIfN3O.jpg,,,,,,,[],,,,
1358792711088836611,1358792711088836611,2021-02-08 20:30:02 IST,2021-02-08,20:30:02,+0530,44674512,wallstsurvivor,Wall Street Survivor,,"Ready to calculate your net worth? Add up your assets (Cash, investments, etc.) and subtract your liabilities (debt) and you have your net worth. #financialplanning  https://t.co/wUsvWqLtMM",en,[],[],['https://pbs.twimg.com/media/EttmxL7WYAMHVrM.jpg'],1,0,2,['financialplanning'],[],https://twitter.com/wallstsurvivor/status/1358792711088836611,False,,1,https://pbs.twimg.com/media/EttmxL7WYAMHVrM.jpg,,,,,,,[],,,,
1358490728217923593,1358490728217923593,2021-02-08 00:30:03 IST,2021-02-08,00:30:03,+0530,44674512,wallstsurvivor,Wall Street Survivor,,Your emergency fund needs to have enough savings to cover your expenses for 3-6 months. Emergency savings makes cash available when financial surprises come your way. #buildwealth #investments  https://t.co/peeAbf31bR,en,[],[],['https://pbs.twimg.com/media/EtpUHEGXIAM0ObP.jpg'],0,0,0,"['buildwealth', 'investments']",[],https://twitter.com/wallstsurvivor/status/1358490728217923593,False,,1,https://pbs.twimg.com/media/EtpUHEGXIAM0ObP.jpg,,,,,,,[],,,,
1358430317820968961,1358430317820968961,2021-02-07 20:30:00 IST,2021-02-07,20:30:00,+0530,44674512,wallstsurvivor,Wall Street Survivor,,TRADING PENNY STOCKS:  Could this #investingstrategy be right for you? Let's dive in 👇,en,[],[],[],0,0,0,['investingstrategy'],[],https://twitter.com/wallstsurvivor/status/1358430317820968961,False,,0,,,,,,,,[],,,,
1358128334836744196,1358128334836744196,2021-02-07 00:30:02 IST,2021-02-07,00:30:02,+0530,44674512,wallstsurvivor,Wall Street Survivor,,"What is your investment purpose? Remembering your ""why"" helps you achieve your goals. #financialplanning  https://t.co/3ZxKkdx55c",en,[],[],['https://pbs.twimg.com/media/EtkKhWJWQAEEkuK.jpg'],0,0,0,['financialplanning'],[],https://twitter.com/wallstsurvivor/status/1358128334836744196,False,,1,https://pbs.twimg.com/media/EtkKhWJWQAEEkuK.jpg,,,,,,,[],,,,
1358067936053846016,1358067936053846016,2021-02-06 20:30:02 IST,2021-02-06,20:30:02,+0530,44674512,wallstsurvivor,Wall Street Survivor,,A Traditional IRA is one of many of your investment options for retirement. Learning the pros and cons will help you determine if this is the best choice for you.#investing #stockmarket  https://t.co/PLOrgpt3Kn,en,[],[],['https://pbs.twimg.com/media/EtjTlptXIAQxzGr.jpg'],0,0,0,"['investing', 'stockmarket']",[],https://twitter.com/wallstsurvivor/status/1358067936053846016,False,,1,https://pbs.twimg.com/media/EtjTlptXIAQxzGr.jpg,,,,,,,[],,,,
